Bus Hound 6.00 capture on Windows Vista (x64). Complements of www.perisoft.net

DMA enabled

  Device - Device ID (followed by the endpoint for USB devices)
            (15) USB Input Device
            (21) HID-compliant mouse
            (35) USB Mass Storage Device
            (36) LZN Product [ROM=0.01]
            (37) Unknown USB Device (Device Descriptor Request Failed)
  Length - Total transfer length
  Phase  - Phase Type
            ATA   ATA task file command      SENSE SCSI sense data
            CMD   SCSI/ATAPI command         SSTS  SCSI request block status
            CTL   USB control transfer       URB   USB request block
            IN    Data in transfer           USTS  USB status
            OUT   Data out transfer          ok    command complete
            RESET bus reset
  Data   - Hex dump of the data transferred
  Descr  - Description of the phase
  Cmd... - Position in the captured data


Device  Length    Phase  Data                                                                                                    Description                       Cmd.Phase.Ofs(rep)
------  --------  -----  ------------------------------------------------------------------------------------------------------  --------------------------------  ------------------
  35.0            CTL    80 06 00 01  00 00 12 00                                                                                GET DESCRIPTOR                           1.1.0(2)     
  35.0        18  IN     12 01 00 02  00 00 00 40  83 04 40 57  00 02 01 02  03 01                                               .......@..@W......                       1.2.0        
  35.0            URB    88 00 08 00  00 00 00 00  68 bd 34 af  f3 7b 00 00  00 00 00 00  00 00 00 00  b0 9c bb 60  0c 84 ff ff  CONTROL TRANSFER                         1.3.0        
  35.0            CTL    80 06 00 02  00 00 09 00                                                                                GET DESCRIPTOR                           2.1.0(2)     
  35.0         9  IN     09 02 20 00  01 01 04 c0  32                                                                            .. .....2                                2.2.0        
  35.0            URB    88 00 08 00  00 00 00 00  68 bd 34 af  f3 7b 00 00  00 00 00 00  00 00 00 00  b0 9c bb 60  0c 84 ff ff  CONTROL TRANSFER                         2.3.0        
  35.0            CTL    80 06 00 02  00 00 20 00                                                                                GET DESCRIPTOR                           3.1.0(2)     
  35.0        32  IN     09 02 20 00  01 01 04 c0  32 09 04 00  00 02 08 06  50 05 07 05  81 02 40 00  00 07 05 01  02 40 00 00  .. .....2.......P.....@......@..         3.2.0        
  35.0            URB    88 00 08 00  00 00 00 00  68 bd 34 af  f3 7b 00 00  00 00 00 00  00 00 00 00  b0 9c bb 60  0c 84 ff ff  CONTROL TRANSFER                         3.3.0        
  35.0            CTL    80 06 00 03  00 00 02 00                                                                                GET DESCRIPTOR                           7.1.0        
  35.0         2  IN     04 03                                                                                                   ..                                       7.2.0        
  35.0            URB    88 00 08 00  00 00 00 00  68 bd 34 af  f3 7b 00 00  00 00 00 00  00 00 00 00  b0 9c bb 60  0c 84 ff ff  CONTROL TRANSFER                         7.3.0        
  35.0            CTL    80 06 00 03  00 00 04 00                                                                                GET DESCRIPTOR                           8.1.0        
  35.0         4  IN     04 03 09 04                                                                                             ....                                     8.2.0        
  35.0            URB    88 00 08 00  00 00 00 00  68 bd 34 af  f3 7b 00 00  00 00 00 00  00 00 00 00  b0 9c bb 60  0c 84 ff ff  CONTROL TRANSFER                         8.3.0        
  35.0            CTL    80 06 03 03  09 04 02 00                                                                                GET DESCRIPTOR                           9.1.0        
  35.0         2  IN     1a 03                                                                                                   ..                                       9.2.0        
  35.0            URB    88 00 08 00  00 00 00 00  68 bd 34 af  f3 7b 00 00  00 00 00 00  00 00 00 00  b0 9c bb 60  0c 84 ff ff  CONTROL TRANSFER                         9.3.0        
  35.0            CTL    80 06 03 03  09 04 1a 00                                                                                GET DESCRIPTOR                          10.1.0        
  35.0        26  IN     1a 03 33 00  30 00 36 00  31 00 33 00  36 00 35 00  36 00 33 00  33 00 33 00  30 00                     ..3.0.6.1.3.6.5.6.3.3.3.0.              10.2.0        
  35.0            URB    88 00 08 00  00 00 00 00  68 bd 34 af  f3 7b 00 00  00 00 00 00  00 00 00 00  b0 9c bb 60  0c 84 ff ff  CONTROL TRANSFER                        10.3.0        
  35.0            CTL    00 09 01 00  00 00 00 00                                                                                SET CONFIG                              11.1.0        
  35.0            URB    70 00 00 00  00 00 00 00  68 bd 34 af  f3 7b 00 00  00 00 00 00  00 00 00 00  80 73 3d 5b  0c 84 ff ff  SELECT CONFIG                           11.2.0        
  35.0            CTL    01 0b 00 00  00 00 00 00                                                                                SET INTERFACE                           12.1.0        
  35.0            URB    68 00 01 00  00 00 00 00  00 00 00 00  00 00 00 00  00 00 00 00  00 00 00 00  40 f5 b9 60  0c 84 ff ff  SELECT INTERFACE                        12.2.0        
  35.0            CTL    a1 fe 00 00  00 00 01 00                                                                                GET MAX LUN                             13.1.0        
  35.0         1  IN     00                                                                                                      .                                       13.2.0        
  35.0            URB    88 00 08 00  00 00 00 00  68 bd 34 af  f3 7b 00 00  00 00 00 00  00 00 00 00  b0 9c bb 60  0c 84 ff ff  CONTROL TRANSFER                        13.3.0        
  35.1        31  OUT    55 53 42 43  e0 f5 89 57  24 00 00 00  80 00 06 12  00 00 00 24  00 00 00 00  00 00 00 00  00 00 00     USBC...W$..........$...........         14.1.0(2)     
  35.1            URB    80 00 09 00  00 00 00 00  68 bd 34 af  f3 7b 00 00  00 00 00 00  00 00 00 00  80 0c bb 5b  0c 84 ff ff  BULK/INT XFER                           14.2.0        
  35.1        36  IN     00 80 02 02  1f 00 00 00  4c 5a 4e 20  20 20 20 20  50 72 6f 64  75 63 74 20  20 20 20 20  20 20 20 20  ........LZN     Product                 15.1.0(2)     
  35.1            URB    80 00 09 00  00 00 00 00  68 bd 34 af  f3 7b 00 00  00 00 00 00  00 00 00 00  80 7c cc 56  0c 84 ff ff  BULK/INT XFER                           15.2.0        
  35.1        13  IN     55 53 42 53  e0 f5 89 57  00 00 00 00  00                                                               USBS...W.....                           16.1.0(2)     
  35.1            URB    80 00 09 00  00 00 00 00  68 bd 34 af  f3 7b 00 00  00 00 00 00  00 00 00 00  80 7c cc 56  0c 84 ff ff  BULK/INT XFER                           16.2.0        
  35.1        31  OUT    55 53 42 43  e0 f5 89 57  fc 00 00 00  80 00 0a 23  00 00 00 00  00 00 00 fc  00 00 00 00  00 00 00     USBC...W.......#...............         20.1.0        
  35.1            URB    80 00 09 00  00 00 00 00  68 bd 34 af  f3 7b 00 00  00 00 00 00  00 00 00 00  80 0c bb 5b  0c 84 ff ff  BULK/INT XFER                           20.2.0        
  35.1        12  IN     00 00 00 08  00 73 7f ff  02 00 02 00                                                                   .....s......                            21.1.0        
  35.1            URB    80 00 09 00  00 00 00 00  68 bd 34 af  f3 7b 00 00  00 00 00 00  00 00 00 00  80 7c cc 56  0c 84 ff ff  BULK/INT XFER                           21.2.0        
  35.1        13  IN     55 53 42 53  e0 f5 89 57  f0 00 00 00  00                                                               USBS...W.....                           22.1.0        
  35.1            URB    80 00 09 00  00 00 00 00  68 bd 34 af  f3 7b 00 00  00 00 00 00  00 00 00 00  80 7c cc 56  0c 84 ff ff  BULK/INT XFER                           22.2.0        
  35.1        31  OUT    55 53 42 43  e0 f5 89 57  ff 00 00 00  80 00 06 12  01 80 00 ff  00 00 00 00  00 00 00 00  00 00 00     USBC...W.......................         23.1.0        
  35.1            URB    80 00 09 00  00 00 00 00  68 bd 34 af  f3 7b 00 00  00 00 00 00  00 00 00 00  80 0c bb 5b  0c 84 ff ff  BULK/INT XFER                           23.2.0        
  35.1         8  IN     00 80 00 08  20 20 20 20                                                                                ....                                    24.1.0        
  35.1            URB    80 00 09 00  00 00 00 00  68 bd 34 af  f3 7b 00 00  00 00 00 00  00 00 00 00  80 7c cc 56  0c 84 ff ff  BULK/INT XFER                           24.2.0        
  35.1        13  IN     55 53 42 53  e0 f5 89 57  f7 00 00 00  00                                                               USBS...W.....                           25.1.0        
  35.1            URB    80 00 09 00  00 00 00 00  68 bd 34 af  f3 7b 00 00  00 00 00 00  00 00 00 00  80 7c cc 56  0c 84 ff ff  BULK/INT XFER                           25.2.0        
  36              CMD    12 00 00 00  24 00                                                                                      INQUIRY                                 26.1.0        
  36          36  IN     00 80 02 02  1f 00 00 00  4c 5a 4e 20  20 20 20 20  50 72 6f 64  75 63 74 20  20 20 20 20  20 20 20 20  ........LZN     Product                 26.2.0        
  36              CMD    25 00 00 00  00 00 00 00  00 00                                                                         READ CAPACITY                           27.1.0        
  35.1        31  OUT    55 53 42 43  20 c9 4e 4c  08 00 00 00  80 00 0a 25  00 00 00 00  00 00 00 00  00 00 00 00  00 00 00     USBC .NL.......%...............         28.1.0        
  35.1            URB    80 00 09 00  00 00 00 00  68 bd 34 af  f3 7b 00 00  00 00 00 00  00 00 00 00  80 0c bb 5b  0c 84 ff ff  BULK/INT XFER                           28.2.0        
  35.1         8  IN     00 73 7f ff  00 00 02 00                                                                                .s......                                29.1.0        
  35.1            URB    80 00 09 00  00 00 00 00  68 bd 34 af  f3 7b 00 00  00 00 00 00  00 00 00 00  80 7c cc 56  0c 84 ff ff  BULK/INT XFER                           29.2.0        
  35.1        13  IN     55 53 42 53  20 c9 4e 4c  00 00 00 00  00                                                               USBS .NL.....                           30.1.0        
  35.1            URB    80 00 09 00  00 00 00 00  68 bd 34 af  f3 7b 00 00  00 00 00 00  00 00 00 00  80 7c cc 56  0c 84 ff ff  BULK/INT XFER                           30.2.0        
  36           8  IN     00 73 7f ff  00 00 02 00                                                                                .s......                                27.2.0        
  36              ATA    00 00 00 4f  c2 a0 ec                                                                                   IDENTIFY                                31.1.0        
  36              SSTS   04                                                                                                      check condition                         31.2.0        
  36              CMD    1a 00 1c 00  c0 00                                                                                      MODE SENSE 1C                           32.1.0        
  35.1        31  OUT    55 53 42 43  50 65 51 52  c0 00 00 00  80 00 06 1a  00 1c 00 c0  00 00 00 00  00 00 00 00  00 00 00     USBCPeQR.......................         33.1.0        
  35.1            URB    80 00 09 00  00 00 00 00  68 bd 34 af  f3 7b 00 00  00 00 00 00  00 00 00 00  80 0c bb 5b  0c 84 ff ff  BULK/INT XFER                           33.2.0        
  35.1        23  IN     22 00 00 00  08 12 00 00  00 00 00 00  00 00 00 00  00 00 00 00  00 00 00                               "......................                 34.1.0        
  35.1            URB    80 00 09 00  00 00 00 00  68 bd 34 af  f3 7b 00 00  00 00 00 00  00 00 00 00  80 7c cc 56  0c 84 ff ff  BULK/INT XFER                           34.2.0        
  35.1        13  IN     55 53 42 53  50 65 51 52  a9 00 00 00  00                                                               USBSPeQR.....                           35.1.0        
  35.1            URB    80 00 09 00  00 00 00 00  68 bd 34 af  f3 7b 00 00  00 00 00 00  00 00 00 00  80 7c cc 56  0c 84 ff ff  BULK/INT XFER                           35.2.0        
  36          23  IN     22 00 00 00  08 12 00 00  00 00 00 00  00 00 00 00  00 00 00 00  00 00 00                               "......................                 32.2.0        
  36              SSTS   12                                                                                                      data overrun                            32.3.0        
  36              CMD    12 01 00 00  ff 00                                                                                      INQUIRY                                 36.1.0        
  36          18  SENSE  70 00 05 00  00 00 00 0a  00 00 00 00  24 00 00 00  00 00                                               invalid cdb                             36.2.0        
  36              CMD    1a 00 08 00  c0 00                                                                                      MODE SENSE 08                           37.1.0        
  35.1        31  OUT    55 53 42 43  e0 f5 89 57  c0 00 00 00  80 00 06 1a  00 08 00 c0  00 00 00 00  00 00 00 00  00 00 00     USBC...W.......................         38.1.0        
  35.1            URB    80 00 09 00  00 00 00 00  68 bd 34 af  f3 7b 00 00  00 00 00 00  00 00 00 00  80 0c bb 5b  0c 84 ff ff  BULK/INT XFER                           38.2.0        
  35.1        23  IN     22 00 00 00  08 12 00 00  00 00 00 00  00 00 00 00  00 00 00 00  00 00 00                               "......................                 39.1.0        
  35.1            URB    80 00 09 00  00 00 00 00  68 bd 34 af  f3 7b 00 00  00 00 00 00  00 00 00 00  80 7c cc 56  0c 84 ff ff  BULK/INT XFER                           39.2.0        
  35.1        13  IN     55 53 42 53  e0 f5 89 57  a9 00 00 00  00                                                               USBS...W.....                           40.1.0        
  35.1            URB    80 00 09 00  00 00 00 00  68 bd 34 af  f3 7b 00 00  00 00 00 00  00 00 00 00  80 7c cc 56  0c 84 ff ff  BULK/INT XFER                           40.2.0        
  36          23  IN     22 00 00 00  08 12 00 00  00 00 00 00  00 00 00 00  00 00 00 00  00 00 00                               "......................                 37.2.0        
  36              SSTS   12                                                                                                      data overrun                            37.3.0        
  36              CMD    25 00 00 00  00 00 00 00  00 00                                                                         READ CAPACITY                           41.1.0        
  35.1        31  OUT    55 53 42 43  10 95 13 57  08 00 00 00  80 00 0a 25  00 00 00 00  00 00 00 00  00 00 00 00  00 00 00     USBC...W.......%...............         42.1.0        
  35.1            URB    80 00 09 00  00 00 00 00  68 bd 34 af  f3 7b 00 00  00 00 00 00  00 00 00 00  80 0c bb 5b  0c 84 ff ff  BULK/INT XFER                           42.2.0        
  35.1         8  IN     00 73 7f ff  00 00 02 00                                                                                .s......                                43.1.0        
  35.1            URB    80 00 09 00  00 00 00 00  68 bd 34 af  f3 7b 00 00  00 00 00 00  00 00 00 00  80 7c cc 56  0c 84 ff ff  BULK/INT XFER                           43.2.0        
  35.1        13  IN     55 53 42 53  10 95 13 57  00 00 00 00  00                                                               USBS...W.....                           44.1.0        
  35.1            URB    80 00 09 00  00 00 00 00  68 bd 34 af  f3 7b 00 00  00 00 00 00  00 00 00 00  80 7c cc 56  0c 84 ff ff  BULK/INT XFER                           44.2.0        
  36           8  IN     00 73 7f ff  00 00 02 00                                                                                .s......                                41.2.0        
  36              CMD    12 00 00 00  24 00                                                                                      INQUIRY                                 45.1.0        
  35.1        31  OUT    55 53 42 43  10 95 13 57  24 00 00 00  80 00 06 12  00 00 00 24  00 00 00 00  00 00 00 00  00 00 00     USBC...W$..........$...........         46.1.0        
  35.1            URB    80 00 09 00  00 00 00 00  68 bd 34 af  f3 7b 00 00  00 00 00 00  00 00 00 00  80 0c bb 5b  0c 84 ff ff  BULK/INT XFER                           46.2.0        
  35.1        36  IN     00 80 02 02  1f 00 00 00  4c 5a 4e 20  20 20 20 20  50 72 6f 64  75 63 74 20  20 20 20 20  20 20 20 20  ........LZN     Product                 47.1.0        
  35.1            URB    80 00 09 00  00 00 00 00  68 bd 34 af  f3 7b 00 00  00 00 00 00  00 00 00 00  80 7c cc 56  0c 84 ff ff  BULK/INT XFER                           47.2.0        
  35.1        13  IN     55 53 42 53  10 95 13 57  00 00 00 00  00                                                               USBS...W.....                           48.1.0        
  35.1            URB    80 00 09 00  00 00 00 00  68 bd 34 af  f3 7b 00 00  00 00 00 00  00 00 00 00  80 7c cc 56  0c 84 ff ff  BULK/INT XFER                           48.2.0        
  36          36  IN     00 80 02 02  1f 00 00 00  4c 5a 4e 20  20 20 20 20  50 72 6f 64  75 63 74 20  20 20 20 20  20 20 20 20  ........LZN     Product                 45.2.0        
  36              CMD    9e 10 00 00  00 00 00 00  00 00 00 00  00 20 00 00                                                      SVC ACTION IN                           49.1.0        
  36          18  SENSE  70 00 05 00  00 00 00 0a  00 00 00 00  20 00 00 00  00 00                                               illegal request                         49.2.0        
  36              CMD    25 00 00 00  00 00 00 00  00 00                                                                         READ CAPACITY                           50.1.0        
  35.1        31  OUT    55 53 42 43  e0 f5 89 57  08 00 00 00  80 00 0a 25  00 00 00 00  00 00 00 00  00 00 00 00  00 00 00     USBC...W.......%...............         51.1.0        
  35.1            URB    80 00 09 00  00 00 00 00  68 bd 34 af  f3 7b 00 00  00 00 00 00  00 00 00 00  80 0c bb 5b  0c 84 ff ff  BULK/INT XFER                           51.2.0        
  35.1         8  IN     00 73 7f ff  00 00 02 00                                                                                .s......                                52.1.0        
  35.1            URB    80 00 09 00  00 00 00 00  68 bd 34 af  f3 7b 00 00  00 00 00 00  00 00 00 00  80 7c cc 56  0c 84 ff ff  BULK/INT XFER                           52.2.0        
  35.1        13  IN     55 53 42 53  e0 f5 89 57  00 00 00 00  00                                                               USBS...W.....                           53.1.0        
  35.1            URB    80 00 09 00  00 00 00 00  68 bd 34 af  f3 7b 00 00  00 00 00 00  00 00 00 00  80 7c cc 56  0c 84 ff ff  BULK/INT XFER                           53.2.0        
  36           8  IN     00 73 7f ff  00 00 02 00                                                                                .s......                                50.2.0        
  36              CMD    25 00 00 00  00 00 00 00  00 00                                                                         READ CAPACITY                           54.1.0(2)     
  35.1        31  OUT    55 53 42 43  20 b9 19 5e  08 00 00 00  80 00 0a 25  00 00 00 00  00 00 00 00  00 00 00 00  00 00 00     USBC ..^.......%...............         55.1.0(2)     
  35.1            URB    80 00 09 00  00 00 00 00  68 bd 34 af  f3 7b 00 00  00 00 00 00  00 00 00 00  80 0c bb 5b  0c 84 ff ff  BULK/INT XFER                           55.2.0        
  35.1         8  IN     00 73 7f ff  00 00 02 00                                                                                .s......                                56.1.0(2)     
  35.1            URB    80 00 09 00  00 00 00 00  68 bd 34 af  f3 7b 00 00  00 00 00 00  00 00 00 00  80 7c cc 56  0c 84 ff ff  BULK/INT XFER                           56.2.0        
  35.1        13  IN     55 53 42 53  20 b9 19 5e  00 00 00 00  00                                                               USBS ..^.....                           57.1.0(2)     
  35.1            URB    80 00 09 00  00 00 00 00  68 bd 34 af  f3 7b 00 00  00 00 00 00  00 00 00 00  80 7c cc 56  0c 84 ff ff  BULK/INT XFER                           57.2.0        
  36           8  IN     00 73 7f ff  00 00 02 00                                                                                .s......                                54.2.0        
  36              CMD    28 00 00 00  00 00 00 00  01 00                                                                         READ                                    62.1.0        
  35.1        31  OUT    55 53 42 43  50 65 51 52  00 02 00 00  80 00 0a 28  00 00 00 00  00 00 00 01  00 00 00 00  00 00 00     USBCPeQR.......(...............         63.1.0        
  35.1            URB    80 00 09 00  00 00 00 00  68 bd 34 af  f3 7b 00 00  00 00 00 00  00 00 00 00  80 0c bb 5b  0c 84 ff ff  BULK/INT XFER                           63.2.0        
  35.1       512  IN     00 00 00 00  00 00 00 00  00 00 00 00  00 00 00 00  00 00 00 00  00 00 00 00  00 00 00 00  00 00 00 00  ................................        64.1.0        
  35.1            URB    80 00 09 00  00 00 00 00  68 bd 34 af  f3 7b 00 00  00 00 00 00  00 00 00 00  80 7c cc 56  0c 84 ff ff  BULK/INT XFER                           64.2.0        
  35.1        13  IN     55 53 42 53  50 65 51 52  00 00 00 00  00                                                               USBSPeQR.....                           65.1.0        
  35.1            URB    80 00 09 00  00 00 00 00  68 bd 34 af  f3 7b 00 00  00 00 00 00  00 00 00 00  80 7c cc 56  0c 84 ff ff  BULK/INT XFER                           65.2.0        
  36         512  IN     00 00 00 00  00 00 00 00  00 00 00 00  00 00 00 00  00 00 00 00  00 00 00 00  00 00 00 00  00 00 00 00  ................................        62.2.0        
  36              CMD    28 00 00 00  00 00 00 00  10 00                                                                         READ                                    66.1.0        
  35.1        31  OUT    55 53 42 43  20 89 4e 5e  00 20 00 00  80 00 0a 28  00 00 00 00  00 00 00 10  00 00 00 00  00 00 00     USBC .N^. .....(...............         67.1.0        
  35.1            URB    80 00 09 00  00 00 00 00  68 bd 34 af  f3 7b 00 00  00 00 00 00  00 00 00 00  80 0c bb 5b  0c 84 ff ff  BULK/INT XFER                           67.2.0        
  36              CMD    25 00 00 00  00 00 00 00  00 00                                                                         READ CAPACITY                           68.1.0        
  35.1            USTS   c0000011                                                                                                xact error                              69.1.0        
  35.1            URB    80 00 09 00  11 00 00 c0  68 bd 34 af  f3 7b 00 00  00 00 00 00  00 00 00 00  80 7c cc 56  0c 84 ff ff  BULK/INT XFER                           69.2.0        
  36              SSTS   4e                                                                                                      bus reset                               66.2.0        
  36              SSTS   16                                                                                                      request flushed                         68.2.0        
  36              CMD    25 00 00 00  00 00 00 00  00 00                                                                         READ CAPACITY                           70.1.0        
  36              CMD    28 00 00 00  00 00 00 00  10 00                                                                         READ                                    71.1.0        
  35              RESET                                                                                                                                                  72.1.0        
  36              CMD    00 00 00 00  00 00                                                                                      TEST UNIT READY                         73.1.0        
  35              ok                                                                                                                                                     72.2.0        
  35.1        31  OUT    55 53 42 43  a0 01 3f 4c  08 00 00 00  80 00 0a 25  00 00 00 00  00 00 00 00  00 00 00 00  00 00 00     USBC..?L.......%...............         74.1.0        
  35.1            URB    80 00 09 00  00 00 00 00  68 bd 34 af  f3 7b 00 00  00 00 00 00  00 00 00 00  80 0c bb 5b  0c 84 ff ff  BULK/INT XFER                           74.2.0        
  35.1         8  IN     00 73 7f ff  00 00 02 00                                                                                .s......                                75.1.0        
  35.1            URB    80 00 09 00  00 00 00 00  68 bd 34 af  f3 7b 00 00  00 00 00 00  00 00 00 00  80 7c cc 56  0c 84 ff ff  BULK/INT XFER                           75.2.0        
  35.1        13  IN     55 53 42 53  a0 01 3f 4c  00 00 00 00  00                                                               USBS..?L.....                           76.1.0        
  35.1            URB    80 00 09 00  00 00 00 00  68 bd 34 af  f3 7b 00 00  00 00 00 00  00 00 00 00  80 7c cc 56  0c 84 ff ff  BULK/INT XFER                           76.2.0        
  36           8  IN     00 73 7f ff  00 00 02 00                                                                                .s......                                70.2.0        
  35.1        31  OUT    55 53 42 43  20 89 4e 5e  00 20 00 00  80 00 0a 28  00 00 00 00  00 00 00 10  00 00 00 00  00 00 00     USBC .N^. .....(...............         77.1.0        
  35.1            URB    80 00 09 00  00 00 00 00  68 bd 34 af  f3 7b 00 00  00 00 00 00  00 00 00 00  80 0c bb 5b  0c 84 ff ff  BULK/INT XFER                           77.2.0        
  36              CMD    25 00 00 00  00 00 00 00  00 00                                                                         READ CAPACITY                           78.1.0        
  35.1            USTS   c0000011                                                                                                xact error                              79.1.0        
  35.1            URB    80 00 09 00  11 00 00 c0  68 bd 34 af  f3 7b 00 00  00 00 00 00  00 00 00 00  80 7c cc 56  0c 84 ff ff  BULK/INT XFER                           79.2.0        
  36              SSTS   4e                                                                                                      bus reset                               71.2.0        
  36              SSTS   16                                                                                                      request flushed                         73.2.0        
  36              SSTS   16                                                                                                      request flushed                         78.2.0        
  36              CMD    25 00 00 00  00 00 00 00  00 00                                                                         READ CAPACITY                           80.1.0        
  36              CMD    28 00 00 00  00 00 00 00  10 00                                                                         READ                                    81.1.0        
  35              RESET                                                                                                                                                  82.1.0        
  36              CMD    00 00 00 00  00 00                                                                                      TEST UNIT READY                         83.1.0        
  35              ok                                                                                                                                                     82.2.0        
  35.1        31  OUT    55 53 42 43  20 b9 19 5e  08 00 00 00  80 00 0a 25  00 00 00 00  00 00 00 00  00 00 00 00  00 00 00     USBC ..^.......%...............         84.1.0        
  35.1            URB    80 00 09 00  00 00 00 00  68 bd 34 af  f3 7b 00 00  00 00 00 00  00 00 00 00  80 0c bb 5b  0c 84 ff ff  BULK/INT XFER                           84.2.0        
  35.1         8  IN     00 73 7f ff  00 00 02 00                                                                                .s......                                85.1.0        
  35.1            URB    80 00 09 00  00 00 00 00  68 bd 34 af  f3 7b 00 00  00 00 00 00  00 00 00 00  80 7c cc 56  0c 84 ff ff  BULK/INT XFER                           85.2.0        
  35.1        13  IN     55 53 42 53  20 b9 19 5e  00 00 00 00  00                                                               USBS ..^.....                           86.1.0        
  35.1            URB    80 00 09 00  00 00 00 00  68 bd 34 af  f3 7b 00 00  00 00 00 00  00 00 00 00  80 7c cc 56  0c 84 ff ff  BULK/INT XFER                           86.2.0        
  36           8  IN     00 73 7f ff  00 00 02 00                                                                                .s......                                80.2.0        
  35.1        31  OUT    55 53 42 43  20 89 4e 5e  00 20 00 00  80 00 0a 28  00 00 00 00  00 00 00 10  00 00 00 00  00 00 00     USBC .N^. .....(...............         87.1.0        
  35.1            URB    80 00 09 00  00 00 00 00  68 bd 34 af  f3 7b 00 00  00 00 00 00  00 00 00 00  80 0c bb 5b  0c 84 ff ff  BULK/INT XFER                           87.2.0        
  36              CMD    25 00 00 00  00 00 00 00  00 00                                                                         READ CAPACITY                           88.1.0        
  35.1            USTS   c0000011                                                                                                xact error                              89.1.0        
  35.1            URB    80 00 09 00  11 00 00 c0  68 bd 34 af  f3 7b 00 00  00 00 00 00  00 00 00 00  80 7c cc 56  0c 84 ff ff  BULK/INT XFER                           89.2.0        
  36              SSTS   4e                                                                                                      bus reset                               81.2.0        
  36              SSTS   16                                                                                                      request flushed                         83.2.0        
  36              SSTS   16                                                                                                      request flushed                         88.2.0        
  36              CMD    25 00 00 00  00 00 00 00  00 00                                                                         READ CAPACITY                           90.1.0        
  36              CMD    28 00 00 00  00 00 00 00  10 00                                                                         READ                                    91.1.0        
  35              RESET                                                                                                                                                  92.1.0        
  35.0            CTL    80 06 00 02  00 00 09 00                                                                                GET DESCRIPTOR                          93.1.0        
  35.0            USTS   c0010000                                                                                                canceled                                93.2.0        
  35.0            URB    88 00 08 00  00 00 01 c0  68 bd 34 af  f3 7b 00 00  00 00 00 00  00 00 00 00  b0 9c bb 60  0c 84 ff ff  CONTROL TRANSFER                        93.3.0        
  35              ok                                                                                                                                                     92.2.0        
  35.1        31  OUT    55 53 42 43  20 b9 19 5e  08 00 00 00  80 00 0a 25  00 00 00 00  00 00 00 00  00 00 00 00  00 00 00     USBC ..^.......%...............         94.1.0        
  35.1            URB    80 00 09 00  00 00 00 00  68 bd 34 af  f3 7b 00 00  00 00 00 00  00 00 00 00  80 0c bb 5b  0c 84 ff ff  BULK/INT XFER                           94.2.0        
  35.1         8  IN     00 73 7f ff  00 00 02 00                                                                                .s......                                95.1.0        
  35.1            URB    80 00 09 00  00 00 00 00  68 bd 34 af  f3 7b 00 00  00 00 00 00  00 00 00 00  80 7c cc 56  0c 84 ff ff  BULK/INT XFER                           95.2.0        
  35.1        13  IN     55 53 42 53  20 b9 19 5e  00 00 00 00  00                                                               USBS ..^.....                           96.1.0        
  35.1            URB    80 00 09 00  00 00 00 00  68 bd 34 af  f3 7b 00 00  00 00 00 00  00 00 00 00  80 7c cc 56  0c 84 ff ff  BULK/INT XFER                           96.2.0        
  36           8  IN     00 73 7f ff  00 00 02 00                                                                                .s......                                90.2.0        
  35.1        31  OUT    55 53 42 43  20 89 4e 5e  00 20 00 00  80 00 0a 28  00 00 00 00  00 00 00 10  00 00 00 00  00 00 00     USBC .N^. .....(...............         97.1.0        
  35.1            URB    80 00 09 00  00 00 00 00  68 bd 34 af  f3 7b 00 00  00 00 00 00  00 00 00 00  80 0c bb 5b  0c 84 ff ff  BULK/INT XFER                           97.2.0        
  36              CMD    28 00 00 00  00 02 00 00  01 00                                                                         READ                                    98.1.0        
  35.1            USTS   c0000011                                                                                                xact error                              99.1.0        
  35.1            URB    80 00 09 00  11 00 00 c0  68 bd 34 af  f3 7b 00 00  00 00 00 00  00 00 00 00  80 7c cc 56  0c 84 ff ff  BULK/INT XFER                           99.2.0        
  36              SSTS   4e                                                                                                      bus reset                               91.2.0        
  36              SSTS   16                                                                                                      request flushed                         98.2.0        
  36              CMD    28 00 00 00  00 02 00 00  01 00                                                                         READ                                   100.1.0        
  36              CMD    28 00 00 00  00 00 00 00  10 00                                                                         READ                                   101.1.0        
  35              RESET                                                                                                                                                 102.1.0        
  36              CMD    00 00 00 00  00 00                                                                                      TEST UNIT READY                        103.1.0        
  35              ok                                                                                                                                                    102.2.0        
  35.1        31  OUT    55 53 42 43  a0 01 3f 4c  00 02 00 00  80 00 0a 28  00 00 00 00  02 00 00 01  00 00 00 00  00 00 00     USBC..?L.......(...............        104.1.0        
  35.1            URB    80 00 09 00  00 00 00 00  68 bd 34 af  f3 7b 00 00  00 00 00 00  00 00 00 00  80 0c bb 5b  0c 84 ff ff  BULK/INT XFER                          104.2.0        
  35.1       512  IN     00 00 00 00  00 00 00 00  00 00 00 00  00 00 00 00  00 00 00 00  00 00 00 00  00 00 00 00  00 00 00 00  ................................       105.1.0        
  35.1            URB    80 00 09 00  00 00 00 00  68 bd 34 af  f3 7b 00 00  00 00 00 00  00 00 00 00  80 7c cc 56  0c 84 ff ff  BULK/INT XFER                          105.2.0        
  35.1        13  IN     55 53 42 53  a0 01 3f 4c  00 00 00 00  00                                                               USBS..?L.....                          106.1.0        
  35.1            URB    80 00 09 00  00 00 00 00  68 bd 34 af  f3 7b 00 00  00 00 00 00  00 00 00 00  80 7c cc 56  0c 84 ff ff  BULK/INT XFER                          106.2.0        
  36         512  IN     00 00 00 00  00 00 00 00  00 00 00 00  00 00 00 00  00 00 00 00  00 00 00 00  00 00 00 00  00 00 00 00  ................................       100.2.0        
  35.1        31  OUT    55 53 42 43  20 89 4e 5e  00 20 00 00  80 00 0a 28  00 00 00 00  00 00 00 10  00 00 00 00  00 00 00     USBC .N^. .....(...............        107.1.0        
  35.1            URB    80 00 09 00  00 00 00 00  68 bd 34 af  f3 7b 00 00  00 00 00 00  00 00 00 00  80 0c bb 5b  0c 84 ff ff  BULK/INT XFER                          107.2.0        
  36              CMD    25 00 00 00  00 00 00 00  00 00                                                                         READ CAPACITY                          108.1.0        
  35.1            USTS   c0000011                                                                                                xact error                             109.1.0        
  35.1            URB    80 00 09 00  11 00 00 c0  68 bd 34 af  f3 7b 00 00  00 00 00 00  00 00 00 00  80 7c cc 56  0c 84 ff ff  BULK/INT XFER                          109.2.0        
  36              SSTS   4e                                                                                                      bus reset                              101.2.0        
  36              SSTS   16                                                                                                      request flushed                        103.2.0        
  36              SSTS   16                                                                                                      request flushed                        108.2.0        
  36              CMD    25 00 00 00  00 00 00 00  00 00                                                                         READ CAPACITY                          110.1.0        
  36              CMD    00 00 00 00  00 00                                                                                      TEST UNIT READY                        111.1.0        
  35              RESET                                                                                                                                                 112.1.0        
  36              CMD    00 00 00 00  00 00                                                                                      TEST UNIT READY                        113.1.0        
  35              ok                                                                                                                                                    112.2.0        
  35.1        31  OUT    55 53 42 43  a0 01 3f 4c  08 00 00 00  80 00 0a 25  00 00 00 00  00 00 00 00  00 00 00 00  00 00 00     USBC..?L.......%...............        114.1.0        
  35.1            URB    80 00 09 00  00 00 00 00  68 bd 34 af  f3 7b 00 00  00 00 00 00  00 00 00 00  80 0c bb 5b  0c 84 ff ff  BULK/INT XFER                          114.2.0        
  35.1         8  IN     00 73 7f ff  00 00 02 00                                                                                .s......                               115.1.0        
  35.1            URB    80 00 09 00  00 00 00 00  68 bd 34 af  f3 7b 00 00  00 00 00 00  00 00 00 00  80 7c cc 56  0c 84 ff ff  BULK/INT XFER                          115.2.0        
  35.1        13  IN     55 53 42 53  a0 01 3f 4c  00 00 00 00  00                                                               USBS..?L.....                          116.1.0        
  35.1            URB    80 00 09 00  00 00 00 00  68 bd 34 af  f3 7b 00 00  00 00 00 00  00 00 00 00  80 7c cc 56  0c 84 ff ff  BULK/INT XFER                          116.2.0        
  36           8  IN     00 73 7f ff  00 00 02 00                                                                                .s......                               110.2.0        
  35.1        31  OUT    55 53 42 43  20 a9 69 5d  00 00 00 00  00 00 06 00  00 00 00 00  00 00 00 00  00 00 00 00  00 00 00     USBC .i].......................        117.1.0        
  35.1            URB    80 00 09 00  00 00 00 00  68 bd 34 af  f3 7b 00 00  00 00 00 00  00 00 00 00  80 0c bb 5b  0c 84 ff ff  BULK/INT XFER                          117.2.0        
  36              CMD    25 00 00 00  00 00 00 00  00 00                                                                         READ CAPACITY                          118.1.0        
  35.1        13  IN     55 53 42 53  20 a9 69 5d  00 00 00 00  00                                                               USBS .i].....                          119.1.0        
  35.1            URB    80 00 09 00  00 00 00 00  68 bd 34 af  f3 7b 00 00  00 00 00 00  00 00 00 00  80 7c cc 56  0c 84 ff ff  BULK/INT XFER                          119.2.0        
  36              ok                                                                                                                                                    111.2.0        
  35.1        31  OUT    55 53 42 43  20 79 c1 4f  00 00 00 00  00 00 06 00  00 00 00 00  00 00 00 00  00 00 00 00  00 00 00     USBC y.O.......................        120.1.0        
  35.1            URB    80 00 09 00  00 00 00 00  68 bd 34 af  f3 7b 00 00  00 00 00 00  00 00 00 00  80 0c bb 5b  0c 84 ff ff  BULK/INT XFER                          120.2.0        
  36              CMD    28 00 00 00  00 00 00 00  10 00                                                                         READ                                   121.1.0        
  35.1        13  IN     55 53 42 53  20 79 c1 4f  00 00 00 00  00                                                               USBS y.O.....                          122.1.0        
  35.1            URB    80 00 09 00  00 00 00 00  68 bd 34 af  f3 7b 00 00  00 00 00 00  00 00 00 00  80 7c cc 56  0c 84 ff ff  BULK/INT XFER                          122.2.0        
  36              ok                                                                                                                                                    113.2.0        
  35.1        31  OUT    55 53 42 43  a0 01 3f 4c  08 00 00 00  80 00 0a 25  00 00 00 00  00 00 00 00  00 00 00 00  00 00 00     USBC..?L.......%...............        123.1.0        
  35.1            URB    80 00 09 00  00 00 00 00  68 bd 34 af  f3 7b 00 00  00 00 00 00  00 00 00 00  80 0c bb 5b  0c 84 ff ff  BULK/INT XFER                          123.2.0        
  35.1         8  IN     00 73 7f ff  00 00 02 00                                                                                .s......                               124.1.0        
  35.1            URB    80 00 09 00  00 00 00 00  68 bd 34 af  f3 7b 00 00  00 00 00 00  00 00 00 00  80 7c cc 56  0c 84 ff ff  BULK/INT XFER                          124.2.0        
  35.1        13  IN     55 53 42 53  a0 01 3f 4c  00 00 00 00  00                                                               USBS..?L.....                          125.1.0        
  35.1            URB    80 00 09 00  00 00 00 00  68 bd 34 af  f3 7b 00 00  00 00 00 00  00 00 00 00  80 7c cc 56  0c 84 ff ff  BULK/INT XFER                          125.2.0        
  36           8  IN     00 73 7f ff  00 00 02 00                                                                                .s......                               118.2.0        
  35.1        31  OUT    55 53 42 43  20 89 4e 5e  00 20 00 00  80 00 0a 28  00 00 00 00  00 00 00 10  00 00 00 00  00 00 00     USBC .N^. .....(...............        126.1.0        
  35.1            URB    80 00 09 00  00 00 00 00  68 bd 34 af  f3 7b 00 00  00 00 00 00  00 00 00 00  80 0c bb 5b  0c 84 ff ff  BULK/INT XFER                          126.2.0        
  36              CMD    28 00 00 00  00 00 00 00  01 00                                                                         READ                                   127.1.0        
  35.1            USTS   c0000011                                                                                                xact error                             128.1.0        
  35.1            URB    80 00 09 00  11 00 00 c0  68 bd 34 af  f3 7b 00 00  00 00 00 00  00 00 00 00  80 7c cc 56  0c 84 ff ff  BULK/INT XFER                          128.2.0        
  36              SSTS   4e                                                                                                      bus reset                              121.2.0        
  36              SSTS   16                                                                                                      request flushed                        127.2.0        
  36              CMD    28 00 00 00  00 00 00 00  01 00                                                                         READ                                   129.1.0        
  36              CMD    28 00 00 00  00 00 00 00  10 00                                                                         READ                                   130.1.0        
  35              RESET                                                                                                                                                 131.1.0        
  36              CMD    00 00 00 00  00 00                                                                                      TEST UNIT READY                        132.1.0        
  35              ok                                                                                                                                                    131.2.0        
  35.1        31  OUT    55 53 42 43  a0 01 3f 4c  00 02 00 00  80 00 0a 28  00 00 00 00  00 00 00 01  00 00 00 00  00 00 00     USBC..?L.......(...............        133.1.0        
  35.1            URB    80 00 09 00  00 00 00 00  68 bd 34 af  f3 7b 00 00  00 00 00 00  00 00 00 00  80 0c bb 5b  0c 84 ff ff  BULK/INT XFER                          133.2.0        
  35.1       512  IN     00 00 00 00  00 00 00 00  00 00 00 00  00 00 00 00  00 00 00 00  00 00 00 00  00 00 00 00  00 00 00 00  ................................       134.1.0        
  35.1            URB    80 00 09 00  00 00 00 00  68 bd 34 af  f3 7b 00 00  00 00 00 00  00 00 00 00  80 7c cc 56  0c 84 ff ff  BULK/INT XFER                          134.2.0        
  35.1        13  IN     55 53 42 53  a0 01 3f 4c  00 00 00 00  00                                                               USBS..?L.....                          135.1.0        
  35.1            URB    80 00 09 00  00 00 00 00  68 bd 34 af  f3 7b 00 00  00 00 00 00  00 00 00 00  80 7c cc 56  0c 84 ff ff  BULK/INT XFER                          135.2.0        
  36         512  IN     00 00 00 00  00 00 00 00  00 00 00 00  00 00 00 00  00 00 00 00  00 00 00 00  00 00 00 00  00 00 00 00  ................................       129.2.0        
  35.1        31  OUT    55 53 42 43  20 89 4e 5e  00 20 00 00  80 00 0a 28  00 00 00 00  00 00 00 10  00 00 00 00  00 00 00     USBC .N^. .....(...............        136.1.0        
  35.1            URB    80 00 09 00  00 00 00 00  68 bd 34 af  f3 7b 00 00  00 00 00 00  00 00 00 00  80 0c bb 5b  0c 84 ff ff  BULK/INT XFER                          136.2.0        
  36              CMD    28 00 00 00  20 00 00 00  01 00                                                                         READ                                   137.1.0        
  35.1            USTS   c0000011                                                                                                xact error                             138.1.0        
  35.1            URB    80 00 09 00  11 00 00 c0  68 bd 34 af  f3 7b 00 00  00 00 00 00  00 00 00 00  80 7c cc 56  0c 84 ff ff  BULK/INT XFER                          138.2.0        
  36              SSTS   4e                                                                                                      bus reset                              130.2.0        
  36              SSTS   16                                                                                                      request flushed                        132.2.0        
  36              SSTS   16                                                                                                      request flushed                        137.2.0        
  36              CMD    28 00 00 00  20 00 00 00  01 00                                                                         READ                                   139.1.0        
  36              CMD    28 00 00 00  00 00 00 00  10 00                                                                         READ                                   140.1.0        
  35              RESET                                                                                                                                                 141.1.0        
  36              CMD    00 00 00 00  00 00                                                                                      TEST UNIT READY                        142.1.0        
  35              ok                                                                                                                                                    141.2.0        
  35.1        31  OUT    55 53 42 43  a0 01 3f 4c  00 02 00 00  80 00 0a 28  00 00 00 20  00 00 00 01  00 00 00 00  00 00 00     USBC..?L.......(... ...........        143.1.0        
  35.1            URB    80 00 09 00  00 00 00 00  68 bd 34 af  f3 7b 00 00  00 00 00 00  00 00 00 00  80 0c bb 5b  0c 84 ff ff  BULK/INT XFER                          143.2.0        
  35.1       512  IN     eb 58 90 4d  53 44 4f 53  35 2e 30 00  02 40 ca 18  02 00 00 00  00 f8 00 00  3f 00 ff 00  00 20 00 00  .X.MSDOS5.0..@..........?.... ..       144.1.0        
  35.1            URB    80 00 09 00  00 00 00 00  68 bd 34 af  f3 7b 00 00  00 00 00 00  00 00 00 00  80 7c cc 56  0c 84 ff ff  BULK/INT XFER                          144.2.0        
  35.1        13  IN     55 53 42 53  a0 01 3f 4c  00 00 00 00  00                                                               USBS..?L.....                          145.1.0        
  35.1            URB    80 00 09 00  00 00 00 00  68 bd 34 af  f3 7b 00 00  00 00 00 00  00 00 00 00  80 7c cc 56  0c 84 ff ff  BULK/INT XFER                          145.2.0        
  36         512  IN     eb 58 90 4d  53 44 4f 53  35 2e 30 00  02 40 ca 18  02 00 00 00  00 f8 00 00  3f 00 ff 00  00 20 00 00  .X.MSDOS5.0..@..........?.... ..       139.2.0        
  35.1        31  OUT    55 53 42 43  20 89 4e 5e  00 20 00 00  80 00 0a 28  00 00 00 00  00 00 00 10  00 00 00 00  00 00 00     USBC .N^. .....(...............        146.1.0        
  35.1            URB    80 00 09 00  00 00 00 00  68 bd 34 af  f3 7b 00 00  00 00 00 00  00 00 00 00  80 0c bb 5b  0c 84 ff ff  BULK/INT XFER                          146.2.0        
  35.1            USTS   c0000011                                                                                                xact error                             147.1.0        
  35.1            URB    80 00 09 00  11 00 00 c0  68 bd 34 af  f3 7b 00 00  00 00 00 00  00 00 00 00  80 7c cc 56  0c 84 ff ff  BULK/INT XFER                          147.2.0        
  36              SSTS   4e                                                                                                      bus reset                              140.2.0        
  36              SSTS   16                                                                                                      request flushed                        142.2.0        
  36              CMD    28 00 00 00  00 00 00 00  10 00                                                                         READ                                   148.1.0        
  35              RESET                                                                                                                                                 149.1.0        
  36              CMD    1a 00 3f 00  c0 00                                                                                      MODE SENSE 3F                          150.1.0        
  36              CMD    00 00 00 00  00 00                                                                                      TEST UNIT READY                        151.1.0(2)     
  35              ok                                                                                                                                                    149.2.0        
  35.1        31  OUT    55 53 42 43  20 89 4e 5e  00 20 00 00  80 00 0a 28  00 00 00 00  00 00 00 10  00 00 00 00  00 00 00     USBC .N^. .....(...............        153.1.0        
  35.1            URB    80 00 09 00  00 00 00 00  68 bd 34 af  f3 7b 00 00  00 00 00 00  00 00 00 00  80 0c bb 5b  0c 84 ff ff  BULK/INT XFER                          153.2.0        
  35.1            USTS   c0000011                                                                                                xact error                             154.1.0        
  35.1            URB    80 00 09 00  11 00 00 c0  68 bd 34 af  f3 7b 00 00  00 00 00 00  00 00 00 00  80 7c cc 56  0c 84 ff ff  BULK/INT XFER                          154.2.0        
  36              SSTS   4e                                                                                                      bus reset                              148.2.0        
  35              RESET                                                                                                                                                 155.1.0        
  36              SSTS   16                                                                                                      request flushed                        150.2.0        
  36              SSTS   16                                                                                                      request flushed                        151.2.0        
  36              SSTS   16                                                                                                      request flushed                        152.2.0        
  36              CMD    1a 00 3f 00  c0 00                                                                                      MODE SENSE 3F                          156.1.0        
  36              CMD    28 00 00 00  00 00 00 00  10 00                                                                         READ                                   157.1.0        
  36              CMD    00 00 00 00  00 00                                                                                      TEST UNIT READY                        158.1.0        
  35              ok                                                                                                                                                    155.2.0        
  35.1        31  OUT    55 53 42 43  20 b9 19 5e  c0 00 00 00  80 00 06 1a  00 3f 00 c0  00 00 00 00  00 00 00 00  00 00 00     USBC ..^.........?.............        159.1.0        
  35.1            URB    80 00 09 00  00 00 00 00  68 bd 34 af  f3 7b 00 00  00 00 00 00  00 00 00 00  80 0c bb 5b  0c 84 ff ff  BULK/INT XFER                          159.2.0        
  35.1        23  IN     22 00 00 00  08 12 00 00  00 00 00 00  00 00 00 00  00 00 00 00  00 00 00                               "......................                160.1.0        
  35.1            URB    80 00 09 00  00 00 00 00  68 bd 34 af  f3 7b 00 00  00 00 00 00  00 00 00 00  80 7c cc 56  0c 84 ff ff  BULK/INT XFER                          160.2.0        
  35.1        13  IN     55 53 42 53  20 b9 19 5e  a9 00 00 00  00                                                               USBS ..^.....                          161.1.0        
  35.1            URB    80 00 09 00  00 00 00 00  68 bd 34 af  f3 7b 00 00  00 00 00 00  00 00 00 00  80 7c cc 56  0c 84 ff ff  BULK/INT XFER                          161.2.0        
  36          23  IN     22 00 00 00  08 12 00 00  00 00 00 00  00 00 00 00  00 00 00 00  00 00 00                               "......................                156.2.0        
  36              SSTS   12                                                                                                      data overrun                           156.3.0        
  36              CMD    00 00 00 00  00 00                                                                                      TEST UNIT READY                        162.1.0        
  35.1        31  OUT    55 53 42 43  20 89 4e 5e  00 20 00 00  80 00 0a 28  00 00 00 00  00 00 00 10  00 00 00 00  00 00 00     USBC .N^. .....(...............        163.1.0        
  35.1            URB    80 00 09 00  00 00 00 00  68 bd 34 af  f3 7b 00 00  00 00 00 00  00 00 00 00  80 0c bb 5b  0c 84 ff ff  BULK/INT XFER                          163.2.0        
  35.1            USTS   c0000011                                                                                                xact error                             164.1.0        
  35.1            URB    80 00 09 00  11 00 00 c0  68 bd 34 af  f3 7b 00 00  00 00 00 00  00 00 00 00  80 7c cc 56  0c 84 ff ff  BULK/INT XFER                          164.2.0        
  36              SSTS   4e                                                                                                      bus reset                              157.2.0        
  36              SSTS   16                                                                                                      request flushed                        158.2.0        
  36              SSTS   16                                                                                                      request flushed                        162.2.0        
  35              RESET                                                                                                                                                 165.1.0        
  36              CMD    25 00 00 00  00 00 00 00  00 00                                                                         READ CAPACITY                          166.1.0        
  36              CMD    00 00 00 00  00 00                                                                                      TEST UNIT READY                        167.1.0(3)     
  35              ok                                                                                                                                                    165.2.0        
  35.1        31  OUT    55 53 42 43  a0 01 3f 4c  08 00 00 00  80 00 0a 25  00 00 00 00  00 00 00 00  00 00 00 00  00 00 00     USBC..?L.......%...............        170.1.0        
  35.1            URB    80 00 09 00  00 00 00 00  68 bd 34 af  f3 7b 00 00  00 00 00 00  00 00 00 00  80 0c bb 5b  0c 84 ff ff  BULK/INT XFER                          170.2.0        
  35.1         8  IN     00 73 7f ff  00 00 02 00                                                                                .s......                               171.1.0        
  35.1            URB    80 00 09 00  00 00 00 00  68 bd 34 af  f3 7b 00 00  00 00 00 00  00 00 00 00  80 7c cc 56  0c 84 ff ff  BULK/INT XFER                          171.2.0        
  35.1        13  IN     55 53 42 53  a0 01 3f 4c  00 00 00 00  00                                                               USBS..?L.....                          172.1.0        
  35.1            URB    80 00 09 00  00 00 00 00  68 bd 34 af  f3 7b 00 00  00 00 00 00  00 00 00 00  80 7c cc 56  0c 84 ff ff  BULK/INT XFER                          172.2.0        
  36           8  IN     00 73 7f ff  00 00 02 00                                                                                .s......                               166.2.0        
  36              CMD    25 00 00 00  00 00 00 00  00 00                                                                         READ CAPACITY                          173.1.0        
  35.1        31  OUT    55 53 42 43  20 79 c1 4f  00 00 00 00  00 00 06 00  00 00 00 00  00 00 00 00  00 00 00 00  00 00 00     USBC y.O.......................        174.1.0        
  35.1            URB    80 00 09 00  00 00 00 00  68 bd 34 af  f3 7b 00 00  00 00 00 00  00 00 00 00  80 0c bb 5b  0c 84 ff ff  BULK/INT XFER                          174.2.0        
  35.1        13  IN     55 53 42 53  20 79 c1 4f  00 00 00 00  00                                                               USBS y.O.....                          175.1.0        
  35.1            URB    80 00 09 00  00 00 00 00  68 bd 34 af  f3 7b 00 00  00 00 00 00  00 00 00 00  80 7c cc 56  0c 84 ff ff  BULK/INT XFER                          175.2.0        
  36              ok                                                                                                                                                    167.2.0        
  35.1        31  OUT    55 53 42 43  60 98 74 56  00 00 00 00  00 00 06 00  00 00 00 00  00 00 00 00  00 00 00 00  00 00 00     USBC`.tV.......................        176.1.0        
  35.1            URB    80 00 09 00  00 00 00 00  68 bd 34 af  f3 7b 00 00  00 00 00 00  00 00 00 00  80 0c bb 5b  0c 84 ff ff  BULK/INT XFER                          176.2.0        
  35.1        13  IN     55 53 42 53  60 98 74 56  00 00 00 00  00                                                               USBS`.tV.....                          177.1.0        
  35.1            URB    80 00 09 00  00 00 00 00  68 bd 34 af  f3 7b 00 00  00 00 00 00  00 00 00 00  80 7c cc 56  0c 84 ff ff  BULK/INT XFER                          177.2.0        
  36              ok                                                                                                                                                    168.2.0        
  35.1        31  OUT    55 53 42 43  20 a9 69 5d  00 00 00 00  00 00 06 00  00 00 00 00  00 00 00 00  00 00 00 00  00 00 00     USBC .i].......................        178.1.0        
  35.1            URB    80 00 09 00  00 00 00 00  68 bd 34 af  f3 7b 00 00  00 00 00 00  00 00 00 00  80 0c bb 5b  0c 84 ff ff  BULK/INT XFER                          178.2.0        
  35.1        13  IN     55 53 42 53  20 a9 69 5d  00 00 00 00  00                                                               USBS .i].....                          179.1.0        
  35.1            URB    80 00 09 00  00 00 00 00  68 bd 34 af  f3 7b 00 00  00 00 00 00  00 00 00 00  80 7c cc 56  0c 84 ff ff  BULK/INT XFER                          179.2.0        
  36              ok                                                                                                                                                    169.2.0        
  36              CMD    25 00 00 00  00 00 00 00  00 00                                                                         READ CAPACITY                          180.1.0        
  35.1        31  OUT    55 53 42 43  a0 01 3f 4c  08 00 00 00  80 00 0a 25  00 00 00 00  00 00 00 00  00 00 00 00  00 00 00     USBC..?L.......%...............        181.1.0        
  35.1            URB    80 00 09 00  00 00 00 00  68 bd 34 af  f3 7b 00 00  00 00 00 00  00 00 00 00  80 0c bb 5b  0c 84 ff ff  BULK/INT XFER                          181.2.0        
  35.1         8  IN     00 73 7f ff  00 00 02 00                                                                                .s......                               182.1.0        
  35.1            URB    80 00 09 00  00 00 00 00  68 bd 34 af  f3 7b 00 00  00 00 00 00  00 00 00 00  80 7c cc 56  0c 84 ff ff  BULK/INT XFER                          182.2.0        
  35.1        13  IN     55 53 42 53  a0 01 3f 4c  00 00 00 00  00                                                               USBS..?L.....                          183.1.0        
  35.1            URB    80 00 09 00  00 00 00 00  68 bd 34 af  f3 7b 00 00  00 00 00 00  00 00 00 00  80 7c cc 56  0c 84 ff ff  BULK/INT XFER                          183.2.0        
  36           8  IN     00 73 7f ff  00 00 02 00                                                                                .s......                               173.2.0        
  35.1        31  OUT    55 53 42 43  20 b9 19 5e  08 00 00 00  80 00 0a 25  00 00 00 00  00 00 00 00  00 00 00 00  00 00 00     USBC ..^.......%...............        184.1.0        
  35.1            URB    80 00 09 00  00 00 00 00  68 bd 34 af  f3 7b 00 00  00 00 00 00  00 00 00 00  80 0c bb 5b  0c 84 ff ff  BULK/INT XFER                          184.2.0        
  35.1         8  IN     00 73 7f ff  00 00 02 00                                                                                .s......                               185.1.0        
  35.1            URB    80 00 09 00  00 00 00 00  68 bd 34 af  f3 7b 00 00  00 00 00 00  00 00 00 00  80 7c cc 56  0c 84 ff ff  BULK/INT XFER                          185.2.0        
  35.1        13  IN     55 53 42 53  20 b9 19 5e  00 00 00 00  00                                                               USBS ..^.....                          186.1.0        
  35.1            URB    80 00 09 00  00 00 00 00  68 bd 34 af  f3 7b 00 00  00 00 00 00  00 00 00 00  80 7c cc 56  0c 84 ff ff  BULK/INT XFER                          186.2.0        
  36           8  IN     00 73 7f ff  00 00 02 00                                                                                .s......                               180.2.0        
  36              CMD    25 00 00 00  00 00 00 00  00 00                                                                         READ CAPACITY                          187.1.0        
  35.1        31  OUT    55 53 42 43  20 b9 19 5e  08 00 00 00  80 00 0a 25  00 00 00 00  00 00 00 00  00 00 00 00  00 00 00     USBC ..^.......%...............        188.1.0        
  35.1            URB    80 00 09 00  00 00 00 00  68 bd 34 af  f3 7b 00 00  00 00 00 00  00 00 00 00  80 0c bb 5b  0c 84 ff ff  BULK/INT XFER                          188.2.0        
  35.1         8  IN     00 73 7f ff  00 00 02 00                                                                                .s......                               189.1.0        
  35.1            URB    80 00 09 00  00 00 00 00  68 bd 34 af  f3 7b 00 00  00 00 00 00  00 00 00 00  80 7c cc 56  0c 84 ff ff  BULK/INT XFER                          189.2.0        
  35.1        13  IN     55 53 42 53  20 b9 19 5e  00 00 00 00  00                                                               USBS ..^.....                          190.1.0        
  35.1            URB    80 00 09 00  00 00 00 00  68 bd 34 af  f3 7b 00 00  00 00 00 00  00 00 00 00  80 7c cc 56  0c 84 ff ff  BULK/INT XFER                          190.2.0        
  36           8  IN     00 73 7f ff  00 00 02 00                                                                                .s......                               187.2.0        
  36              CMD    28 00 00 00  00 00 00 00  01 00                                                                         READ                                   191.1.0        
  35.1        31  OUT    55 53 42 43  20 b9 19 5e  00 02 00 00  80 00 0a 28  00 00 00 00  00 00 00 01  00 00 00 00  00 00 00     USBC ..^.......(...............        192.1.0        
  35.1            URB    80 00 09 00  00 00 00 00  68 bd 34 af  f3 7b 00 00  00 00 00 00  00 00 00 00  80 0c bb 5b  0c 84 ff ff  BULK/INT XFER                          192.2.0        
  35.1       512  IN     00 00 00 00  00 00 00 00  00 00 00 00  00 00 00 00  00 00 00 00  00 00 00 00  00 00 00 00  00 00 00 00  ................................       193.1.0        
  35.1            URB    80 00 09 00  00 00 00 00  68 bd 34 af  f3 7b 00 00  00 00 00 00  00 00 00 00  80 7c cc 56  0c 84 ff ff  BULK/INT XFER                          193.2.0        
  35.1        13  IN     55 53 42 53  20 b9 19 5e  00 00 00 00  00                                                               USBS ..^.....                          194.1.0        
  35.1            URB    80 00 09 00  00 00 00 00  68 bd 34 af  f3 7b 00 00  00 00 00 00  00 00 00 00  80 7c cc 56  0c 84 ff ff  BULK/INT XFER                          194.2.0        
  36         512  IN     00 00 00 00  00 00 00 00  00 00 00 00  00 00 00 00  00 00 00 00  00 00 00 00  00 00 00 00  00 00 00 00  ................................       191.2.0        
  36              CMD    25 00 00 00  00 00 00 00  00 00                                                                         READ CAPACITY                          195.1.0(2)     
  35.1        31  OUT    55 53 42 43  a0 01 3f 4c  08 00 00 00  80 00 0a 25  00 00 00 00  00 00 00 00  00 00 00 00  00 00 00     USBC..?L.......%...............        196.1.0(2)     
  35.1            URB    80 00 09 00  00 00 00 00  68 bd 34 af  f3 7b 00 00  00 00 00 00  00 00 00 00  80 0c bb 5b  0c 84 ff ff  BULK/INT XFER                          196.2.0        
  35.1         8  IN     00 73 7f ff  00 00 02 00                                                                                .s......                               197.1.0(2)     
  35.1            URB    80 00 09 00  00 00 00 00  68 bd 34 af  f3 7b 00 00  00 00 00 00  00 00 00 00  80 7c cc 56  0c 84 ff ff  BULK/INT XFER                          197.2.0        
  35.1        13  IN     55 53 42 53  a0 01 3f 4c  00 00 00 00  00                                                               USBS..?L.....                          198.1.0(2)     
  35.1            URB    80 00 09 00  00 00 00 00  68 bd 34 af  f3 7b 00 00  00 00 00 00  00 00 00 00  80 7c cc 56  0c 84 ff ff  BULK/INT XFER                          198.2.0        
  36           8  IN     00 73 7f ff  00 00 02 00                                                                                .s......                               195.2.0        
  36              CMD    28 00 00 00  00 00 00 00  01 00                                                                         READ                                   203.1.0        
  35.1        31  OUT    55 53 42 43  a0 01 3f 4c  00 02 00 00  80 00 0a 28  00 00 00 00  00 00 00 01  00 00 00 00  00 00 00     USBC..?L.......(...............        204.1.0        
  35.1            URB    80 00 09 00  00 00 00 00  68 bd 34 af  f3 7b 00 00  00 00 00 00  00 00 00 00  80 0c bb 5b  0c 84 ff ff  BULK/INT XFER                          204.2.0        
  35.1            USTS   c0000011                                                                                                xact error                             205.1.0        
  35.1            URB    80 00 09 00  11 00 00 c0  68 bd 34 af  f3 7b 00 00  00 00 00 00  00 00 00 00  80 7c cc 56  0c 84 ff ff  BULK/INT XFER                          205.2.0        
  36              SSTS   4e                                                                                                      bus reset                              203.2.0        
  36              CMD    28 00 00 00  00 00 00 00  01 00                                                                         READ                                   206.1.0        
  35              RESET                                                                                                                                                 207.1.0        
