Bus Hound 6.00 capture on Windows Vista (x64). Complements of www.perisoft.net

DMA disabled

  Device - Device ID (followed by the endpoint for USB devices)
            (15) USB Input Device
            (21) HID-compliant mouse
            (35) USB Mass Storage Device
            (36) LZN Product [ROM=0.01]
            (37) Unknown USB Device (Device Descriptor Request Failed)
  Length - Total transfer length
  Phase  - Phase Type
            ATA   ATA task file command      SENSE SCSI sense data
            CMD   SCSI/ATAPI command         SSTS  SCSI request block status
            CTL   USB control transfer       URB   USB request block
            IN    Data in transfer           ok    command complete
            OUT   Data out transfer
  Data   - Hex dump of the data transferred
  Descr  - Description of the phase
  Cmd... - Position in the captured data


Device  Length    Phase  Data                                                                                                    Description                       Cmd.Phase.Ofs(rep)
------  --------  -----  ------------------------------------------------------------------------------------------------------  --------------------------------  ------------------
  35.0            CTL    80 06 00 01  00 00 12 00                                                                                GET DESCRIPTOR                           1.1.0(2)     
  35.0        18  IN     12 01 00 02  00 00 00 40  83 04 40 57  00 02 01 02  03 01                                               .......@..@W......                       1.2.0        
  35.0            URB    88 00 08 00  00 00 00 00  78 d8 5d b2  f3 7b 00 00  00 00 00 00  00 00 00 00  80 0c bb 5b  0c 84 ff ff  CONTROL TRANSFER                         1.3.0        
  35.0            CTL    80 06 00 02  00 00 09 00                                                                                GET DESCRIPTOR                           2.1.0(2)     
  35.0         9  IN     09 02 20 00  01 01 04 c0  32                                                                            .. .....2                                2.2.0        
  35.0            URB    88 00 08 00  00 00 00 00  78 d8 5d b2  f3 7b 00 00  00 00 00 00  00 00 00 00  80 0c bb 5b  0c 84 ff ff  CONTROL TRANSFER                         2.3.0        
  35.0            CTL    80 06 00 02  00 00 20 00                                                                                GET DESCRIPTOR                           3.1.0(2)     
  35.0        32  IN     09 02 20 00  01 01 04 c0  32 09 04 00  00 02 08 06  50 05 07 05  81 02 40 00  00 07 05 01  02 40 00 00  .. .....2.......P.....@......@..         3.2.0        
  35.0            URB    88 00 08 00  00 00 00 00  78 d8 5d b2  f3 7b 00 00  00 00 00 00  00 00 00 00  80 0c bb 5b  0c 84 ff ff  CONTROL TRANSFER                         3.3.0        
  35.0            CTL    80 06 00 03  00 00 02 00                                                                                GET DESCRIPTOR                           7.1.0        
  35.0         2  IN     04 03                                                                                                   ..                                       7.2.0        
  35.0            URB    88 00 08 00  00 00 00 00  78 d8 5d b2  f3 7b 00 00  00 00 00 00  00 00 00 00  80 0c bb 5b  0c 84 ff ff  CONTROL TRANSFER                         7.3.0        
  35.0            CTL    80 06 00 03  00 00 04 00                                                                                GET DESCRIPTOR                           8.1.0        
  35.0         4  IN     04 03 09 04                                                                                             ....                                     8.2.0        
  35.0            URB    88 00 08 00  00 00 00 00  78 d8 5d b2  f3 7b 00 00  00 00 00 00  00 00 00 00  80 0c bb 5b  0c 84 ff ff  CONTROL TRANSFER                         8.3.0        
  35.0            CTL    80 06 03 03  09 04 02 00                                                                                GET DESCRIPTOR                           9.1.0        
  35.0         2  IN     1a 03                                                                                                   ..                                       9.2.0        
  35.0            URB    88 00 08 00  00 00 00 00  78 d8 5d b2  f3 7b 00 00  00 00 00 00  00 00 00 00  80 0c bb 5b  0c 84 ff ff  CONTROL TRANSFER                         9.3.0        
  35.0            CTL    80 06 03 03  09 04 1a 00                                                                                GET DESCRIPTOR                          10.1.0        
  35.0        26  IN     1a 03 33 00  30 00 36 00  31 00 33 00  36 00 35 00  36 00 33 00  33 00 33 00  30 00                     ..3.0.6.1.3.6.5.6.3.3.3.0.              10.2.0        
  35.0            URB    88 00 08 00  00 00 00 00  78 d8 5d b2  f3 7b 00 00  00 00 00 00  00 00 00 00  80 0c bb 5b  0c 84 ff ff  CONTROL TRANSFER                        10.3.0        
  35.0            CTL    00 09 01 00  00 00 00 00                                                                                SET CONFIG                              11.1.0        
  35.0            URB    70 00 00 00  00 00 00 00  78 d8 5d b2  f3 7b 00 00  00 00 00 00  00 00 00 00  e0 89 2f 5c  0c 84 ff ff  SELECT CONFIG                           11.2.0        
  35.0            CTL    01 0b 00 00  00 00 00 00                                                                                SET INTERFACE                           12.1.0        
  35.0            URB    68 00 01 00  00 00 00 00  00 00 00 00  00 00 00 00  00 00 00 00  00 00 00 00  80 53 34 5f  0c 84 ff ff  SELECT INTERFACE                        12.2.0        
  35.0            CTL    a1 fe 00 00  00 00 01 00                                                                                GET MAX LUN                             13.1.0        
  35.0         1  IN     00                                                                                                      .                                       13.2.0        
  35.0            URB    88 00 08 00  00 00 00 00  78 d8 5d b2  f3 7b 00 00  00 00 00 00  00 00 00 00  80 0c bb 5b  0c 84 ff ff  CONTROL TRANSFER                        13.3.0        
  35.1        31  OUT    55 53 42 43  70 95 a0 5d  24 00 00 00  80 00 06 12  00 00 00 24  00 00 00 00  00 00 00 00  00 00 00     USBCp..]$..........$...........         14.1.0(2)     
  35.1            URB    80 00 09 00  00 00 00 00  78 d8 5d b2  f3 7b 00 00  00 00 00 00  00 00 00 00  f0 49 a6 56  0c 84 ff ff  BULK/INT XFER                           14.2.0        
  35.1        36  IN     00 80 02 02  1f 00 00 00  4c 5a 4e 20  20 20 20 20  50 72 6f 64  75 63 74 20  20 20 20 20  20 20 20 20  ........LZN     Product                 15.1.0(2)     
  35.1            URB    80 00 09 00  00 00 00 00  78 d8 5d b2  f3 7b 00 00  00 00 00 00  00 00 00 00  80 ac 52 57  0c 84 ff ff  BULK/INT XFER                           15.2.0        
  35.1        13  IN     55 53 42 53  70 95 a0 5d  00 00 00 00  00                                                               USBSp..].....                           16.1.0(2)     
  35.1            URB    80 00 09 00  00 00 00 00  78 d8 5d b2  f3 7b 00 00  00 00 00 00  00 00 00 00  80 ac 52 57  0c 84 ff ff  BULK/INT XFER                           16.2.0        
  35.1        31  OUT    55 53 42 43  70 95 a0 5d  fc 00 00 00  80 00 0a 23  00 00 00 00  00 00 00 fc  00 00 00 00  00 00 00     USBCp..].......#...............         20.1.0        
  35.1            URB    80 00 09 00  00 00 00 00  78 d8 5d b2  f3 7b 00 00  00 00 00 00  00 00 00 00  f0 49 a6 56  0c 84 ff ff  BULK/INT XFER                           20.2.0        
  35.1        12  IN     00 00 00 08  00 73 7f ff  02 00 02 00                                                                   .....s......                            21.1.0        
  35.1            URB    80 00 09 00  00 00 00 00  78 d8 5d b2  f3 7b 00 00  00 00 00 00  00 00 00 00  80 ac 52 57  0c 84 ff ff  BULK/INT XFER                           21.2.0        
  35.1        13  IN     55 53 42 53  70 95 a0 5d  f0 00 00 00  00                                                               USBSp..].....                           22.1.0        
  35.1            URB    80 00 09 00  00 00 00 00  78 d8 5d b2  f3 7b 00 00  00 00 00 00  00 00 00 00  80 ac 52 57  0c 84 ff ff  BULK/INT XFER                           22.2.0        
  35.1        31  OUT    55 53 42 43  70 95 a0 5d  ff 00 00 00  80 00 06 12  01 80 00 ff  00 00 00 00  00 00 00 00  00 00 00     USBCp..].......................         23.1.0        
  35.1            URB    80 00 09 00  00 00 00 00  78 d8 5d b2  f3 7b 00 00  00 00 00 00  00 00 00 00  f0 49 a6 56  0c 84 ff ff  BULK/INT XFER                           23.2.0        
  35.1         8  IN     00 80 00 08  20 20 20 20                                                                                ....                                    24.1.0        
  35.1            URB    80 00 09 00  00 00 00 00  78 d8 5d b2  f3 7b 00 00  00 00 00 00  00 00 00 00  80 ac 52 57  0c 84 ff ff  BULK/INT XFER                           24.2.0        
  35.1        13  IN     55 53 42 53  70 95 a0 5d  f7 00 00 00  00                                                               USBSp..].....                           25.1.0        
  35.1            URB    80 00 09 00  00 00 00 00  78 d8 5d b2  f3 7b 00 00  00 00 00 00  00 00 00 00  80 ac 52 57  0c 84 ff ff  BULK/INT XFER                           25.2.0        
  36              CMD    12 00 00 00  24 00                                                                                      INQUIRY                                 26.1.0        
  36          36  IN     00 80 02 02  1f 00 00 00  4c 5a 4e 20  20 20 20 20  50 72 6f 64  75 63 74 20  20 20 20 20  20 20 20 20  ........LZN     Product                 26.2.0        
  36              CMD    25 00 00 00  00 00 00 00  00 00                                                                         READ CAPACITY                           27.1.0        
  35.1        31  OUT    55 53 42 43  e0 45 0f 57  08 00 00 00  80 00 0a 25  00 00 00 00  00 00 00 00  00 00 00 00  00 00 00     USBC.E.W.......%...............         28.1.0        
  35.1            URB    80 00 09 00  00 00 00 00  78 d8 5d b2  f3 7b 00 00  00 00 00 00  00 00 00 00  f0 49 a6 56  0c 84 ff ff  BULK/INT XFER                           28.2.0        
  35.1         8  IN     00 73 7f ff  00 00 02 00                                                                                .s......                                29.1.0        
  35.1            URB    80 00 09 00  00 00 00 00  78 d8 5d b2  f3 7b 00 00  00 00 00 00  00 00 00 00  80 ac 52 57  0c 84 ff ff  BULK/INT XFER                           29.2.0        
  35.1        13  IN     55 53 42 53  e0 45 0f 57  00 00 00 00  00                                                               USBS.E.W.....                           30.1.0        
  35.1            URB    80 00 09 00  00 00 00 00  78 d8 5d b2  f3 7b 00 00  00 00 00 00  00 00 00 00  80 ac 52 57  0c 84 ff ff  BULK/INT XFER                           30.2.0        
  36           8  IN     00 73 7f ff  00 00 02 00                                                                                .s......                                27.2.0        
  36              ATA    00 00 00 4f  c2 a0 ec                                                                                   IDENTIFY                                31.1.0        
  36              CMD    12 01 00 00  ff 00                                                                                      INQUIRY                                 32.1.0        
  36              SSTS   04                                                                                                      check condition                         31.2.0        
  36          18  SENSE  70 00 05 00  00 00 00 0a  00 00 00 00  24 00 00 00  00 00                                               invalid cdb                             32.2.0        
  36              CMD    1a 00 1c 00  c0 00                                                                                      MODE SENSE 1C                           33.1.0        
  35.1        31  OUT    55 53 42 43  50 60 84 4f  c0 00 00 00  80 00 06 1a  00 1c 00 c0  00 00 00 00  00 00 00 00  00 00 00     USBCP`.O.......................         34.1.0        
  35.1            URB    80 00 09 00  00 00 00 00  78 d8 5d b2  f3 7b 00 00  00 00 00 00  00 00 00 00  f0 49 a6 56  0c 84 ff ff  BULK/INT XFER                           34.2.0        
  35.1        23  IN     22 00 00 00  08 12 00 00  00 00 00 00  00 00 00 00  00 00 00 00  00 00 00                               "......................                 35.1.0        
  35.1            URB    80 00 09 00  00 00 00 00  78 d8 5d b2  f3 7b 00 00  00 00 00 00  00 00 00 00  80 ac 52 57  0c 84 ff ff  BULK/INT XFER                           35.2.0        
  35.1        13  IN     55 53 42 53  50 60 84 4f  a9 00 00 00  00                                                               USBSP`.O.....                           36.1.0        
  35.1            URB    80 00 09 00  00 00 00 00  78 d8 5d b2  f3 7b 00 00  00 00 00 00  00 00 00 00  80 ac 52 57  0c 84 ff ff  BULK/INT XFER                           36.2.0        
  36          23  IN     22 00 00 00  08 12 00 00  00 00 00 00  00 00 00 00  00 00 00 00  00 00 00                               "......................                 33.2.0        
  36              SSTS   12                                                                                                      data overrun                            33.3.0        
  36              CMD    1a 00 08 00  c0 00                                                                                      MODE SENSE 08                           37.1.0        
  35.1        31  OUT    55 53 42 43  e0 d5 46 56  c0 00 00 00  80 00 06 1a  00 08 00 c0  00 00 00 00  00 00 00 00  00 00 00     USBC..FV.......................         38.1.0        
  35.1            URB    80 00 09 00  00 00 00 00  78 d8 5d b2  f3 7b 00 00  00 00 00 00  00 00 00 00  f0 49 a6 56  0c 84 ff ff  BULK/INT XFER                           38.2.0        
  35.1        23  IN     22 00 00 00  08 12 00 00  00 00 00 00  00 00 00 00  00 00 00 00  00 00 00                               "......................                 39.1.0        
  35.1            URB    80 00 09 00  00 00 00 00  78 d8 5d b2  f3 7b 00 00  00 00 00 00  00 00 00 00  80 ac 52 57  0c 84 ff ff  BULK/INT XFER                           39.2.0        
  35.1        13  IN     55 53 42 53  e0 d5 46 56  a9 00 00 00  00                                                               USBS..FV.....                           40.1.0        
  35.1            URB    80 00 09 00  00 00 00 00  78 d8 5d b2  f3 7b 00 00  00 00 00 00  00 00 00 00  80 ac 52 57  0c 84 ff ff  BULK/INT XFER                           40.2.0        
  36          23  IN     22 00 00 00  08 12 00 00  00 00 00 00  00 00 00 00  00 00 00 00  00 00 00                               "......................                 37.2.0        
  36              SSTS   12                                                                                                      data overrun                            37.3.0        
  36              CMD    25 00 00 00  00 00 00 00  00 00                                                                         READ CAPACITY                           41.1.0        
  35.1        31  OUT    55 53 42 43  30 60 59 4d  08 00 00 00  80 00 0a 25  00 00 00 00  00 00 00 00  00 00 00 00  00 00 00     USBC0`YM.......%...............         42.1.0        
  35.1            URB    80 00 09 00  00 00 00 00  78 d8 5d b2  f3 7b 00 00  00 00 00 00  00 00 00 00  f0 49 a6 56  0c 84 ff ff  BULK/INT XFER                           42.2.0        
  35.1         8  IN     00 73 7f ff  00 00 02 00                                                                                .s......                                43.1.0        
  35.1            URB    80 00 09 00  00 00 00 00  78 d8 5d b2  f3 7b 00 00  00 00 00 00  00 00 00 00  80 ac 52 57  0c 84 ff ff  BULK/INT XFER                           43.2.0        
  35.1        13  IN     55 53 42 53  30 60 59 4d  00 00 00 00  00                                                               USBS0`YM.....                           44.1.0        
  35.1            URB    80 00 09 00  00 00 00 00  78 d8 5d b2  f3 7b 00 00  00 00 00 00  00 00 00 00  80 ac 52 57  0c 84 ff ff  BULK/INT XFER                           44.2.0        
  36           8  IN     00 73 7f ff  00 00 02 00                                                                                .s......                                41.2.0        
  36              CMD    12 00 00 00  24 00                                                                                      INQUIRY                                 45.1.0        
  35.1        31  OUT    55 53 42 43  30 60 59 4d  24 00 00 00  80 00 06 12  00 00 00 24  00 00 00 00  00 00 00 00  00 00 00     USBC0`YM$..........$...........         46.1.0        
  35.1            URB    80 00 09 00  00 00 00 00  78 d8 5d b2  f3 7b 00 00  00 00 00 00  00 00 00 00  f0 49 a6 56  0c 84 ff ff  BULK/INT XFER                           46.2.0        
  35.1        36  IN     00 80 02 02  1f 00 00 00  4c 5a 4e 20  20 20 20 20  50 72 6f 64  75 63 74 20  20 20 20 20  20 20 20 20  ........LZN     Product                 47.1.0        
  35.1            URB    80 00 09 00  00 00 00 00  78 d8 5d b2  f3 7b 00 00  00 00 00 00  00 00 00 00  80 ac 52 57  0c 84 ff ff  BULK/INT XFER                           47.2.0        
  35.1        13  IN     55 53 42 53  30 60 59 4d  00 00 00 00  00                                                               USBS0`YM.....                           48.1.0        
  35.1            URB    80 00 09 00  00 00 00 00  78 d8 5d b2  f3 7b 00 00  00 00 00 00  00 00 00 00  80 ac 52 57  0c 84 ff ff  BULK/INT XFER                           48.2.0        
  36          36  IN     00 80 02 02  1f 00 00 00  4c 5a 4e 20  20 20 20 20  50 72 6f 64  75 63 74 20  20 20 20 20  20 20 20 20  ........LZN     Product                 45.2.0        
  36              CMD    9e 10 00 00  00 00 00 00  00 00 00 00  00 20 00 00                                                      SVC ACTION IN                           49.1.0        
  36          18  SENSE  70 00 05 00  00 00 00 0a  00 00 00 00  20 00 00 00  00 00                                               illegal request                         49.2.0        
  36              CMD    25 00 00 00  00 00 00 00  00 00                                                                         READ CAPACITY                           50.1.0        
  35.1        31  OUT    55 53 42 43  e0 d5 46 56  08 00 00 00  80 00 0a 25  00 00 00 00  00 00 00 00  00 00 00 00  00 00 00     USBC..FV.......%...............         51.1.0        
  35.1            URB    80 00 09 00  00 00 00 00  78 d8 5d b2  f3 7b 00 00  00 00 00 00  00 00 00 00  f0 49 a6 56  0c 84 ff ff  BULK/INT XFER                           51.2.0        
  35.1         8  IN     00 73 7f ff  00 00 02 00                                                                                .s......                                52.1.0        
  35.1            URB    80 00 09 00  00 00 00 00  78 d8 5d b2  f3 7b 00 00  00 00 00 00  00 00 00 00  80 ac 52 57  0c 84 ff ff  BULK/INT XFER                           52.2.0        
  35.1        13  IN     55 53 42 53  e0 d5 46 56  00 00 00 00  00                                                               USBS..FV.....                           53.1.0        
  35.1            URB    80 00 09 00  00 00 00 00  78 d8 5d b2  f3 7b 00 00  00 00 00 00  00 00 00 00  80 ac 52 57  0c 84 ff ff  BULK/INT XFER                           53.2.0        
  36           8  IN     00 73 7f ff  00 00 02 00                                                                                .s......                                50.2.0        
  36              CMD    25 00 00 00  00 00 00 00  00 00                                                                         READ CAPACITY                           54.1.0        
  35.1        31  OUT    55 53 42 43  e0 45 0f 57  08 00 00 00  80 00 0a 25  00 00 00 00  00 00 00 00  00 00 00 00  00 00 00     USBC.E.W.......%...............         55.1.0        
  35.1            URB    80 00 09 00  00 00 00 00  78 d8 5d b2  f3 7b 00 00  00 00 00 00  00 00 00 00  f0 49 a6 56  0c 84 ff ff  BULK/INT XFER                           55.2.0        
  35.1         8  IN     00 73 7f ff  00 00 02 00                                                                                .s......                                56.1.0        
  35.1            URB    80 00 09 00  00 00 00 00  78 d8 5d b2  f3 7b 00 00  00 00 00 00  00 00 00 00  80 ac 52 57  0c 84 ff ff  BULK/INT XFER                           56.2.0        
  35.1        13  IN     55 53 42 53  e0 45 0f 57  00 00 00 00  00                                                               USBS.E.W.....                           57.1.0        
  35.1            URB    80 00 09 00  00 00 00 00  78 d8 5d b2  f3 7b 00 00  00 00 00 00  00 00 00 00  80 ac 52 57  0c 84 ff ff  BULK/INT XFER                           57.2.0        
  36           8  IN     00 73 7f ff  00 00 02 00                                                                                .s......                                54.2.0        
  36              CMD    25 00 00 00  00 00 00 00  00 00                                                                         READ CAPACITY                           58.1.0        
  35.1        31  OUT    55 53 42 43  50 60 84 4f  08 00 00 00  80 00 0a 25  00 00 00 00  00 00 00 00  00 00 00 00  00 00 00     USBCP`.O.......%...............         59.1.0        
  35.1            URB    80 00 09 00  00 00 00 00  78 d8 5d b2  f3 7b 00 00  00 00 00 00  00 00 00 00  f0 49 a6 56  0c 84 ff ff  BULK/INT XFER                           59.2.0        
  35.1         8  IN     00 73 7f ff  00 00 02 00                                                                                .s......                                60.1.0        
  35.1            URB    80 00 09 00  00 00 00 00  78 d8 5d b2  f3 7b 00 00  00 00 00 00  00 00 00 00  80 ac 52 57  0c 84 ff ff  BULK/INT XFER                           60.2.0        
  35.1        13  IN     55 53 42 53  50 60 84 4f  00 00 00 00  00                                                               USBSP`.O.....                           61.1.0        
  35.1            URB    80 00 09 00  00 00 00 00  78 d8 5d b2  f3 7b 00 00  00 00 00 00  00 00 00 00  80 ac 52 57  0c 84 ff ff  BULK/INT XFER                           61.2.0        
  36           8  IN     00 73 7f ff  00 00 02 00                                                                                .s......                                58.2.0        
  36              CMD    28 00 00 00  00 00 00 00  01 00                                                                         READ                                    62.1.0        
  35.1        31  OUT    55 53 42 43  e0 45 0f 57  00 02 00 00  80 00 0a 28  00 00 00 00  00 00 00 01  00 00 00 00  00 00 00     USBC.E.W.......(...............         63.1.0        
  35.1            URB    80 00 09 00  00 00 00 00  78 d8 5d b2  f3 7b 00 00  00 00 00 00  00 00 00 00  f0 49 a6 56  0c 84 ff ff  BULK/INT XFER                           63.2.0        
  35.1       512  IN     00 00 00 00  00 00 00 00  00 00 00 00  00 00 00 00  00 00 00 00  00 00 00 00  00 00 00 00  00 00 00 00  ................................        64.1.0        
  35.1            URB    80 00 09 00  00 00 00 00  78 d8 5d b2  f3 7b 00 00  00 00 00 00  00 00 00 00  80 ac 52 57  0c 84 ff ff  BULK/INT XFER                           64.2.0        
  35.1        13  IN     55 53 42 53  e0 45 0f 57  00 00 00 00  00                                                               USBS.E.W.....                           65.1.0        
  35.1            URB    80 00 09 00  00 00 00 00  78 d8 5d b2  f3 7b 00 00  00 00 00 00  00 00 00 00  80 ac 52 57  0c 84 ff ff  BULK/INT XFER                           65.2.0        
  36         512  IN     00 00 00 00  00 00 00 00  00 00 00 00  00 00 00 00  00 00 00 00  00 00 00 00  00 00 00 00  00 00 00 00  ................................        62.2.0        
  36              CMD    28 00 00 00  00 00 00 00  10 00                                                                         READ                                    66.1.0        
  35.1        31  OUT    55 53 42 43  60 65 b5 46  00 20 00 00  80 00 0a 28  00 00 00 00  00 00 00 10  00 00 00 00  00 00 00     USBC`e.F. .....(...............         67.1.0        
  36              CMD    25 00 00 00  00 00 00 00  00 00                                                                         READ CAPACITY                           68.1.0        
  35.1            URB    80 00 09 00  00 00 00 00  78 d8 5d b2  f3 7b 00 00  00 00 00 00  00 00 00 00  f0 49 a6 56  0c 84 ff ff  BULK/INT XFER                           67.2.0        
  35.1      8192  IN     00 00 00 00  00 00 00 00  00 00 00 00  00 00 00 00  00 00 00 00  00 00 00 00  00 00 00 00  00 00 00 00  ................................        69.1.0        
  35.1            URB    80 00 09 00  00 00 00 00  78 d8 5d b2  f3 7b 00 00  00 00 00 00  00 00 00 00  80 ac 52 57  0c 84 ff ff  BULK/INT XFER                           69.2.0        
  35.1        13  IN     55 53 42 53  60 65 b5 46  00 00 00 00  00                                                               USBS`e.F.....                           70.1.0        
  35.1            URB    80 00 09 00  00 00 00 00  78 d8 5d b2  f3 7b 00 00  00 00 00 00  00 00 00 00  80 ac 52 57  0c 84 ff ff  BULK/INT XFER                           70.2.0        
  36        8192  IN     00 00 00 00  00 00 00 00  00 00 00 00  00 00 00 00  00 00 00 00  00 00 00 00  00 00 00 00  00 00 00 00  ................................        66.2.0        
  35.1        31  OUT    55 53 42 43  20 a9 55 56  08 00 00 00  80 00 0a 25  00 00 00 00  00 00 00 00  00 00 00 00  00 00 00     USBC .UV.......%...............         71.1.0        
  35.1            URB    80 00 09 00  00 00 00 00  78 d8 5d b2  f3 7b 00 00  00 00 00 00  00 00 00 00  f0 49 a6 56  0c 84 ff ff  BULK/INT XFER                           71.2.0        
  35.1         8  IN     00 73 7f ff  00 00 02 00                                                                                .s......                                72.1.0        
  35.1            URB    80 00 09 00  00 00 00 00  78 d8 5d b2  f3 7b 00 00  00 00 00 00  00 00 00 00  80 ac 52 57  0c 84 ff ff  BULK/INT XFER                           72.2.0        
  35.1        13  IN     55 53 42 53  20 a9 55 56  00 00 00 00  00                                                               USBS .UV.....                           73.1.0        
  35.1            URB    80 00 09 00  00 00 00 00  78 d8 5d b2  f3 7b 00 00  00 00 00 00  00 00 00 00  80 ac 52 57  0c 84 ff ff  BULK/INT XFER                           73.2.0        
  36           8  IN     00 73 7f ff  00 00 02 00                                                                                .s......                                68.2.0        
  36              CMD    25 00 00 00  00 00 00 00  00 00                                                                         READ CAPACITY                           74.1.0        
  35.1        31  OUT    55 53 42 43  20 59 8a 5d  08 00 00 00  80 00 0a 25  00 00 00 00  00 00 00 00  00 00 00 00  00 00 00     USBC Y.].......%...............         75.1.0        
  35.1            URB    80 00 09 00  00 00 00 00  78 d8 5d b2  f3 7b 00 00  00 00 00 00  00 00 00 00  f0 49 a6 56  0c 84 ff ff  BULK/INT XFER                           75.2.0        
  35.1         8  IN     00 73 7f ff  00 00 02 00                                                                                .s......                                76.1.0        
  35.1            URB    80 00 09 00  00 00 00 00  78 d8 5d b2  f3 7b 00 00  00 00 00 00  00 00 00 00  80 ac 52 57  0c 84 ff ff  BULK/INT XFER                           76.2.0        
  35.1        13  IN     55 53 42 53  20 59 8a 5d  00 00 00 00  00                                                               USBS Y.].....                           77.1.0        
  35.1            URB    80 00 09 00  00 00 00 00  78 d8 5d b2  f3 7b 00 00  00 00 00 00  00 00 00 00  80 ac 52 57  0c 84 ff ff  BULK/INT XFER                           77.2.0        
  36           8  IN     00 73 7f ff  00 00 02 00                                                                                .s......                                74.2.0        
  36              CMD    25 00 00 00  00 00 00 00  00 00                                                                         READ CAPACITY                           78.1.0        
  35.1        31  OUT    55 53 42 43  50 60 84 4f  08 00 00 00  80 00 0a 25  00 00 00 00  00 00 00 00  00 00 00 00  00 00 00     USBCP`.O.......%...............         79.1.0        
  35.1            URB    80 00 09 00  00 00 00 00  78 d8 5d b2  f3 7b 00 00  00 00 00 00  00 00 00 00  f0 49 a6 56  0c 84 ff ff  BULK/INT XFER                           79.2.0        
  35.1         8  IN     00 73 7f ff  00 00 02 00                                                                                .s......                                80.1.0        
  35.1            URB    80 00 09 00  00 00 00 00  78 d8 5d b2  f3 7b 00 00  00 00 00 00  00 00 00 00  80 ac 52 57  0c 84 ff ff  BULK/INT XFER                           80.2.0        
  35.1        13  IN     55 53 42 53  50 60 84 4f  00 00 00 00  00                                                               USBSP`.O.....                           81.1.0        
  35.1            URB    80 00 09 00  00 00 00 00  78 d8 5d b2  f3 7b 00 00  00 00 00 00  00 00 00 00  80 ac 52 57  0c 84 ff ff  BULK/INT XFER                           81.2.0        
  36           8  IN     00 73 7f ff  00 00 02 00                                                                                .s......                                78.2.0        
  36              CMD    28 00 00 00  00 02 00 00  01 00                                                                         READ                                    82.1.0        
  35.1        31  OUT    55 53 42 43  50 60 84 4f  00 02 00 00  80 00 0a 28  00 00 00 00  02 00 00 01  00 00 00 00  00 00 00     USBCP`.O.......(...............         83.1.0        
  35.1            URB    80 00 09 00  00 00 00 00  78 d8 5d b2  f3 7b 00 00  00 00 00 00  00 00 00 00  f0 49 a6 56  0c 84 ff ff  BULK/INT XFER                           83.2.0        
  35.1       512  IN     00 00 00 00  00 00 00 00  00 00 00 00  00 00 00 00  00 00 00 00  00 00 00 00  00 00 00 00  00 00 00 00  ................................        84.1.0        
  35.1            URB    80 00 09 00  00 00 00 00  78 d8 5d b2  f3 7b 00 00  00 00 00 00  00 00 00 00  80 ac 52 57  0c 84 ff ff  BULK/INT XFER                           84.2.0        
  35.1        13  IN     55 53 42 53  50 60 84 4f  00 00 00 00  00                                                               USBSP`.O.....                           85.1.0        
  35.1            URB    80 00 09 00  00 00 00 00  78 d8 5d b2  f3 7b 00 00  00 00 00 00  00 00 00 00  80 ac 52 57  0c 84 ff ff  BULK/INT XFER                           85.2.0        
  36         512  IN     00 00 00 00  00 00 00 00  00 00 00 00  00 00 00 00  00 00 00 00  00 00 00 00  00 00 00 00  00 00 00 00  ................................        82.2.0        
  36              CMD    25 00 00 00  00 00 00 00  00 00                                                                         READ CAPACITY                           86.1.0        
  35.1        31  OUT    55 53 42 43  20 f9 8d 53  08 00 00 00  80 00 0a 25  00 00 00 00  00 00 00 00  00 00 00 00  00 00 00     USBC ..S.......%...............         87.1.0        
  35.1            URB    80 00 09 00  00 00 00 00  78 d8 5d b2  f3 7b 00 00  00 00 00 00  00 00 00 00  f0 49 a6 56  0c 84 ff ff  BULK/INT XFER                           87.2.0        
  35.1         8  IN     00 73 7f ff  00 00 02 00                                                                                .s......                                88.1.0        
  35.1            URB    80 00 09 00  00 00 00 00  78 d8 5d b2  f3 7b 00 00  00 00 00 00  00 00 00 00  80 ac 52 57  0c 84 ff ff  BULK/INT XFER                           88.2.0        
  35.1        13  IN     55 53 42 53  20 f9 8d 53  00 00 00 00  00                                                               USBS ..S.....                           89.1.0        
  35.1            URB    80 00 09 00  00 00 00 00  78 d8 5d b2  f3 7b 00 00  00 00 00 00  00 00 00 00  80 ac 52 57  0c 84 ff ff  BULK/INT XFER                           89.2.0        
  36           8  IN     00 73 7f ff  00 00 02 00                                                                                .s......                                86.2.0        
  36              CMD    25 00 00 00  00 00 00 00  00 00                                                                         READ CAPACITY                           90.1.0        
  35.1        31  OUT    55 53 42 43  e0 45 0f 57  08 00 00 00  80 00 0a 25  00 00 00 00  00 00 00 00  00 00 00 00  00 00 00     USBC.E.W.......%...............         91.1.0        
  35.1            URB    80 00 09 00  00 00 00 00  78 d8 5d b2  f3 7b 00 00  00 00 00 00  00 00 00 00  f0 49 a6 56  0c 84 ff ff  BULK/INT XFER                           91.2.0        
  35.1         8  IN     00 73 7f ff  00 00 02 00                                                                                .s......                                92.1.0        
  35.1            URB    80 00 09 00  00 00 00 00  78 d8 5d b2  f3 7b 00 00  00 00 00 00  00 00 00 00  80 ac 52 57  0c 84 ff ff  BULK/INT XFER                           92.2.0        
  35.1        13  IN     55 53 42 53  e0 45 0f 57  00 00 00 00  00                                                               USBS.E.W.....                           93.1.0        
  35.1            URB    80 00 09 00  00 00 00 00  78 d8 5d b2  f3 7b 00 00  00 00 00 00  00 00 00 00  80 ac 52 57  0c 84 ff ff  BULK/INT XFER                           93.2.0        
  36           8  IN     00 73 7f ff  00 00 02 00                                                                                .s......                                90.2.0        
  36              CMD    28 00 00 00  00 00 00 00  01 00                                                                         READ                                    94.1.0        
  35.1        31  OUT    55 53 42 43  60 65 b5 46  00 02 00 00  80 00 0a 28  00 00 00 00  00 00 00 01  00 00 00 00  00 00 00     USBC`e.F.......(...............         95.1.0        
  35.1            URB    80 00 09 00  00 00 00 00  78 d8 5d b2  f3 7b 00 00  00 00 00 00  00 00 00 00  f0 49 a6 56  0c 84 ff ff  BULK/INT XFER                           95.2.0        
  36              CMD    25 00 00 00  00 00 00 00  00 00                                                                         READ CAPACITY                           96.1.0        
  35.1       512  IN     00 00 00 00  00 00 00 00  00 00 00 00  00 00 00 00  00 00 00 00  00 00 00 00  00 00 00 00  00 00 00 00  ................................        97.1.0        
  35.1            URB    80 00 09 00  00 00 00 00  78 d8 5d b2  f3 7b 00 00  00 00 00 00  00 00 00 00  80 ac 52 57  0c 84 ff ff  BULK/INT XFER                           97.2.0        
  35.1        13  IN     55 53 42 53  60 65 b5 46  00 00 00 00  00                                                               USBS`e.F.....                           98.1.0        
  35.1            URB    80 00 09 00  00 00 00 00  78 d8 5d b2  f3 7b 00 00  00 00 00 00  00 00 00 00  80 ac 52 57  0c 84 ff ff  BULK/INT XFER                           98.2.0        
  36         512  IN     00 00 00 00  00 00 00 00  00 00 00 00  00 00 00 00  00 00 00 00  00 00 00 00  00 00 00 00  00 00 00 00  ................................        94.2.0        
  36              CMD    28 00 00 00  20 00 00 00  01 00                                                                         READ                                    99.1.0        
  35.1        31  OUT    55 53 42 43  20 79 ec 4c  08 00 00 00  80 00 0a 25  00 00 00 00  00 00 00 00  00 00 00 00  00 00 00     USBC y.L.......%...............        100.1.0        
  35.1            URB    80 00 09 00  00 00 00 00  78 d8 5d b2  f3 7b 00 00  00 00 00 00  00 00 00 00  f0 49 a6 56  0c 84 ff ff  BULK/INT XFER                          100.2.0        
  35.1         8  IN     00 73 7f ff  00 00 02 00                                                                                .s......                               101.1.0        
  35.1            URB    80 00 09 00  00 00 00 00  78 d8 5d b2  f3 7b 00 00  00 00 00 00  00 00 00 00  80 ac 52 57  0c 84 ff ff  BULK/INT XFER                          101.2.0        
  35.1        13  IN     55 53 42 53  20 79 ec 4c  00 00 00 00  00                                                               USBS y.L.....                          102.1.0        
  35.1            URB    80 00 09 00  00 00 00 00  78 d8 5d b2  f3 7b 00 00  00 00 00 00  00 00 00 00  80 ac 52 57  0c 84 ff ff  BULK/INT XFER                          102.2.0        
  36           8  IN     00 73 7f ff  00 00 02 00                                                                                .s......                                96.2.0        
  36              CMD    25 00 00 00  00 00 00 00  00 00                                                                         READ CAPACITY                          103.1.0        
  35.1        31  OUT    55 53 42 43  20 09 13 5e  00 02 00 00  80 00 0a 28  00 00 00 20  00 00 00 01  00 00 00 00  00 00 00     USBC ..^.......(... ...........        104.1.0        
  35.1            URB    80 00 09 00  00 00 00 00  78 d8 5d b2  f3 7b 00 00  00 00 00 00  00 00 00 00  f0 49 a6 56  0c 84 ff ff  BULK/INT XFER                          104.2.0        
  35.1       512  IN     eb 58 90 4d  53 44 4f 53  35 2e 30 00  02 40 ca 18  02 00 00 00  00 f8 00 00  3f 00 ff 00  00 20 00 00  .X.MSDOS5.0..@..........?.... ..       105.1.0        
  35.1            URB    80 00 09 00  00 00 00 00  78 d8 5d b2  f3 7b 00 00  00 00 00 00  00 00 00 00  80 ac 52 57  0c 84 ff ff  BULK/INT XFER                          105.2.0        
  35.1        13  IN     55 53 42 53  20 09 13 5e  00 00 00 00  00                                                               USBS ..^.....                          106.1.0        
  35.1            URB    80 00 09 00  00 00 00 00  78 d8 5d b2  f3 7b 00 00  00 00 00 00  00 00 00 00  80 ac 52 57  0c 84 ff ff  BULK/INT XFER                          106.2.0        
  36         512  IN     eb 58 90 4d  53 44 4f 53  35 2e 30 00  02 40 ca 18  02 00 00 00  00 f8 00 00  3f 00 ff 00  00 20 00 00  .X.MSDOS5.0..@..........?.... ..        99.2.0        
  35.1        31  OUT    55 53 42 43  10 60 29 5a  08 00 00 00  80 00 0a 25  00 00 00 00  00 00 00 00  00 00 00 00  00 00 00     USBC.`)Z.......%...............        107.1.0        
  35.1            URB    80 00 09 00  00 00 00 00  78 d8 5d b2  f3 7b 00 00  00 00 00 00  00 00 00 00  f0 49 a6 56  0c 84 ff ff  BULK/INT XFER                          107.2.0        
  35.1         8  IN     00 73 7f ff  00 00 02 00                                                                                .s......                               108.1.0        
  35.1            URB    80 00 09 00  00 00 00 00  78 d8 5d b2  f3 7b 00 00  00 00 00 00  00 00 00 00  80 ac 52 57  0c 84 ff ff  BULK/INT XFER                          108.2.0        
  35.1        13  IN     55 53 42 53  10 60 29 5a  00 00 00 00  00                                                               USBS.`)Z.....                          109.1.0        
  35.1            URB    80 00 09 00  00 00 00 00  78 d8 5d b2  f3 7b 00 00  00 00 00 00  00 00 00 00  80 ac 52 57  0c 84 ff ff  BULK/INT XFER                          109.2.0        
  36           8  IN     00 73 7f ff  00 00 02 00                                                                                .s......                               103.2.0        
  36              CMD    1a 00 3f 00  c0 00                                                                                      MODE SENSE 3F                          110.1.0        
  35.1        31  OUT    55 53 42 43  e0 45 0f 57  c0 00 00 00  80 00 06 1a  00 3f 00 c0  00 00 00 00  00 00 00 00  00 00 00     USBC.E.W.........?.............        111.1.0        
  35.1            URB    80 00 09 00  00 00 00 00  78 d8 5d b2  f3 7b 00 00  00 00 00 00  00 00 00 00  f0 49 a6 56  0c 84 ff ff  BULK/INT XFER                          111.2.0        
  35.1        23  IN     22 00 00 00  08 12 00 00  00 00 00 00  00 00 00 00  00 00 00 00  00 00 00                               "......................                112.1.0        
  35.1            URB    80 00 09 00  00 00 00 00  78 d8 5d b2  f3 7b 00 00  00 00 00 00  00 00 00 00  80 ac 52 57  0c 84 ff ff  BULK/INT XFER                          112.2.0        
  35.1        13  IN     55 53 42 53  e0 45 0f 57  a9 00 00 00  00                                                               USBS.E.W.....                          113.1.0        
  35.1            URB    80 00 09 00  00 00 00 00  78 d8 5d b2  f3 7b 00 00  00 00 00 00  00 00 00 00  80 ac 52 57  0c 84 ff ff  BULK/INT XFER                          113.2.0        
  36          23  IN     22 00 00 00  08 12 00 00  00 00 00 00  00 00 00 00  00 00 00 00  00 00 00                               "......................                110.2.0        
  36              SSTS   12                                                                                                      data overrun                           110.3.0        
  36              CMD    00 00 00 00  00 00                                                                                      TEST UNIT READY                        114.1.0        
  35.1        31  OUT    55 53 42 43  f0 78 3d 57  00 00 00 00  00 00 06 00  00 00 00 00  00 00 00 00  00 00 00 00  00 00 00     USBC.x=W.......................        115.1.0        
  35.1            URB    80 00 09 00  00 00 00 00  78 d8 5d b2  f3 7b 00 00  00 00 00 00  00 00 00 00  f0 49 a6 56  0c 84 ff ff  BULK/INT XFER                          115.2.0        
  35.1        13  IN     55 53 42 53  f0 78 3d 57  00 00 00 00  00                                                               USBS.x=W.....                          116.1.0        
  35.1            URB    80 00 09 00  00 00 00 00  78 d8 5d b2  f3 7b 00 00  00 00 00 00  00 00 00 00  80 ac 52 57  0c 84 ff ff  BULK/INT XFER                          116.2.0        
  36              ok                                                                                                                                                    114.2.0        
  36              CMD    25 00 00 00  00 00 00 00  00 00                                                                         READ CAPACITY                          117.1.0        
  35.1        31  OUT    55 53 42 43  20 49 3f 54  08 00 00 00  80 00 0a 25  00 00 00 00  00 00 00 00  00 00 00 00  00 00 00     USBC I?T.......%...............        118.1.0        
  35.1            URB    80 00 09 00  00 00 00 00  78 d8 5d b2  f3 7b 00 00  00 00 00 00  00 00 00 00  f0 49 a6 56  0c 84 ff ff  BULK/INT XFER                          118.2.0        
  35.1         8  IN     00 73 7f ff  00 00 02 00                                                                                .s......                               119.1.0        
  35.1            URB    80 00 09 00  00 00 00 00  78 d8 5d b2  f3 7b 00 00  00 00 00 00  00 00 00 00  80 ac 52 57  0c 84 ff ff  BULK/INT XFER                          119.2.0        
  35.1        13  IN     55 53 42 53  20 49 3f 54  00 00 00 00  00                                                               USBS I?T.....                          120.1.0        
  35.1            URB    80 00 09 00  00 00 00 00  78 d8 5d b2  f3 7b 00 00  00 00 00 00  00 00 00 00  80 ac 52 57  0c 84 ff ff  BULK/INT XFER                          120.2.0        
  36           8  IN     00 73 7f ff  00 00 02 00                                                                                .s......                               117.2.0        
  36              CMD    25 00 00 00  00 00 00 00  00 00                                                                         READ CAPACITY                          121.1.0        
  35.1        31  OUT    55 53 42 43  20 a9 55 56  08 00 00 00  80 00 0a 25  00 00 00 00  00 00 00 00  00 00 00 00  00 00 00     USBC .UV.......%...............        122.1.0        
  35.1            URB    80 00 09 00  00 00 00 00  78 d8 5d b2  f3 7b 00 00  00 00 00 00  00 00 00 00  f0 49 a6 56  0c 84 ff ff  BULK/INT XFER                          122.2.0        
  35.1         8  IN     00 73 7f ff  00 00 02 00                                                                                .s......                               123.1.0        
  35.1            URB    80 00 09 00  00 00 00 00  78 d8 5d b2  f3 7b 00 00  00 00 00 00  00 00 00 00  80 ac 52 57  0c 84 ff ff  BULK/INT XFER                          123.2.0        
  35.1        13  IN     55 53 42 53  20 a9 55 56  00 00 00 00  00                                                               USBS .UV.....                          124.1.0        
  35.1            URB    80 00 09 00  00 00 00 00  78 d8 5d b2  f3 7b 00 00  00 00 00 00  00 00 00 00  80 ac 52 57  0c 84 ff ff  BULK/INT XFER                          124.2.0        
  36           8  IN     00 73 7f ff  00 00 02 00                                                                                .s......                               121.2.0        
  36              CMD    28 00 00 00  00 00 00 00  01 00                                                                         READ                                   125.1.0        
  35.1        31  OUT    55 53 42 43  10 60 29 5a  00 02 00 00  80 00 0a 28  00 00 00 00  00 00 00 01  00 00 00 00  00 00 00     USBC.`)Z.......(...............        126.1.0        
  35.1            URB    80 00 09 00  00 00 00 00  78 d8 5d b2  f3 7b 00 00  00 00 00 00  00 00 00 00  f0 49 a6 56  0c 84 ff ff  BULK/INT XFER                          126.2.0        
  35.1       512  IN     00 00 00 00  00 00 00 00  00 00 00 00  00 00 00 00  00 00 00 00  00 00 00 00  00 00 00 00  00 00 00 00  ................................       127.1.0        
  35.1            URB    80 00 09 00  00 00 00 00  78 d8 5d b2  f3 7b 00 00  00 00 00 00  00 00 00 00  80 ac 52 57  0c 84 ff ff  BULK/INT XFER                          127.2.0        
  35.1        13  IN     55 53 42 53  10 60 29 5a  00 00 00 00  00                                                               USBS.`)Z.....                          128.1.0        
  35.1            URB    80 00 09 00  00 00 00 00  78 d8 5d b2  f3 7b 00 00  00 00 00 00  00 00 00 00  80 ac 52 57  0c 84 ff ff  BULK/INT XFER                          128.2.0        
  36         512  IN     00 00 00 00  00 00 00 00  00 00 00 00  00 00 00 00  00 00 00 00  00 00 00 00  00 00 00 00  00 00 00 00  ................................       125.2.0        
  36              CMD    25 00 00 00  00 00 00 00  00 00                                                                         READ CAPACITY                          129.1.0        
  35.1        31  OUT    55 53 42 43  20 79 41 5a  08 00 00 00  80 00 0a 25  00 00 00 00  00 00 00 00  00 00 00 00  00 00 00     USBC yAZ.......%...............        130.1.0        
  35.1            URB    80 00 09 00  00 00 00 00  78 d8 5d b2  f3 7b 00 00  00 00 00 00  00 00 00 00  f0 49 a6 56  0c 84 ff ff  BULK/INT XFER                          130.2.0        
  35.1         8  IN     00 73 7f ff  00 00 02 00                                                                                .s......                               131.1.0        
  35.1            URB    80 00 09 00  00 00 00 00  78 d8 5d b2  f3 7b 00 00  00 00 00 00  00 00 00 00  80 ac 52 57  0c 84 ff ff  BULK/INT XFER                          131.2.0        
  35.1        13  IN     55 53 42 53  20 79 41 5a  00 00 00 00  00                                                               USBS yAZ.....                          132.1.0        
  35.1            URB    80 00 09 00  00 00 00 00  78 d8 5d b2  f3 7b 00 00  00 00 00 00  00 00 00 00  80 ac 52 57  0c 84 ff ff  BULK/INT XFER                          132.2.0        
  36           8  IN     00 73 7f ff  00 00 02 00                                                                                .s......                               129.2.0        
  36              CMD    25 00 00 00  00 00 00 00  00 00                                                                         READ CAPACITY                          133.1.0        
  35.1        31  OUT    55 53 42 43  10 60 29 5a  08 00 00 00  80 00 0a 25  00 00 00 00  00 00 00 00  00 00 00 00  00 00 00     USBC.`)Z.......%...............        134.1.0        
  35.1            URB    80 00 09 00  00 00 00 00  78 d8 5d b2  f3 7b 00 00  00 00 00 00  00 00 00 00  f0 49 a6 56  0c 84 ff ff  BULK/INT XFER                          134.2.0        
  35.1         8  IN     00 73 7f ff  00 00 02 00                                                                                .s......                               135.1.0        
  35.1            URB    80 00 09 00  00 00 00 00  78 d8 5d b2  f3 7b 00 00  00 00 00 00  00 00 00 00  80 ac 52 57  0c 84 ff ff  BULK/INT XFER                          135.2.0        
  35.1        13  IN     55 53 42 53  10 60 29 5a  00 00 00 00  00                                                               USBS.`)Z.....                          136.1.0        
  35.1            URB    80 00 09 00  00 00 00 00  78 d8 5d b2  f3 7b 00 00  00 00 00 00  00 00 00 00  80 ac 52 57  0c 84 ff ff  BULK/INT XFER                          136.2.0        
  36           8  IN     00 73 7f ff  00 00 02 00                                                                                .s......                               133.2.0        
  36              CMD    25 00 00 00  00 00 00 00  00 00                                                                         READ CAPACITY                          137.1.0        
  35.1        31  OUT    55 53 42 43  20 19 a9 5d  08 00 00 00  80 00 0a 25  00 00 00 00  00 00 00 00  00 00 00 00  00 00 00     USBC ..].......%...............        138.1.0        
  35.1            URB    80 00 09 00  00 00 00 00  78 d8 5d b2  f3 7b 00 00  00 00 00 00  00 00 00 00  f0 49 a6 56  0c 84 ff ff  BULK/INT XFER                          138.2.0        
  35.1         8  IN     00 73 7f ff  00 00 02 00                                                                                .s......                               139.1.0        
  35.1            URB    80 00 09 00  00 00 00 00  78 d8 5d b2  f3 7b 00 00  00 00 00 00  00 00 00 00  80 ac 52 57  0c 84 ff ff  BULK/INT XFER                          139.2.0        
  35.1        13  IN     55 53 42 53  20 19 a9 5d  00 00 00 00  00                                                               USBS ..].....                          140.1.0        
  35.1            URB    80 00 09 00  00 00 00 00  78 d8 5d b2  f3 7b 00 00  00 00 00 00  00 00 00 00  80 ac 52 57  0c 84 ff ff  BULK/INT XFER                          140.2.0        
  36           8  IN     00 73 7f ff  00 00 02 00                                                                                .s......                               137.2.0        
  36              CMD    28 00 00 00  00 00 00 00  01 00                                                                         READ                                   141.1.0        
  35.1        31  OUT    55 53 42 43  20 79 41 5a  00 02 00 00  80 00 0a 28  00 00 00 00  00 00 00 01  00 00 00 00  00 00 00     USBC yAZ.......(...............        142.1.0        
  35.1            URB    80 00 09 00  00 00 00 00  78 d8 5d b2  f3 7b 00 00  00 00 00 00  00 00 00 00  f0 49 a6 56  0c 84 ff ff  BULK/INT XFER                          142.2.0        
  35.1       512  IN     00 00 00 00  00 00 00 00  00 00 00 00  00 00 00 00  00 00 00 00  00 00 00 00  00 00 00 00  00 00 00 00  ................................       143.1.0        
  35.1            URB    80 00 09 00  00 00 00 00  78 d8 5d b2  f3 7b 00 00  00 00 00 00  00 00 00 00  80 ac 52 57  0c 84 ff ff  BULK/INT XFER                          143.2.0        
  35.1        13  IN     55 53 42 53  20 79 41 5a  00 00 00 00  00                                                               USBS yAZ.....                          144.1.0        
  35.1            URB    80 00 09 00  00 00 00 00  78 d8 5d b2  f3 7b 00 00  00 00 00 00  00 00 00 00  80 ac 52 57  0c 84 ff ff  BULK/INT XFER                          144.2.0        
  36         512  IN     00 00 00 00  00 00 00 00  00 00 00 00  00 00 00 00  00 00 00 00  00 00 00 00  00 00 00 00  00 00 00 00  ................................       141.2.0        
  36              CMD    28 00 00 00  20 00 00 00  10 00                                                                         READ                                   145.1.0        
  35.1        31  OUT    55 53 42 43  10 60 29 5a  00 20 00 00  80 00 0a 28  00 00 00 20  00 00 00 10  00 00 00 00  00 00 00     USBC.`)Z. .....(... ...........        146.1.0        
  35.1            URB    80 00 09 00  00 00 00 00  78 d8 5d b2  f3 7b 00 00  00 00 00 00  00 00 00 00  f0 49 a6 56  0c 84 ff ff  BULK/INT XFER                          146.2.0        
  35.1      8192  IN     eb 58 90 4d  53 44 4f 53  35 2e 30 00  02 40 ca 18  02 00 00 00  00 f8 00 00  3f 00 ff 00  00 20 00 00  .X.MSDOS5.0..@..........?.... ..       147.1.0        
  35.1            URB    80 00 09 00  00 00 00 00  78 d8 5d b2  f3 7b 00 00  00 00 00 00  00 00 00 00  80 ac 52 57  0c 84 ff ff  BULK/INT XFER                          147.2.0        
  35.1        13  IN     55 53 42 53  10 60 29 5a  00 00 00 00  00                                                               USBS.`)Z.....                          148.1.0        
  35.1            URB    80 00 09 00  00 00 00 00  78 d8 5d b2  f3 7b 00 00  00 00 00 00  00 00 00 00  80 ac 52 57  0c 84 ff ff  BULK/INT XFER                          148.2.0        
  36        8192  IN     eb 58 90 4d  53 44 4f 53  35 2e 30 00  02 40 ca 18  02 00 00 00  00 f8 00 00  3f 00 ff 00  00 20 00 00  .X.MSDOS5.0..@..........?.... ..       145.2.0        
  36              CMD    00 00 00 00  00 00                                                                                      TEST UNIT READY                        149.1.0        
  35.1        31  OUT    55 53 42 43  20 79 5c 4d  00 00 00 00  00 00 06 00  00 00 00 00  00 00 00 00  00 00 00 00  00 00 00     USBC y\M.......................        150.1.0        
  35.1            URB    80 00 09 00  00 00 00 00  78 d8 5d b2  f3 7b 00 00  00 00 00 00  00 00 00 00  f0 49 a6 56  0c 84 ff ff  BULK/INT XFER                          150.2.0        
  35.1        13  IN     55 53 42 53  20 79 5c 4d  00 00 00 00  00                                                               USBS y\M.....                          151.1.0        
  35.1            URB    80 00 09 00  00 00 00 00  78 d8 5d b2  f3 7b 00 00  00 00 00 00  00 00 00 00  80 ac 52 57  0c 84 ff ff  BULK/INT XFER                          151.2.0        
  36              ok                                                                                                                                                    149.2.0        
  36              CMD    25 00 00 00  00 00 00 00  00 00                                                                         READ CAPACITY                          152.1.0        
  35.1        31  OUT    55 53 42 43  10 e0 2c 4c  08 00 00 00  80 00 0a 25  00 00 00 00  00 00 00 00  00 00 00 00  00 00 00     USBC..,L.......%...............        153.1.0        
  35.1            URB    80 00 09 00  00 00 00 00  78 d8 5d b2  f3 7b 00 00  00 00 00 00  00 00 00 00  f0 49 a6 56  0c 84 ff ff  BULK/INT XFER                          153.2.0        
  35.1         8  IN     00 73 7f ff  00 00 02 00                                                                                .s......                               154.1.0        
  35.1            URB    80 00 09 00  00 00 00 00  78 d8 5d b2  f3 7b 00 00  00 00 00 00  00 00 00 00  80 ac 52 57  0c 84 ff ff  BULK/INT XFER                          154.2.0        
  35.1        13  IN     55 53 42 53  10 e0 2c 4c  00 00 00 00  00                                                               USBS..,L.....                          155.1.0        
  35.1            URB    80 00 09 00  00 00 00 00  78 d8 5d b2  f3 7b 00 00  00 00 00 00  00 00 00 00  80 ac 52 57  0c 84 ff ff  BULK/INT XFER                          155.2.0        
  36           8  IN     00 73 7f ff  00 00 02 00                                                                                .s......                               152.2.0        
  36              CMD    25 00 00 00  00 00 00 00  00 00                                                                         READ CAPACITY                          156.1.0        
  35.1        31  OUT    55 53 42 43  20 f9 8d 53  08 00 00 00  80 00 0a 25  00 00 00 00  00 00 00 00  00 00 00 00  00 00 00     USBC ..S.......%...............        157.1.0        
  35.1            URB    80 00 09 00  00 00 00 00  78 d8 5d b2  f3 7b 00 00  00 00 00 00  00 00 00 00  f0 49 a6 56  0c 84 ff ff  BULK/INT XFER                          157.2.0        
  35.1         8  IN     00 73 7f ff  00 00 02 00                                                                                .s......                               158.1.0        
  35.1            URB    80 00 09 00  00 00 00 00  78 d8 5d b2  f3 7b 00 00  00 00 00 00  00 00 00 00  80 ac 52 57  0c 84 ff ff  BULK/INT XFER                          158.2.0        
  35.1        13  IN     55 53 42 53  20 f9 8d 53  00 00 00 00  00                                                               USBS ..S.....                          159.1.0        
  35.1            URB    80 00 09 00  00 00 00 00  78 d8 5d b2  f3 7b 00 00  00 00 00 00  00 00 00 00  80 ac 52 57  0c 84 ff ff  BULK/INT XFER                          159.2.0        
  36           8  IN     00 73 7f ff  00 00 02 00                                                                                .s......                               156.2.0        
  36              CMD    28 00 00 00  00 00 00 00  01 00                                                                         READ                                   160.1.0        
  35.1        31  OUT    55 53 42 43  10 e0 2c 4c  00 02 00 00  80 00 0a 28  00 00 00 00  00 00 00 01  00 00 00 00  00 00 00     USBC..,L.......(...............        161.1.0        
  35.1            URB    80 00 09 00  00 00 00 00  78 d8 5d b2  f3 7b 00 00  00 00 00 00  00 00 00 00  f0 49 a6 56  0c 84 ff ff  BULK/INT XFER                          161.2.0        
  35.1       512  IN     00 00 00 00  00 00 00 00  00 00 00 00  00 00 00 00  00 00 00 00  00 00 00 00  00 00 00 00  00 00 00 00  ................................       162.1.0        
  35.1            URB    80 00 09 00  00 00 00 00  78 d8 5d b2  f3 7b 00 00  00 00 00 00  00 00 00 00  80 ac 52 57  0c 84 ff ff  BULK/INT XFER                          162.2.0        
  35.1        13  IN     55 53 42 53  10 e0 2c 4c  00 00 00 00  00                                                               USBS..,L.....                          163.1.0        
  35.1            URB    80 00 09 00  00 00 00 00  78 d8 5d b2  f3 7b 00 00  00 00 00 00  00 00 00 00  80 ac 52 57  0c 84 ff ff  BULK/INT XFER                          163.2.0        
  36         512  IN     00 00 00 00  00 00 00 00  00 00 00 00  00 00 00 00  00 00 00 00  00 00 00 00  00 00 00 00  00 00 00 00  ................................       160.2.0        
  36              CMD    25 00 00 00  00 00 00 00  00 00                                                                         READ CAPACITY                          164.1.0        
  35.1        31  OUT    55 53 42 43  e0 45 0f 57  08 00 00 00  80 00 0a 25  00 00 00 00  00 00 00 00  00 00 00 00  00 00 00     USBC.E.W.......%...............        165.1.0        
  35.1            URB    80 00 09 00  00 00 00 00  78 d8 5d b2  f3 7b 00 00  00 00 00 00  00 00 00 00  f0 49 a6 56  0c 84 ff ff  BULK/INT XFER                          165.2.0        
  35.1         8  IN     00 73 7f ff  00 00 02 00                                                                                .s......                               166.1.0        
  35.1            URB    80 00 09 00  00 00 00 00  78 d8 5d b2  f3 7b 00 00  00 00 00 00  00 00 00 00  80 ac 52 57  0c 84 ff ff  BULK/INT XFER                          166.2.0        
  35.1        13  IN     55 53 42 53  e0 45 0f 57  00 00 00 00  00                                                               USBS.E.W.....                          167.1.0        
  35.1            URB    80 00 09 00  00 00 00 00  78 d8 5d b2  f3 7b 00 00  00 00 00 00  00 00 00 00  80 ac 52 57  0c 84 ff ff  BULK/INT XFER                          167.2.0        
  36           8  IN     00 73 7f ff  00 00 02 00                                                                                .s......                               164.2.0        
  36              CMD    28 00 00 00  20 00 00 00  01 00                                                                         READ                                   168.1.0        
  35.1        31  OUT    55 53 42 43  60 25 42 5a  00 02 00 00  80 00 0a 28  00 00 00 20  00 00 00 01  00 00 00 00  00 00 00     USBC`%BZ.......(... ...........        169.1.0        
  35.1            URB    80 00 09 00  00 00 00 00  78 d8 5d b2  f3 7b 00 00  00 00 00 00  00 00 00 00  f0 49 a6 56  0c 84 ff ff  BULK/INT XFER                          169.2.0        
  35.1       512  IN     eb 58 90 4d  53 44 4f 53  35 2e 30 00  02 40 ca 18  02 00 00 00  00 f8 00 00  3f 00 ff 00  00 20 00 00  .X.MSDOS5.0..@..........?.... ..       170.1.0        
  35.1            URB    80 00 09 00  00 00 00 00  78 d8 5d b2  f3 7b 00 00  00 00 00 00  00 00 00 00  80 ac 52 57  0c 84 ff ff  BULK/INT XFER                          170.2.0        
  35.1        13  IN     55 53 42 53  60 25 42 5a  00 00 00 00  00                                                               USBS`%BZ.....                          171.1.0        
  35.1            URB    80 00 09 00  00 00 00 00  78 d8 5d b2  f3 7b 00 00  00 00 00 00  00 00 00 00  80 ac 52 57  0c 84 ff ff  BULK/INT XFER                          171.2.0        
  36         512  IN     eb 58 90 4d  53 44 4f 53  35 2e 30 00  02 40 ca 18  02 00 00 00  00 f8 00 00  3f 00 ff 00  00 20 00 00  .X.MSDOS5.0..@..........?.... ..       168.2.0        
  36              CMD    28 00 00 00  38 c8 00 00  80 00                                                                         READ                                   172.1.0        
  36              CMD    28 00 00 00  39 48 00 00  80 00                                                                         READ                                   173.1.0        
  35.1        31  OUT    55 53 42 43  20 d9 43 5d  00 00 01 00  80 00 0a 28  00 00 00 38  c8 00 00 80  00 00 00 00  00 00 00     USBC .C].......(...8...........        174.1.0        
  35.1            URB    80 00 09 00  00 00 00 00  78 d8 5d b2  f3 7b 00 00  00 00 00 00  00 00 00 00  f0 49 a6 56  0c 84 ff ff  BULK/INT XFER                          174.2.0        
  36              CMD    28 00 00 00  39 c8 00 00  80 00                                                                         READ                                   175.1.0        
  36              CMD    28 00 00 00  3a 48 00 00  80 00                                                                         READ                                   176.1.0        
  36              CMD    28 00 00 00  3a c8 00 00  80 00                                                                         READ                                   177.1.0        
  36              CMD    28 00 00 00  3b 48 00 00  80 00                                                                         READ                                   178.1.0        
  36              CMD    28 00 00 00  3b c8 00 00  80 00                                                                         READ                                   179.1.0        
  36              CMD    28 00 00 00  3c 48 00 00  20 00                                                                         READ                                   180.1.0        
  35.1     65536  IN     00 00 00 00  00 00 00 00  00 00 00 00  00 00 00 00  00 00 00 00  00 00 00 00  00 00 00 00  00 00 00 00  ................................       181.1.0        
  35.1            URB    80 00 09 00  00 00 00 00  78 d8 5d b2  f3 7b 00 00  00 00 00 00  00 00 00 00  80 ac 52 57  0c 84 ff ff  BULK/INT XFER                          181.2.0        
  35.1        13  IN     55 53 42 53  20 d9 43 5d  00 00 00 00  00                                                               USBS .C].....                          182.1.0        
  35.1            URB    80 00 09 00  00 00 00 00  78 d8 5d b2  f3 7b 00 00  00 00 00 00  00 00 00 00  80 ac 52 57  0c 84 ff ff  BULK/INT XFER                          182.2.0        
  36       65536  IN     00 00 00 00  00 00 00 00  00 00 00 00  00 00 00 00  00 00 00 00  00 00 00 00  00 00 00 00  00 00 00 00  ................................       172.2.0        
  35.1        31  OUT    55 53 42 43  20 d9 f1 5d  00 00 01 00  80 00 0a 28  00 00 00 39  48 00 00 80  00 00 00 00  00 00 00     USBC ..].......(...9H..........        183.1.0        
  35.1            URB    80 00 09 00  00 00 00 00  78 d8 5d b2  f3 7b 00 00  00 00 00 00  00 00 00 00  f0 49 a6 56  0c 84 ff ff  BULK/INT XFER                          183.2.0        
  35.1     65536  IN     01 3f 00 00  02 3f 00 00  03 3f 00 00  04 3f 00 00  05 3f 00 00  06 3f 00 00  07 3f 00 00  08 3f 00 00  .?...?...?...?...?...?...?...?..       184.1.0        
  35.1            URB    80 00 09 00  00 00 00 00  78 d8 5d b2  f3 7b 00 00  00 00 00 00  00 00 00 00  80 ac 52 57  0c 84 ff ff  BULK/INT XFER                          184.2.0        
  35.1        13  IN     55 53 42 53  20 d9 f1 5d  00 00 00 00  00                                                               USBS ..].....                          185.1.0        
  35.1            URB    80 00 09 00  00 00 00 00  78 d8 5d b2  f3 7b 00 00  00 00 00 00  00 00 00 00  80 ac 52 57  0c 84 ff ff  BULK/INT XFER                          185.2.0        
  36       65536  IN     01 3f 00 00  02 3f 00 00  03 3f 00 00  04 3f 00 00  05 3f 00 00  06 3f 00 00  07 3f 00 00  08 3f 00 00  .?...?...?...?...?...?...?...?..       173.2.0        
  35.1        31  OUT    55 53 42 43  20 29 4e 5a  00 00 01 00  80 00 0a 28  00 00 00 39  c8 00 00 80  00 00 00 00  00 00 00     USBC )NZ.......(...9...........        186.1.0        
  35.1            URB    80 00 09 00  00 00 00 00  78 d8 5d b2  f3 7b 00 00  00 00 00 00  00 00 00 00  f0 49 a6 56  0c 84 ff ff  BULK/INT XFER                          186.2.0        
  35.1     65536  IN     01 7f 00 00  02 7f 00 00  03 7f 00 00  04 7f 00 00  05 7f 00 00  06 7f 00 00  07 7f 00 00  08 7f 00 00  ................................       187.1.0        
  35.1            URB    80 00 09 00  00 00 00 00  78 d8 5d b2  f3 7b 00 00  00 00 00 00  00 00 00 00  80 ac 52 57  0c 84 ff ff  BULK/INT XFER                          187.2.0        
  35.1        13  IN     55 53 42 53  20 29 4e 5a  00 00 00 00  00                                                               USBS )NZ.....                          188.1.0        
  35.1            URB    80 00 09 00  00 00 00 00  78 d8 5d b2  f3 7b 00 00  00 00 00 00  00 00 00 00  80 ac 52 57  0c 84 ff ff  BULK/INT XFER                          188.2.0        
  36       65536  IN     01 7f 00 00  02 7f 00 00  03 7f 00 00  04 7f 00 00  05 7f 00 00  06 7f 00 00  07 7f 00 00  08 7f 00 00  ................................       175.2.0        
  35.1        31  OUT    55 53 42 43  10 f0 c9 46  00 00 01 00  80 00 0a 28  00 00 00 3a  48 00 00 80  00 00 00 00  00 00 00     USBC...F.......(...:H..........        189.1.0        
  35.1            URB    80 00 09 00  00 00 00 00  78 d8 5d b2  f3 7b 00 00  00 00 00 00  00 00 00 00  f0 49 a6 56  0c 84 ff ff  BULK/INT XFER                          189.2.0        
  35.1     65536  IN     01 bf 00 00  02 bf 00 00  03 bf 00 00  04 bf 00 00  05 bf 00 00  06 bf 00 00  07 bf 00 00  08 bf 00 00  ................................       190.1.0        
  35.1            URB    80 00 09 00  00 00 00 00  78 d8 5d b2  f3 7b 00 00  00 00 00 00  00 00 00 00  80 ac 52 57  0c 84 ff ff  BULK/INT XFER                          190.2.0        
  35.1        13  IN     55 53 42 53  10 f0 c9 46  00 00 00 00  00                                                               USBS...F.....                          191.1.0        
  35.1            URB    80 00 09 00  00 00 00 00  78 d8 5d b2  f3 7b 00 00  00 00 00 00  00 00 00 00  80 ac 52 57  0c 84 ff ff  BULK/INT XFER                          191.2.0        
  36       65536  IN     01 bf 00 00  02 bf 00 00  03 bf 00 00  04 bf 00 00  05 bf 00 00  06 bf 00 00  07 bf 00 00  08 bf 00 00  ................................       176.2.0        
  35.1        31  OUT    55 53 42 43  20 59 2c 50  00 00 01 00  80 00 0a 28  00 00 00 3a  c8 00 00 80  00 00 00 00  00 00 00     USBC Y,P.......(...:...........        192.1.0        
  35.1            URB    80 00 09 00  00 00 00 00  78 d8 5d b2  f3 7b 00 00  00 00 00 00  00 00 00 00  f0 49 a6 56  0c 84 ff ff  BULK/INT XFER                          192.2.0        
  36              CMD    00 00 00 00  00 00                                                                                      TEST UNIT READY                        193.1.0        
  35.1     65536  IN     01 ff 00 00  02 ff 00 00  03 ff 00 00  04 ff 00 00  05 ff 00 00  06 ff 00 00  07 ff 00 00  08 ff 00 00  ................................       194.1.0        
  35.1            URB    80 00 09 00  00 00 00 00  78 d8 5d b2  f3 7b 00 00  00 00 00 00  00 00 00 00  80 ac 52 57  0c 84 ff ff  BULK/INT XFER                          194.2.0        
  35.1        13  IN     55 53 42 53  20 59 2c 50  00 00 00 00  00                                                               USBS Y,P.....                          195.1.0        
  35.1            URB    80 00 09 00  00 00 00 00  78 d8 5d b2  f3 7b 00 00  00 00 00 00  00 00 00 00  80 ac 52 57  0c 84 ff ff  BULK/INT XFER                          195.2.0        
  36       65536  IN     01 ff 00 00  02 ff 00 00  03 ff 00 00  04 ff 00 00  05 ff 00 00  06 ff 00 00  07 ff 00 00  08 ff 00 00  ................................       177.2.0        
  35.1        31  OUT    55 53 42 43  20 d9 fe 5e  00 00 01 00  80 00 0a 28  00 00 00 3b  48 00 00 80  00 00 00 00  00 00 00     USBC ..^.......(...;H..........        196.1.0        
  35.1            URB    80 00 09 00  00 00 00 00  78 d8 5d b2  f3 7b 00 00  00 00 00 00  00 00 00 00  f0 49 a6 56  0c 84 ff ff  BULK/INT XFER                          196.2.0        
  35.0            CTL    80 06 00 02  00 00 09 00                                                                                GET DESCRIPTOR                         197.1.0        
  35.0         9  IN     09 02 20 00  01 01 04 c0  32                                                                            .. .....2                              197.2.0        
  35.0            URB    88 00 08 00  00 00 00 00  78 d8 5d b2  f3 7b 00 00  00 00 00 00  00 00 00 00  80 0c bb 5b  0c 84 ff ff  CONTROL TRANSFER                       197.3.0        
  35.0            CTL    80 06 00 02  00 00 20 00                                                                                GET DESCRIPTOR                         198.1.0        
  35.0        32  IN     09 02 20 00  01 01 04 c0  32 09 04 00  00 02 08 06  50 05 07 05  81 02 40 00  00 07 05 01  02 40 00 00  .. .....2.......P.....@......@..       198.2.0        
  35.0            URB    88 00 08 00  00 00 00 00  78 d8 5d b2  f3 7b 00 00  00 00 00 00  00 00 00 00  80 0c bb 5b  0c 84 ff ff  CONTROL TRANSFER                       198.3.0        
  35.1     65536  IN     00 00 00 00  00 00 00 00  00 00 00 00  00 00 00 00  00 00 00 00  00 00 00 00  00 00 00 00  00 00 00 00  ................................       199.1.0        
  35.1            URB    80 00 09 00  00 00 00 00  78 d8 5d b2  f3 7b 00 00  00 00 00 00  00 00 00 00  80 ac 52 57  0c 84 ff ff  BULK/INT XFER                          199.2.0        
  35.1        13  IN     55 53 42 53  20 d9 fe 5e  00 00 00 00  00                                                               USBS ..^.....                          200.1.0        
  35.1            URB    80 00 09 00  00 00 00 00  78 d8 5d b2  f3 7b 00 00  00 00 00 00  00 00 00 00  80 ac 52 57  0c 84 ff ff  BULK/INT XFER                          200.2.0        
  36       65536  IN     00 00 00 00  00 00 00 00  00 00 00 00  00 00 00 00  00 00 00 00  00 00 00 00  00 00 00 00  00 00 00 00  ................................       178.2.0        
  35.1        31  OUT    55 53 42 43  60 15 d3 57  00 00 01 00  80 00 0a 28  00 00 00 3b  c8 00 00 80  00 00 00 00  00 00 00     USBC`..W.......(...;...........        201.1.0        
  35.1            URB    80 00 09 00  00 00 00 00  78 d8 5d b2  f3 7b 00 00  00 00 00 00  00 00 00 00  f0 49 a6 56  0c 84 ff ff  BULK/INT XFER                          201.2.0        
  36              CMD    00 00 00 00  00 00                                                                                      TEST UNIT READY                        202.1.0        
  35.1     65536  IN     00 00 00 00  00 00 00 00  00 00 00 00  00 00 00 00  00 00 00 00  00 00 00 00  00 00 00 00  00 00 00 00  ................................       203.1.0        
  35.1            URB    80 00 09 00  00 00 00 00  78 d8 5d b2  f3 7b 00 00  00 00 00 00  00 00 00 00  80 ac 52 57  0c 84 ff ff  BULK/INT XFER                          203.2.0        
  35.1        13  IN     55 53 42 53  60 15 d3 57  00 00 00 00  00                                                               USBS`..W.....                          204.1.0        
  35.1            URB    80 00 09 00  00 00 00 00  78 d8 5d b2  f3 7b 00 00  00 00 00 00  00 00 00 00  80 ac 52 57  0c 84 ff ff  BULK/INT XFER                          204.2.0        
  36       65536  IN     00 00 00 00  00 00 00 00  00 00 00 00  00 00 00 00  00 00 00 00  00 00 00 00  00 00 00 00  00 00 00 00  ................................       179.2.0        
  35.1        31  OUT    55 53 42 43  20 09 13 5e  00 40 00 00  80 00 0a 28  00 00 00 3c  48 00 00 20  00 00 00 00  00 00 00     USBC ..^.@.....(...<H.. .......        205.1.0        
  35.1            URB    80 00 09 00  00 00 00 00  78 d8 5d b2  f3 7b 00 00  00 00 00 00  00 00 00 00  f0 49 a6 56  0c 84 ff ff  BULK/INT XFER                          205.2.0        
  35.1     16384  IN     00 00 00 00  00 00 00 00  00 00 00 00  00 00 00 00  00 00 00 00  00 00 00 00  00 00 00 00  00 00 00 00  ................................       206.1.0        
  35.1            URB    80 00 09 00  00 00 00 00  78 d8 5d b2  f3 7b 00 00  00 00 00 00  00 00 00 00  80 ac 52 57  0c 84 ff ff  BULK/INT XFER                          206.2.0        
  35.1        13  IN     55 53 42 53  20 09 13 5e  00 00 00 00  00                                                               USBS ..^.....                          207.1.0        
  35.1            URB    80 00 09 00  00 00 00 00  78 d8 5d b2  f3 7b 00 00  00 00 00 00  00 00 00 00  80 ac 52 57  0c 84 ff ff  BULK/INT XFER                          207.2.0        
  36       16384  IN     00 00 00 00  00 00 00 00  00 00 00 00  00 00 00 00  00 00 00 00  00 00 00 00  00 00 00 00  00 00 00 00  ................................       180.2.0        
  35.1        31  OUT    55 53 42 43  20 e9 be 53  00 00 00 00  00 00 06 00  00 00 00 00  00 00 00 00  00 00 00 00  00 00 00     USBC ..S.......................        208.1.0        
  35.1            URB    80 00 09 00  00 00 00 00  78 d8 5d b2  f3 7b 00 00  00 00 00 00  00 00 00 00  f0 49 a6 56  0c 84 ff ff  BULK/INT XFER                          208.2.0        
  35.1        13  IN     55 53 42 53  20 e9 be 53  00 00 00 00  00                                                               USBS ..S.....                          209.1.0        
  35.1            URB    80 00 09 00  00 00 00 00  78 d8 5d b2  f3 7b 00 00  00 00 00 00  00 00 00 00  80 ac 52 57  0c 84 ff ff  BULK/INT XFER                          209.2.0        
  36              ok                                                                                                                                                    193.2.0        
  35.1        31  OUT    55 53 42 43  10 d0 c7 57  00 00 00 00  00 00 06 00  00 00 00 00  00 00 00 00  00 00 00 00  00 00 00     USBC...W.......................        210.1.0        
  35.1            URB    80 00 09 00  00 00 00 00  78 d8 5d b2  f3 7b 00 00  00 00 00 00  00 00 00 00  f0 49 a6 56  0c 84 ff ff  BULK/INT XFER                          210.2.0        
  35.1        13  IN     55 53 42 53  10 d0 c7 57  00 00 00 00  00                                                               USBS...W.....                          211.1.0        
  35.1            URB    80 00 09 00  00 00 00 00  78 d8 5d b2  f3 7b 00 00  00 00 00 00  00 00 00 00  80 ac 52 57  0c 84 ff ff  BULK/INT XFER                          211.2.0        
  36              ok                                                                                                                                                    202.2.0        
  36              CMD    28 00 00 00  40 00 00 00  08 00                                                                         READ                                   212.1.0        
  35.1        31  OUT    55 53 42 43  10 e0 2c 4c  00 10 00 00  80 00 0a 28  00 00 00 40  00 00 00 08  00 00 00 00  00 00 00     USBC..,L.......(...@...........        213.1.0        
  35.1            URB    80 00 09 00  00 00 00 00  78 d8 5d b2  f3 7b 00 00  00 00 00 00  00 00 00 00  f0 49 a6 56  0c 84 ff ff  BULK/INT XFER                          213.2.0        
  35.1      4096  IN     4c 4c 4d 43  20 20 20 20  20 20 20 08  00 00 00 00  00 00 00 00  00 00 02 01  ec 58 00 00  00 00 00 00  LLMC       ..............X......       214.1.0        
  35.1            URB    80 00 09 00  00 00 00 00  78 d8 5d b2  f3 7b 00 00  00 00 00 00  00 00 00 00  80 ac 52 57  0c 84 ff ff  BULK/INT XFER                          214.2.0        
  35.1        13  IN     55 53 42 53  10 e0 2c 4c  00 00 00 00  00                                                               USBS..,L.....                          215.1.0        
  35.1            URB    80 00 09 00  00 00 00 00  78 d8 5d b2  f3 7b 00 00  00 00 00 00  00 00 00 00  80 ac 52 57  0c 84 ff ff  BULK/INT XFER                          215.2.0        
  36        4096  IN     4c 4c 4d 43  20 20 20 20  20 20 20 08  00 00 00 00  00 00 00 00  00 00 02 01  ec 58 00 00  00 00 00 00  LLMC       ..............X......       212.2.0        
  36              CMD    28 00 00 00  20 00 00 00  08 00                                                                         READ                                   216.1.0        
  35.1        31  OUT    55 53 42 43  10 e0 2c 4c  00 10 00 00  80 00 0a 28  00 00 00 20  00 00 00 08  00 00 00 00  00 00 00     USBC..,L.......(... ...........        217.1.0        
  35.1            URB    80 00 09 00  00 00 00 00  78 d8 5d b2  f3 7b 00 00  00 00 00 00  00 00 00 00  f0 49 a6 56  0c 84 ff ff  BULK/INT XFER                          217.2.0        
  35.1      4096  IN     eb 58 90 4d  53 44 4f 53  35 2e 30 00  02 40 ca 18  02 00 00 00  00 f8 00 00  3f 00 ff 00  00 20 00 00  .X.MSDOS5.0..@..........?.... ..       218.1.0        
  35.1            URB    80 00 09 00  00 00 00 00  78 d8 5d b2  f3 7b 00 00  00 00 00 00  00 00 00 00  80 ac 52 57  0c 84 ff ff  BULK/INT XFER                          218.2.0        
  35.1        13  IN     55 53 42 53  10 e0 2c 4c  00 00 00 00  00                                                               USBS..,L.....                          219.1.0        
  35.1            URB    80 00 09 00  00 00 00 00  78 d8 5d b2  f3 7b 00 00  00 00 00 00  00 00 00 00  80 ac 52 57  0c 84 ff ff  BULK/INT XFER                          219.2.0        
  36        4096  IN     eb 58 90 4d  53 44 4f 53  35 2e 30 00  02 40 ca 18  02 00 00 00  00 f8 00 00  3f 00 ff 00  00 20 00 00  .X.MSDOS5.0..@..........?.... ..       216.2.0        
  36              CMD    1a 00 3f 00  c0 00                                                                                      MODE SENSE 3F                          220.1.0        
  35.1        31  OUT    55 53 42 43  20 09 13 5e  c0 00 00 00  80 00 06 1a  00 3f 00 c0  00 00 00 00  00 00 00 00  00 00 00     USBC ..^.........?.............        221.1.0        
  35.1            URB    80 00 09 00  00 00 00 00  78 d8 5d b2  f3 7b 00 00  00 00 00 00  00 00 00 00  f0 49 a6 56  0c 84 ff ff  BULK/INT XFER                          221.2.0        
  35.1        23  IN     22 00 00 00  08 12 00 00  00 00 00 00  00 00 00 00  00 00 00 00  00 00 00                               "......................                222.1.0        
  35.1            URB    80 00 09 00  00 00 00 00  78 d8 5d b2  f3 7b 00 00  00 00 00 00  00 00 00 00  80 ac 52 57  0c 84 ff ff  BULK/INT XFER                          222.2.0        
  35.1        13  IN     55 53 42 53  20 09 13 5e  a9 00 00 00  00                                                               USBS ..^.....                          223.1.0        
  35.1            URB    80 00 09 00  00 00 00 00  78 d8 5d b2  f3 7b 00 00  00 00 00 00  00 00 00 00  80 ac 52 57  0c 84 ff ff  BULK/INT XFER                          223.2.0        
  36          23  IN     22 00 00 00  08 12 00 00  00 00 00 00  00 00 00 00  00 00 00 00  00 00 00                               "......................                220.2.0        
  36              SSTS   12                                                                                                      data overrun                           220.3.0        
  36              CMD    28 00 00 00  20 00 00 00  10 00                                                                         READ                                   224.1.0        
  35.1        31  OUT    55 53 42 43  20 09 13 5e  00 20 00 00  80 00 0a 28  00 00 00 20  00 00 00 10  00 00 00 00  00 00 00     USBC ..^. .....(... ...........        225.1.0        
  35.1            URB    80 00 09 00  00 00 00 00  78 d8 5d b2  f3 7b 00 00  00 00 00 00  00 00 00 00  f0 49 a6 56  0c 84 ff ff  BULK/INT XFER                          225.2.0        
  35.1      8192  IN     eb 58 90 4d  53 44 4f 53  35 2e 30 00  02 40 ca 18  02 00 00 00  00 f8 00 00  3f 00 ff 00  00 20 00 00  .X.MSDOS5.0..@..........?.... ..       226.1.0        
  35.1            URB    80 00 09 00  00 00 00 00  78 d8 5d b2  f3 7b 00 00  00 00 00 00  00 00 00 00  80 ac 52 57  0c 84 ff ff  BULK/INT XFER                          226.2.0        
  35.1        13  IN     55 53 42 53  20 09 13 5e  00 00 00 00  00                                                               USBS ..^.....                          227.1.0        
  35.1            URB    80 00 09 00  00 00 00 00  78 d8 5d b2  f3 7b 00 00  00 00 00 00  00 00 00 00  80 ac 52 57  0c 84 ff ff  BULK/INT XFER                          227.2.0        
  36        8192  IN     eb 58 90 4d  53 44 4f 53  35 2e 30 00  02 40 ca 18  02 00 00 00  00 f8 00 00  3f 00 ff 00  00 20 00 00  .X.MSDOS5.0..@..........?.... ..       224.2.0        
  36              CMD    28 00 00 00  40 40 00 00  08 00                                                                         READ                                   228.1.0        
  35.1        31  OUT    55 53 42 43  10 e0 2c 4c  00 10 00 00  80 00 0a 28  00 00 00 40  40 00 00 08  00 00 00 00  00 00 00     USBC..,L.......(...@@..........        229.1.0        
  35.1            URB    80 00 09 00  00 00 00 00  78 d8 5d b2  f3 7b 00 00  00 00 00 00  00 00 00 00  f0 49 a6 56  0c 84 ff ff  BULK/INT XFER                          229.2.0        
  35.1      4096  IN     2e 20 20 20  20 20 20 20  20 20 20 10  00 66 01 01  ec 58 ec 58  00 00 02 01  ec 58 03 00  00 00 00 00  .          ..f...X.X.....X......       230.1.0        
  35.1            URB    80 00 09 00  00 00 00 00  78 d8 5d b2  f3 7b 00 00  00 00 00 00  00 00 00 00  80 ac 52 57  0c 84 ff ff  BULK/INT XFER                          230.2.0        
  35.1        13  IN     55 53 42 53  10 e0 2c 4c  00 00 00 00  00                                                               USBS..,L.....                          231.1.0        
  35.1            URB    80 00 09 00  00 00 00 00  78 d8 5d b2  f3 7b 00 00  00 00 00 00  00 00 00 00  80 ac 52 57  0c 84 ff ff  BULK/INT XFER                          231.2.0        
  36        4096  IN     2e 20 20 20  20 20 20 20  20 20 20 10  00 66 01 01  ec 58 ec 58  00 00 02 01  ec 58 03 00  00 00 00 00  .          ..f...X.X.....X......       228.2.0        
  36              CMD    25 00 00 00  00 00 00 00  00 00                                                                         READ CAPACITY                          232.1.0        
  35.1        31  OUT    55 53 42 43  20 79 41 5a  08 00 00 00  80 00 0a 25  00 00 00 00  00 00 00 00  00 00 00 00  00 00 00     USBC yAZ.......%...............        233.1.0        
  35.1            URB    80 00 09 00  00 00 00 00  78 d8 5d b2  f3 7b 00 00  00 00 00 00  00 00 00 00  f0 49 a6 56  0c 84 ff ff  BULK/INT XFER                          233.2.0        
  35.1         8  IN     00 73 7f ff  00 00 02 00                                                                                .s......                               234.1.0        
  35.1            URB    80 00 09 00  00 00 00 00  78 d8 5d b2  f3 7b 00 00  00 00 00 00  00 00 00 00  80 ac 52 57  0c 84 ff ff  BULK/INT XFER                          234.2.0        
  35.1        13  IN     55 53 42 53  20 79 41 5a  00 00 00 00  00                                                               USBS yAZ.....                          235.1.0        
  35.1            URB    80 00 09 00  00 00 00 00  78 d8 5d b2  f3 7b 00 00  00 00 00 00  00 00 00 00  80 ac 52 57  0c 84 ff ff  BULK/INT XFER                          235.2.0        
  36           8  IN     00 73 7f ff  00 00 02 00                                                                                .s......                               232.2.0        
  36              CMD    28 00 00 00  00 02 00 00  01 00                                                                         READ                                   236.1.0        
  35.1        31  OUT    55 53 42 43  20 09 13 5e  00 02 00 00  80 00 0a 28  00 00 00 00  02 00 00 01  00 00 00 00  00 00 00     USBC ..^.......(...............        237.1.0        
  35.1            URB    80 00 09 00  00 00 00 00  78 d8 5d b2  f3 7b 00 00  00 00 00 00  00 00 00 00  f0 49 a6 56  0c 84 ff ff  BULK/INT XFER                          237.2.0        
  35.1       512  IN     00 00 00 00  00 00 00 00  00 00 00 00  00 00 00 00  00 00 00 00  00 00 00 00  00 00 00 00  00 00 00 00  ................................       238.1.0        
  35.1            URB    80 00 09 00  00 00 00 00  78 d8 5d b2  f3 7b 00 00  00 00 00 00  00 00 00 00  80 ac 52 57  0c 84 ff ff  BULK/INT XFER                          238.2.0        
  35.1        13  IN     55 53 42 53  20 09 13 5e  00 00 00 00  00                                                               USBS ..^.....                          239.1.0        
  35.1            URB    80 00 09 00  00 00 00 00  78 d8 5d b2  f3 7b 00 00  00 00 00 00  00 00 00 00  80 ac 52 57  0c 84 ff ff  BULK/INT XFER                          239.2.0        
  36         512  IN     00 00 00 00  00 00 00 00  00 00 00 00  00 00 00 00  00 00 00 00  00 00 00 00  00 00 00 00  00 00 00 00  ................................       236.2.0        
  36              CMD    00 00 00 00  00 00                                                                                      TEST UNIT READY                        240.1.0        
  36              CMD    28 00 00 00  20 00 00 00  10 00                                                                         READ                                   241.1.0        
  35.1        31  OUT    55 53 42 43  10 00 43 50  00 00 00 00  00 00 06 00  00 00 00 00  00 00 00 00  00 00 00 00  00 00 00     USBC..CP.......................        242.1.0        
  35.1            URB    80 00 09 00  00 00 00 00  78 d8 5d b2  f3 7b 00 00  00 00 00 00  00 00 00 00  f0 49 a6 56  0c 84 ff ff  BULK/INT XFER                          242.2.0        
  36              CMD    28 00 00 00  00 00 00 00  10 00                                                                         READ                                   243.1.0        
  35.1        13  IN     55 53 42 53  10 00 43 50  00 00 00 00  00                                                               USBS..CP.....                          244.1.0        
  35.1            URB    80 00 09 00  00 00 00 00  78 d8 5d b2  f3 7b 00 00  00 00 00 00  00 00 00 00  80 ac 52 57  0c 84 ff ff  BULK/INT XFER                          244.2.0        
  36              ok                                                                                                                                                    240.2.0        
  35.1        31  OUT    55 53 42 43  20 19 a9 5d  00 20 00 00  80 00 0a 28  00 00 00 20  00 00 00 10  00 00 00 00  00 00 00     USBC ..]. .....(... ...........        245.1.0        
  35.1            URB    80 00 09 00  00 00 00 00  78 d8 5d b2  f3 7b 00 00  00 00 00 00  00 00 00 00  f0 49 a6 56  0c 84 ff ff  BULK/INT XFER                          245.2.0        
  36              CMD    00 00 00 00  00 00                                                                                      TEST UNIT READY                        246.1.0        
  35.1      8192  IN     eb 58 90 4d  53 44 4f 53  35 2e 30 00  02 40 ca 18  02 00 00 00  00 f8 00 00  3f 00 ff 00  00 20 00 00  .X.MSDOS5.0..@..........?.... ..       247.1.0        
  35.1            URB    80 00 09 00  00 00 00 00  78 d8 5d b2  f3 7b 00 00  00 00 00 00  00 00 00 00  80 ac 52 57  0c 84 ff ff  BULK/INT XFER                          247.2.0        
  35.1        13  IN     55 53 42 53  20 19 a9 5d  00 00 00 00  00                                                               USBS ..].....                          248.1.0        
  35.1            URB    80 00 09 00  00 00 00 00  78 d8 5d b2  f3 7b 00 00  00 00 00 00  00 00 00 00  80 ac 52 57  0c 84 ff ff  BULK/INT XFER                          248.2.0        
  36        8192  IN     eb 58 90 4d  53 44 4f 53  35 2e 30 00  02 40 ca 18  02 00 00 00  00 f8 00 00  3f 00 ff 00  00 20 00 00  .X.MSDOS5.0..@..........?.... ..       241.2.0        
  35.1        31  OUT    55 53 42 43  50 60 84 4f  00 20 00 00  80 00 0a 28  00 00 00 00  00 00 00 10  00 00 00 00  00 00 00     USBCP`.O. .....(...............        249.1.0        
  35.1            URB    80 00 09 00  00 00 00 00  78 d8 5d b2  f3 7b 00 00  00 00 00 00  00 00 00 00  f0 49 a6 56  0c 84 ff ff  BULK/INT XFER                          249.2.0        
  36              CMD    28 00 00 00  20 00 00 00  10 00                                                                         READ                                   250.1.0        
  35.1      8192  IN     00 00 00 00  00 00 00 00  00 00 00 00  00 00 00 00  00 00 00 00  00 00 00 00  00 00 00 00  00 00 00 00  ................................       251.1.0        
  35.1            URB    80 00 09 00  00 00 00 00  78 d8 5d b2  f3 7b 00 00  00 00 00 00  00 00 00 00  80 ac 52 57  0c 84 ff ff  BULK/INT XFER                          251.2.0        
  35.1        13  IN     55 53 42 53  50 60 84 4f  00 00 00 00  00                                                               USBSP`.O.....                          252.1.0        
  35.1            URB    80 00 09 00  00 00 00 00  78 d8 5d b2  f3 7b 00 00  00 00 00 00  00 00 00 00  80 ac 52 57  0c 84 ff ff  BULK/INT XFER                          252.2.0        
  36        8192  IN     00 00 00 00  00 00 00 00  00 00 00 00  00 00 00 00  00 00 00 00  00 00 00 00  00 00 00 00  00 00 00 00  ................................       243.2.0        
  35.1        31  OUT    55 53 42 43  e0 45 0f 57  00 20 00 00  80 00 0a 28  00 00 00 20  00 00 00 10  00 00 00 00  00 00 00     USBC.E.W. .....(... ...........        253.1.0        
  35.1            URB    80 00 09 00  00 00 00 00  78 d8 5d b2  f3 7b 00 00  00 00 00 00  00 00 00 00  f0 49 a6 56  0c 84 ff ff  BULK/INT XFER                          253.2.0        
  36              CMD    28 00 00 00  00 00 00 00  10 00                                                                         READ                                   254.1.0        
  35.1      8192  IN     eb 58 90 4d  53 44 4f 53  35 2e 30 00  02 40 ca 18  02 00 00 00  00 f8 00 00  3f 00 ff 00  00 20 00 00  .X.MSDOS5.0..@..........?.... ..       255.1.0        
  35.1            URB    80 00 09 00  00 00 00 00  78 d8 5d b2  f3 7b 00 00  00 00 00 00  00 00 00 00  80 ac 52 57  0c 84 ff ff  BULK/INT XFER                          255.2.0        
  35.1        13  IN     55 53 42 53  e0 45 0f 57  00 00 00 00  00                                                               USBS.E.W.....                          256.1.0        
  35.1            URB    80 00 09 00  00 00 00 00  78 d8 5d b2  f3 7b 00 00  00 00 00 00  00 00 00 00  80 ac 52 57  0c 84 ff ff  BULK/INT XFER                          256.2.0        
  36        8192  IN     eb 58 90 4d  53 44 4f 53  35 2e 30 00  02 40 ca 18  02 00 00 00  00 f8 00 00  3f 00 ff 00  00 20 00 00  .X.MSDOS5.0..@..........?.... ..       250.2.0        
  35.1        31  OUT    55 53 42 43  10 b0 ce 53  00 00 00 00  00 00 06 00  00 00 00 00  00 00 00 00  00 00 00 00  00 00 00     USBC...S.......................        257.1.0        
  35.1            URB    80 00 09 00  00 00 00 00  78 d8 5d b2  f3 7b 00 00  00 00 00 00  00 00 00 00  f0 49 a6 56  0c 84 ff ff  BULK/INT XFER                          257.2.0        
  35.1        13  IN     55 53 42 53  10 b0 ce 53  00 00 00 00  00                                                               USBS...S.....                          258.1.0        
  35.1            URB    80 00 09 00  00 00 00 00  78 d8 5d b2  f3 7b 00 00  00 00 00 00  00 00 00 00  80 ac 52 57  0c 84 ff ff  BULK/INT XFER                          258.2.0        
  36              ok                                                                                                                                                    246.2.0        
  35.1        31  OUT    55 53 42 43  20 79 ec 4c  00 20 00 00  80 00 0a 28  00 00 00 00  00 00 00 10  00 00 00 00  00 00 00     USBC y.L. .....(...............        259.1.0        
  35.1            URB    80 00 09 00  00 00 00 00  78 d8 5d b2  f3 7b 00 00  00 00 00 00  00 00 00 00  f0 49 a6 56  0c 84 ff ff  BULK/INT XFER                          259.2.0        
  36              CMD    28 00 00 00  20 00 00 00  10 00                                                                         READ                                   260.1.0        
  35.1      8192  IN     00 00 00 00  00 00 00 00  00 00 00 00  00 00 00 00  00 00 00 00  00 00 00 00  00 00 00 00  00 00 00 00  ................................       261.1.0        
  35.1            URB    80 00 09 00  00 00 00 00  78 d8 5d b2  f3 7b 00 00  00 00 00 00  00 00 00 00  80 ac 52 57  0c 84 ff ff  BULK/INT XFER                          261.2.0        
  35.1        13  IN     55 53 42 53  20 79 ec 4c  00 00 00 00  00                                                               USBS y.L.....                          262.1.0        
  35.1            URB    80 00 09 00  00 00 00 00  78 d8 5d b2  f3 7b 00 00  00 00 00 00  00 00 00 00  80 ac 52 57  0c 84 ff ff  BULK/INT XFER                          262.2.0        
  36        8192  IN     00 00 00 00  00 00 00 00  00 00 00 00  00 00 00 00  00 00 00 00  00 00 00 00  00 00 00 00  00 00 00 00  ................................       254.2.0        
  35.1        31  OUT    55 53 42 43  50 60 84 4f  00 20 00 00  80 00 0a 28  00 00 00 20  00 00 00 10  00 00 00 00  00 00 00     USBCP`.O. .....(... ...........        263.1.0        
  35.1            URB    80 00 09 00  00 00 00 00  78 d8 5d b2  f3 7b 00 00  00 00 00 00  00 00 00 00  f0 49 a6 56  0c 84 ff ff  BULK/INT XFER                          263.2.0        
  36              CMD    28 00 00 00  40 80 00 00  01 00                                                                         READ                                   264.1.0        
  35.1      8192  IN     eb 58 90 4d  53 44 4f 53  35 2e 30 00  02 40 ca 18  02 00 00 00  00 f8 00 00  3f 00 ff 00  00 20 00 00  .X.MSDOS5.0..@..........?.... ..       265.1.0        
  35.1            URB    80 00 09 00  00 00 00 00  78 d8 5d b2  f3 7b 00 00  00 00 00 00  00 00 00 00  80 ac 52 57  0c 84 ff ff  BULK/INT XFER                          265.2.0        
  35.1        13  IN     55 53 42 53  50 60 84 4f  00 00 00 00  00                                                               USBSP`.O.....                          266.1.0        
  35.1            URB    80 00 09 00  00 00 00 00  78 d8 5d b2  f3 7b 00 00  00 00 00 00  00 00 00 00  80 ac 52 57  0c 84 ff ff  BULK/INT XFER                          266.2.0        
  36        8192  IN     eb 58 90 4d  53 44 4f 53  35 2e 30 00  02 40 ca 18  02 00 00 00  00 f8 00 00  3f 00 ff 00  00 20 00 00  .X.MSDOS5.0..@..........?.... ..       260.2.0        
  35.1        31  OUT    55 53 42 43  10 e0 2c 4c  00 02 00 00  80 00 0a 28  00 00 00 40  80 00 00 01  00 00 00 00  00 00 00     USBC..,L.......(...@...........        267.1.0        
  35.1            URB    80 00 09 00  00 00 00 00  78 d8 5d b2  f3 7b 00 00  00 00 00 00  00 00 00 00  f0 49 a6 56  0c 84 ff ff  BULK/INT XFER                          267.2.0        
  35.1       512  IN     0c 00 00 00  09 b9 da 5a  3c 87 d7 90  00 00 00 00  00 00 00 00  00 00 00 00  00 00 00 00  00 00 00 00  .......Z<.......................       268.1.0        
  35.1            URB    80 00 09 00  00 00 00 00  78 d8 5d b2  f3 7b 00 00  00 00 00 00  00 00 00 00  80 ac 52 57  0c 84 ff ff  BULK/INT XFER                          268.2.0        
  35.1        13  IN     55 53 42 53  10 e0 2c 4c  00 00 00 00  00                                                               USBS..,L.....                          269.1.0        
  35.1            URB    80 00 09 00  00 00 00 00  78 d8 5d b2  f3 7b 00 00  00 00 00 00  00 00 00 00  80 ac 52 57  0c 84 ff ff  BULK/INT XFER                          269.2.0        
  36         512  IN     0c 00 00 00  09 b9 da 5a  3c 87 d7 90  00 00 00 00  00 00 00 00  00 00 00 00  00 00 00 00  00 00 00 00  .......Z<.......................       264.2.0        
  36              CMD    28 00 00 00  00 00 00 00  10 00                                                                         READ                                   270.1.0        
  35.1        31  OUT    55 53 42 43  10 e0 2c 4c  00 20 00 00  80 00 0a 28  00 00 00 00  00 00 00 10  00 00 00 00  00 00 00     USBC..,L. .....(...............        271.1.0        
  35.1            URB    80 00 09 00  00 00 00 00  78 d8 5d b2  f3 7b 00 00  00 00 00 00  00 00 00 00  f0 49 a6 56  0c 84 ff ff  BULK/INT XFER                          271.2.0        
  36              CMD    00 00 00 00  00 00                                                                                      TEST UNIT READY                        272.1.0        
  35.1      8192  IN     00 00 00 00  00 00 00 00  00 00 00 00  00 00 00 00  00 00 00 00  00 00 00 00  00 00 00 00  00 00 00 00  ................................       273.1.0        
  35.1            URB    80 00 09 00  00 00 00 00  78 d8 5d b2  f3 7b 00 00  00 00 00 00  00 00 00 00  80 ac 52 57  0c 84 ff ff  BULK/INT XFER                          273.2.0        
  35.1        13  IN     55 53 42 53  10 e0 2c 4c  00 00 00 00  00                                                               USBS..,L.....                          274.1.0        
  35.1            URB    80 00 09 00  00 00 00 00  78 d8 5d b2  f3 7b 00 00  00 00 00 00  00 00 00 00  80 ac 52 57  0c 84 ff ff  BULK/INT XFER                          274.2.0        
  36        8192  IN     00 00 00 00  00 00 00 00  00 00 00 00  00 00 00 00  00 00 00 00  00 00 00 00  00 00 00 00  00 00 00 00  ................................       270.2.0        
  35.1        31  OUT    55 53 42 43  60 a8 47 56  00 00 00 00  00 00 06 00  00 00 00 00  00 00 00 00  00 00 00 00  00 00 00     USBC`.GV.......................        275.1.0        
  35.1            URB    80 00 09 00  00 00 00 00  78 d8 5d b2  f3 7b 00 00  00 00 00 00  00 00 00 00  f0 49 a6 56  0c 84 ff ff  BULK/INT XFER                          275.2.0        
  35.1        13  IN     55 53 42 53  60 a8 47 56  00 00 00 00  00                                                               USBS`.GV.....                          276.1.0        
  35.1            URB    80 00 09 00  00 00 00 00  78 d8 5d b2  f3 7b 00 00  00 00 00 00  00 00 00 00  80 ac 52 57  0c 84 ff ff  BULK/INT XFER                          276.2.0        
  36              ok                                                                                                                                                    272.2.0        
  36              CMD    00 00 00 00  00 00                                                                                      TEST UNIT READY                        277.1.0        
  35.1        31  OUT    55 53 42 43  b0 38 9f 50  00 00 00 00  00 00 06 00  00 00 00 00  00 00 00 00  00 00 00 00  00 00 00     USBC.8.P.......................        278.1.0        
  35.1            URB    80 00 09 00  00 00 00 00  78 d8 5d b2  f3 7b 00 00  00 00 00 00  00 00 00 00  f0 49 a6 56  0c 84 ff ff  BULK/INT XFER                          278.2.0        
  35.1        13  IN     55 53 42 53  b0 38 9f 50  00 00 00 00  00                                                               USBS.8.P.....                          279.1.0        
  35.1            URB    80 00 09 00  00 00 00 00  78 d8 5d b2  f3 7b 00 00  00 00 00 00  00 00 00 00  80 ac 52 57  0c 84 ff ff  BULK/INT XFER                          279.2.0        
  36              ok                                                                                                                                                    277.2.0        
  36              CMD    00 00 00 00  00 00                                                                                      TEST UNIT READY                        280.1.0        
  35.1        31  OUT    55 53 42 43  10 50 4a 4f  00 00 00 00  00 00 06 00  00 00 00 00  00 00 00 00  00 00 00 00  00 00 00     USBC.PJO.......................        281.1.0        
  35.1            URB    80 00 09 00  00 00 00 00  78 d8 5d b2  f3 7b 00 00  00 00 00 00  00 00 00 00  f0 49 a6 56  0c 84 ff ff  BULK/INT XFER                          281.2.0        
  35.1        13  IN     55 53 42 53  10 50 4a 4f  00 00 00 00  00                                                               USBS.PJO.....                          282.1.0        
  35.1            URB    80 00 09 00  00 00 00 00  78 d8 5d b2  f3 7b 00 00  00 00 00 00  00 00 00 00  80 ac 52 57  0c 84 ff ff  BULK/INT XFER                          282.2.0        
  36              ok                                                                                                                                                    280.2.0        
  36              CMD    00 00 00 00  00 00                                                                                      TEST UNIT READY                        283.1.0        
  35.1        31  OUT    55 53 42 43  10 a0 2e 57  00 00 00 00  00 00 06 00  00 00 00 00  00 00 00 00  00 00 00 00  00 00 00     USBC...W.......................        284.1.0        
  35.1            URB    80 00 09 00  00 00 00 00  78 d8 5d b2  f3 7b 00 00  00 00 00 00  00 00 00 00  f0 49 a6 56  0c 84 ff ff  BULK/INT XFER                          284.2.0        
  35.1        13  IN     55 53 42 53  10 a0 2e 57  00 00 00 00  00                                                               USBS...W.....                          285.1.0        
  35.1            URB    80 00 09 00  00 00 00 00  78 d8 5d b2  f3 7b 00 00  00 00 00 00  00 00 00 00  80 ac 52 57  0c 84 ff ff  BULK/INT XFER                          285.2.0        
  36              ok                                                                                                                                                    283.2.0        
  36              CMD    2a 00 00 00  40 40 00 00  08 00                                                                         WRITE                                  286.1.0        
  35.1        31  OUT    55 53 42 43  10 e0 2c 4c  00 10 00 00  00 00 0a 2a  00 00 00 40  40 00 00 08  00 00 00 00  00 00 00     USBC..,L.......*...@@..........        287.1.0        
  35.1            URB    80 00 09 00  00 00 00 00  78 d8 5d b2  f3 7b 00 00  00 00 00 00  00 00 00 00  f0 49 a6 56  0c 84 ff ff  BULK/INT XFER                          287.2.0        
  36              CMD    00 00 00 00  00 00                                                                                      TEST UNIT READY                        288.1.0        
  35.1      4096  OUT    2e 20 20 20  20 20 20 20  20 20 20 10  00 66 01 01  ec 58 ec 58  00 00 02 01  ec 58 03 00  00 00 00 00  .          ..f...X.X.....X......       289.1.0        
  35.1            URB    80 00 09 00  00 00 00 00  78 d8 5d b2  f3 7b 00 00  00 00 00 00  00 00 00 00  f0 49 a6 56  0c 84 ff ff  BULK/INT XFER                          289.2.0        
  35.1        13  IN     55 53 42 53  10 e0 2c 4c  00 00 00 00  00                                                               USBS..,L.....                          290.1.0        
  35.1            URB    80 00 09 00  00 00 00 00  78 d8 5d b2  f3 7b 00 00  00 00 00 00  00 00 00 00  80 ac 52 57  0c 84 ff ff  BULK/INT XFER                          290.2.0        
  36        4096  OUT    2e 20 20 20  20 20 20 20  20 20 20 10  00 66 01 01  ec 58 ec 58  00 00 02 01  ec 58 03 00  00 00 00 00  .          ..f...X.X.....X......       286.2.0        
  35.1        31  OUT    55 53 42 43  b0 38 9f 50  00 00 00 00  00 00 06 00  00 00 00 00  00 00 00 00  00 00 00 00  00 00 00     USBC.8.P.......................        291.1.0        
  35.1            URB    80 00 09 00  00 00 00 00  78 d8 5d b2  f3 7b 00 00  00 00 00 00  00 00 00 00  f0 49 a6 56  0c 84 ff ff  BULK/INT XFER                          291.2.0        
  35.1        13  IN     55 53 42 53  b0 38 9f 50  00 00 00 00  00                                                               USBS.8.P.....                          292.1.0        
  35.1            URB    80 00 09 00  00 00 00 00  78 d8 5d b2  f3 7b 00 00  00 00 00 00  00 00 00 00  80 ac 52 57  0c 84 ff ff  BULK/INT XFER                          292.2.0        
  36              ok                                                                                                                                                    288.2.0        
  36              CMD    00 00 00 00  00 00                                                                                      TEST UNIT READY                        293.1.0        
  35.1        31  OUT    55 53 42 43  80 b8 4c 50  00 00 00 00  00 00 06 00  00 00 00 00  00 00 00 00  00 00 00 00  00 00 00     USBC..LP.......................        294.1.0        
  35.1            URB    80 00 09 00  00 00 00 00  78 d8 5d b2  f3 7b 00 00  00 00 00 00  00 00 00 00  f0 49 a6 56  0c 84 ff ff  BULK/INT XFER                          294.2.0        
  35.1        13  IN     55 53 42 53  80 b8 4c 50  00 00 00 00  00                                                               USBS..LP.....                          295.1.0        
  35.1            URB    80 00 09 00  00 00 00 00  78 d8 5d b2  f3 7b 00 00  00 00 00 00  00 00 00 00  80 ac 52 57  0c 84 ff ff  BULK/INT XFER                          295.2.0        
  36              ok                                                                                                                                                    293.2.0        
  36              CMD    00 00 00 00  00 00                                                                                      TEST UNIT READY                        296.1.0        
  35.1        31  OUT    55 53 42 43  10 50 4a 4f  00 00 00 00  00 00 06 00  00 00 00 00  00 00 00 00  00 00 00 00  00 00 00     USBC.PJO.......................        297.1.0        
  35.1            URB    80 00 09 00  00 00 00 00  78 d8 5d b2  f3 7b 00 00  00 00 00 00  00 00 00 00  f0 49 a6 56  0c 84 ff ff  BULK/INT XFER                          297.2.0        
  35.1        13  IN     55 53 42 53  10 50 4a 4f  00 00 00 00  00                                                               USBS.PJO.....                          298.1.0        
  35.1            URB    80 00 09 00  00 00 00 00  78 d8 5d b2  f3 7b 00 00  00 00 00 00  00 00 00 00  80 ac 52 57  0c 84 ff ff  BULK/INT XFER                          298.2.0        
  36              ok                                                                                                                                                    296.2.0        
  36              CMD    00 00 00 00  00 00                                                                                      TEST UNIT READY                        299.1.0        
  35.1        31  OUT    55 53 42 43  10 d0 c7 57  00 00 00 00  00 00 06 00  00 00 00 00  00 00 00 00  00 00 00 00  00 00 00     USBC...W.......................        300.1.0        
  35.1            URB    80 00 09 00  00 00 00 00  78 d8 5d b2  f3 7b 00 00  00 00 00 00  00 00 00 00  f0 49 a6 56  0c 84 ff ff  BULK/INT XFER                          300.2.0        
  35.1        13  IN     55 53 42 53  10 d0 c7 57  00 00 00 00  00                                                               USBS...W.....                          301.1.0        
  35.1            URB    80 00 09 00  00 00 00 00  78 d8 5d b2  f3 7b 00 00  00 00 00 00  00 00 00 00  80 ac 52 57  0c 84 ff ff  BULK/INT XFER                          301.2.0        
  36              ok                                                                                                                                                    299.2.0        
  36              CMD    00 00 00 00  00 00                                                                                      TEST UNIT READY                        302.1.0        
  35.1        31  OUT    55 53 42 43  10 50 4a 4f  00 00 00 00  00 00 06 00  00 00 00 00  00 00 00 00  00 00 00 00  00 00 00     USBC.PJO.......................        303.1.0        
  35.1            URB    80 00 09 00  00 00 00 00  78 d8 5d b2  f3 7b 00 00  00 00 00 00  00 00 00 00  f0 49 a6 56  0c 84 ff ff  BULK/INT XFER                          303.2.0        
  35.1        13  IN     55 53 42 53  10 50 4a 4f  00 00 00 00  00                                                               USBS.PJO.....                          304.1.0        
  35.1            URB    80 00 09 00  00 00 00 00  78 d8 5d b2  f3 7b 00 00  00 00 00 00  00 00 00 00  80 ac 52 57  0c 84 ff ff  BULK/INT XFER                          304.2.0        
  36              ok                                                                                                                                                    302.2.0        
  36              CMD    00 00 00 00  00 00                                                                                      TEST UNIT READY                        305.1.0        
  35.1        31  OUT    55 53 42 43  10 b0 ce 53  00 00 00 00  00 00 06 00  00 00 00 00  00 00 00 00  00 00 00 00  00 00 00     USBC...S.......................        306.1.0        
  35.1            URB    80 00 09 00  00 00 00 00  78 d8 5d b2  f3 7b 00 00  00 00 00 00  00 00 00 00  f0 49 a6 56  0c 84 ff ff  BULK/INT XFER                          306.2.0        
  35.1        13  IN     55 53 42 53  10 b0 ce 53  00 00 00 00  00                                                               USBS...S.....                          307.1.0        
  35.1            URB    80 00 09 00  00 00 00 00  78 d8 5d b2  f3 7b 00 00  00 00 00 00  00 00 00 00  80 ac 52 57  0c 84 ff ff  BULK/INT XFER                          307.2.0        
  36              ok                                                                                                                                                    305.2.0        
  36              CMD    00 00 00 00  00 00                                                                                      TEST UNIT READY                        308.1.0        
  35.1        31  OUT    55 53 42 43  f0 78 3d 57  00 00 00 00  00 00 06 00  00 00 00 00  00 00 00 00  00 00 00 00  00 00 00     USBC.x=W.......................        309.1.0        
  35.1            URB    80 00 09 00  00 00 00 00  78 d8 5d b2  f3 7b 00 00  00 00 00 00  00 00 00 00  f0 49 a6 56  0c 84 ff ff  BULK/INT XFER                          309.2.0        
  35.1        13  IN     55 53 42 53  f0 78 3d 57  00 00 00 00  00                                                               USBS.x=W.....                          310.1.0        
  35.1            URB    80 00 09 00  00 00 00 00  78 d8 5d b2  f3 7b 00 00  00 00 00 00  00 00 00 00  80 ac 52 57  0c 84 ff ff  BULK/INT XFER                          310.2.0        
  36              ok                                                                                                                                                    308.2.0        
  36              CMD    00 00 00 00  00 00                                                                                      TEST UNIT READY                        311.1.0        
  35.1        31  OUT    55 53 42 43  80 b8 4c 50  00 00 00 00  00 00 06 00  00 00 00 00  00 00 00 00  00 00 00 00  00 00 00     USBC..LP.......................        312.1.0        
  35.1            URB    80 00 09 00  00 00 00 00  78 d8 5d b2  f3 7b 00 00  00 00 00 00  00 00 00 00  f0 49 a6 56  0c 84 ff ff  BULK/INT XFER                          312.2.0        
  35.1        13  IN     55 53 42 53  80 b8 4c 50  00 00 00 00  00                                                               USBS..LP.....                          313.1.0        
  35.1            URB    80 00 09 00  00 00 00 00  78 d8 5d b2  f3 7b 00 00  00 00 00 00  00 00 00 00  80 ac 52 57  0c 84 ff ff  BULK/INT XFER                          313.2.0        
  36              ok                                                                                                                                                    311.2.0        
  36              CMD    00 00 00 00  00 00                                                                                      TEST UNIT READY                        314.1.0        
  35.1        31  OUT    55 53 42 43  10 50 4a 4f  00 00 00 00  00 00 06 00  00 00 00 00  00 00 00 00  00 00 00 00  00 00 00     USBC.PJO.......................        315.1.0        
  35.1            URB    80 00 09 00  00 00 00 00  78 d8 5d b2  f3 7b 00 00  00 00 00 00  00 00 00 00  f0 49 a6 56  0c 84 ff ff  BULK/INT XFER                          315.2.0        
  35.1        13  IN     55 53 42 53  10 50 4a 4f  00 00 00 00  00                                                               USBS.PJO.....                          316.1.0        
  35.1            URB    80 00 09 00  00 00 00 00  78 d8 5d b2  f3 7b 00 00  00 00 00 00  00 00 00 00  80 ac 52 57  0c 84 ff ff  BULK/INT XFER                          316.2.0        
  36              ok                                                                                                                                                    314.2.0        
  36              CMD    00 00 00 00  00 00                                                                                      TEST UNIT READY                        317.1.0        
  35.1        31  OUT    55 53 42 43  20 e9 be 53  00 00 00 00  00 00 06 00  00 00 00 00  00 00 00 00  00 00 00 00  00 00 00     USBC ..S.......................        318.1.0        
  35.1            URB    80 00 09 00  00 00 00 00  78 d8 5d b2  f3 7b 00 00  00 00 00 00  00 00 00 00  f0 49 a6 56  0c 84 ff ff  BULK/INT XFER                          318.2.0        
  35.1        13  IN     55 53 42 53  20 e9 be 53  00 00 00 00  00                                                               USBS ..S.....                          319.1.0        
  35.1            URB    80 00 09 00  00 00 00 00  78 d8 5d b2  f3 7b 00 00  00 00 00 00  00 00 00 00  80 ac 52 57  0c 84 ff ff  BULK/INT XFER                          319.2.0        
  36              ok                                                                                                                                                    317.2.0        
  36              CMD    28 00 00 00  40 c0 00 00  01 00                                                                         READ                                   320.1.0        
  35.1        31  OUT    55 53 42 43  50 60 84 4f  00 02 00 00  80 00 0a 28  00 00 00 40  c0 00 00 01  00 00 00 00  00 00 00     USBCP`.O.......(...@...........        321.1.0        
  35.1            URB    80 00 09 00  00 00 00 00  78 d8 5d b2  f3 7b 00 00  00 00 00 00  00 00 00 00  f0 49 a6 56  0c 84 ff ff  BULK/INT XFER                          321.2.0        
  35.1       512  IN     7b 00 38 00  34 00 31 00  31 00 45 00  33 00 32 00  30 00 2d 00  39 00 33 00  38 00 37 00  2d 00 34 00  ..8.4.1.1.E.3.2.0.-.9.3.8.7.-.4.       322.1.0        
  35.1            URB    80 00 09 00  00 00 00 00  78 d8 5d b2  f3 7b 00 00  00 00 00 00  00 00 00 00  80 ac 52 57  0c 84 ff ff  BULK/INT XFER                          322.2.0        
  35.1        13  IN     55 53 42 53  50 60 84 4f  00 00 00 00  00                                                               USBSP`.O.....                          323.1.0        
  35.1            URB    80 00 09 00  00 00 00 00  78 d8 5d b2  f3 7b 00 00  00 00 00 00  00 00 00 00  80 ac 52 57  0c 84 ff ff  BULK/INT XFER                          323.2.0        
  36         512  IN     7b 00 38 00  34 00 31 00  31 00 45 00  33 00 32 00  30 00 2d 00  39 00 33 00  38 00 37 00  2d 00 34 00  ..8.4.1.1.E.3.2.0.-.9.3.8.7.-.4.       320.2.0        
  36              CMD    2a 00 00 00  40 40 00 00  08 00                                                                         WRITE                                  324.1.0        
  35.1        31  OUT    55 53 42 43  20 f9 8d 53  00 10 00 00  00 00 0a 2a  00 00 00 40  40 00 00 08  00 00 00 00  00 00 00     USBC ..S.......*...@@..........        325.1.0        
  35.1            URB    80 00 09 00  00 00 00 00  78 d8 5d b2  f3 7b 00 00  00 00 00 00  00 00 00 00  f0 49 a6 56  0c 84 ff ff  BULK/INT XFER                          325.2.0        
  35.1      4096  OUT    2e 20 20 20  20 20 20 20  20 20 20 10  00 66 01 01  ec 58 ec 58  00 00 02 01  ec 58 03 00  00 00 00 00  .          ..f...X.X.....X......       326.1.0        
  35.1            URB    80 00 09 00  00 00 00 00  78 d8 5d b2  f3 7b 00 00  00 00 00 00  00 00 00 00  f0 49 a6 56  0c 84 ff ff  BULK/INT XFER                          326.2.0        
  35.1        13  IN     55 53 42 53  20 f9 8d 53  00 00 00 00  00                                                               USBS ..S.....                          327.1.0        
  35.1            URB    80 00 09 00  00 00 00 00  78 d8 5d b2  f3 7b 00 00  00 00 00 00  00 00 00 00  80 ac 52 57  0c 84 ff ff  BULK/INT XFER                          327.2.0        
  36        4096  OUT    2e 20 20 20  20 20 20 20  20 20 20 10  00 66 01 01  ec 58 ec 58  00 00 02 01  ec 58 03 00  00 00 00 00  .          ..f...X.X.....X......       324.2.0        
  36              CMD    00 00 00 00  00 00                                                                                      TEST UNIT READY                        328.1.0(12)    
  35.1        31  OUT    55 53 42 43  20 e9 be 53  00 00 00 00  00 00 06 00  00 00 00 00  00 00 00 00  00 00 00 00  00 00 00     USBC ..S.......................        329.1.0(12)    
  35.1            URB    80 00 09 00  00 00 00 00  78 d8 5d b2  f3 7b 00 00  00 00 00 00  00 00 00 00  f0 49 a6 56  0c 84 ff ff  BULK/INT XFER                          329.2.0        
  35.1        13  IN     55 53 42 53  20 e9 be 53  00 00 00 00  00                                                               USBS ..S.....                          330.1.0(12)    
  35.1            URB    80 00 09 00  00 00 00 00  78 d8 5d b2  f3 7b 00 00  00 00 00 00  00 00 00 00  80 ac 52 57  0c 84 ff ff  BULK/INT XFER                          330.2.0        
  36              ok                                                                                                                                                    328.2.0        
