Bus Hound 6.00 capture on Windows Vista (x64). Complements of www.perisoft.net

release

  Device - Device ID (followed by the endpoint for USB devices)
            (33) USB Mass Storage Device
            (34) LZN Lroduct [ROM=0.01]
            (35) Unknown USB Device (Device Descriptor Request Failed)
  Length - Total transfer length
  Phase  - Phase Type
            ATA   ATA task file command      RESET bus reset
            CMD   SCSI/ATAPI command         SENSE SCSI sense data
            CTL   USB control transfer       SSTS  SCSI request block status
            IN    Data in transfer           URB   USB request block
            NTSTS NTSTATUS value             USTS  USB status
            OUT   Data out transfer
  Data   - Hex dump of the data transferred
  Descr  - Description of the phase
  Cmd... - Position in the captured data


Device  Length    Phase  Data                                                                                                    Description                       Cmd.Phase.Ofs(rep)
------  --------  -----  ------------------------------------------------------------------------------------------------------  --------------------------------  ------------------
  33.0            USTS   c0010000                                                                                                canceled                               149.2.0        
  33.0            URB    88 00 08 00  00 00 01 c0  08 ea c5 17  f0 57 00 00  00 00 00 0e  49 6f 53 42  b0 86 14 e8  0f a8 ff ff  CONTROL TRANSFER                       149.3.0        
  33.1            USTS   c0000011                                                                                                xact error                               1.1.0        
  33.1            URB    80 00 09 00  11 00 00 c0  08 ea c5 17  f0 57 00 00  00 00 00 00  00 00 00 00  b0 76 24 d2  0f a8 ff ff  BULK/INT XFER                            1.2.0        
  34              SSTS   4e                                                                                                      bus reset                              146.2.0        
  34              SSTS   16                                                                                                      request flushed                        148.2.0        
  34              CMD    28 00 00 00  00 00 00 00  01 00                                                                         READ                                     2.1.0        
  34              SSTS   08                                                                                                      no device                                2.2.0        
  34              CMD    25 00 00 00  00 00 00 00  00 00                                                                         READ CAPACITY                            3.1.0(4)     
  34              SSTS   08                                                                                                      no device                                3.2.0        
  34              CMD    00 00 00 00  00 00                                                                                      TEST UNIT READY                          7.1.0        
  34              SSTS   08                                                                                                      no device                                7.2.0        
  33.0            CTL    80 06 00 01  00 00 12 00                                                                                GET DESCRIPTOR                           8.1.0(2)     
  33.0        18  IN     12 01 00 02  00 00 00 40  83 04 40 57  00 02 01 02  03 01                                               .......@..@W......                       8.2.0        
  33.0            URB    88 00 08 00  00 00 00 00  98 83 ef 1d  f0 57 00 00  00 00 00 00  00 00 00 00  b0 e6 6c e4  0f a8 ff ff  CONTROL TRANSFER                         8.3.0        
  33.0            CTL    80 06 00 02  00 00 09 00                                                                                GET DESCRIPTOR                           9.1.0(2)     
  33.0         9  IN     09 02 20 00  01 01 04 c0  32                                                                            .. .....2                                9.2.0        
  33.0            URB    88 00 08 00  00 00 00 00  98 83 ef 1d  f0 57 00 00  00 00 00 00  00 00 00 00  b0 e6 6c e4  0f a8 ff ff  CONTROL TRANSFER                         9.3.0        
  33.0            CTL    80 06 00 02  00 00 20 00                                                                                GET DESCRIPTOR                          10.1.0(2)     
  33.0        32  IN     09 02 20 00  01 01 04 c0  32 09 04 00  00 02 08 06  50 05 07 05  81 02 40 00  00 07 05 01  02 40 00 00  .. .....2.......P.....@......@..        10.2.0        
  33.0            URB    88 00 08 00  00 00 00 00  98 83 ef 1d  f0 57 00 00  00 00 00 00  00 00 00 00  b0 e6 6c e4  0f a8 ff ff  CONTROL TRANSFER                        10.3.0        
  33.0            CTL    80 06 00 03  00 00 02 00                                                                                GET DESCRIPTOR                          14.1.0        
  33.0         2  IN     04 03                                                                                                   ..                                      14.2.0        
  33.0            URB    88 00 08 00  00 00 00 00  98 83 ef 1d  f0 57 00 00  00 00 00 00  00 00 00 00  b0 e6 6c e4  0f a8 ff ff  CONTROL TRANSFER                        14.3.0        
  33.0            CTL    80 06 00 03  00 00 04 00                                                                                GET DESCRIPTOR                          15.1.0        
  33.0         4  IN     04 03 09 04                                                                                             ....                                    15.2.0        
  33.0            URB    88 00 08 00  00 00 00 00  98 83 ef 1d  f0 57 00 00  00 00 00 00  00 00 00 00  b0 e6 6c e4  0f a8 ff ff  CONTROL TRANSFER                        15.3.0        
  33.0            CTL    80 06 03 03  09 04 02 00                                                                                GET DESCRIPTOR                          16.1.0        
  33.0         2  IN     1a 03                                                                                                   ..                                      16.2.0        
  33.0            URB    88 00 08 00  00 00 00 00  98 83 ef 1d  f0 57 00 00  00 00 00 00  00 00 00 00  b0 e6 6c e4  0f a8 ff ff  CONTROL TRANSFER                        16.3.0        
  33.0            CTL    80 06 03 03  09 04 1a 00                                                                                GET DESCRIPTOR                          17.1.0        
  33.0        26  IN     1a 03 33 00  30 00 36 00  31 00 33 00  36 00 35 00  36 00 33 00  33 00 33 00  30 00                     ..3.0.6.1.3.6.5.6.3.3.3.0.              17.2.0        
  33.0            URB    88 00 08 00  00 00 00 00  98 83 ef 1d  f0 57 00 00  00 00 00 00  00 00 00 00  b0 e6 6c e4  0f a8 ff ff  CONTROL TRANSFER                        17.3.0        
  33.0            CTL    00 09 01 00  00 00 00 00                                                                                SET CONFIG                              18.1.0        
  33.0            URB    70 00 00 00  00 00 00 00  98 83 ef 1d  f0 57 00 00  00 00 00 00  00 00 00 00  a0 32 7e e6  0f a8 ff ff  SELECT CONFIG                           18.2.0        
  33.0            CTL    01 0b 00 00  00 00 00 00                                                                                SET INTERFACE                           19.1.0        
  33.0            URB    68 00 01 00  00 00 00 00  00 00 00 00  00 00 00 00  00 00 00 00  00 00 00 00  40 99 3e e2  0f a8 ff ff  SELECT INTERFACE                        19.2.0        
  33.0            CTL    a1 fe 00 00  00 00 01 00                                                                                GET MAX LUN                             20.1.0        
  33.0         1  IN     00                                                                                                      .                                       20.2.0        
  33.0            URB    88 00 08 00  00 00 00 00  98 83 ef 1d  f0 57 00 00  00 00 00 00  00 00 00 00  b0 e6 6c e4  0f a8 ff ff  CONTROL TRANSFER                        20.3.0        
  33.1        31  OUT    55 53 42 43  60 55 af d2  24 00 00 00  80 00 06 12  00 00 00 24  00 00 00 00  00 00 00 00  00 00 00     USBC`U..$..........$...........         21.1.0(2)     
  33.1            URB    80 00 09 00  00 00 00 00  98 83 ef 1d  f0 57 00 00  00 00 00 00  00 00 00 00  c0 e9 9e e6  0f a8 ff ff  BULK/INT XFER                           21.2.0        
  33.1        36  IN     00 80 02 02  1f 00 00 00  4c 5a 4e 20  20 20 20 20  4c 72 6f 64  75 63 74 20  20 20 20 20  20 20 20 20  ........LZN     Lroduct                 22.1.0(2)     
  33.1            URB    80 00 09 00  00 00 00 00  98 83 ef 1d  f0 57 00 00  00 00 00 00  00 00 00 00  b0 26 1a e8  0f a8 ff ff  BULK/INT XFER                           22.2.0        
  33.1        13  IN     55 53 42 53  60 55 af d2  00 00 00 00  00                                                               USBS`U.......                           23.1.0(2)     
  33.1            URB    80 00 09 00  00 00 00 00  98 83 ef 1d  f0 57 00 00  00 00 00 00  00 00 00 00  b0 26 1a e8  0f a8 ff ff  BULK/INT XFER                           23.2.0        
  33.1        31  OUT    55 53 42 43  60 55 af d2  fc 00 00 00  80 00 0a 23  00 00 00 00  00 00 00 fc  00 00 00 00  00 00 00     USBC`U.........#...............         27.1.0        
  33.1            URB    80 00 09 00  00 00 00 00  98 83 ef 1d  f0 57 00 00  00 00 00 00  00 00 00 00  c0 e9 9e e6  0f a8 ff ff  BULK/INT XFER                           27.2.0        
  33.1        12  IN     00 00 00 08  00 73 7f ff  02 00 02 00                                                                   .....s......                            28.1.0        
  33.1            URB    80 00 09 00  00 00 00 00  98 83 ef 1d  f0 57 00 00  00 00 00 00  00 00 00 00  b0 26 1a e8  0f a8 ff ff  BULK/INT XFER                           28.2.0        
  33.1        13  IN     55 53 42 53  60 55 af d2  f0 00 00 00  00                                                               USBS`U.......                           29.1.0        
  33.1            URB    80 00 09 00  00 00 00 00  98 83 ef 1d  f0 57 00 00  00 00 00 00  00 00 00 00  b0 26 1a e8  0f a8 ff ff  BULK/INT XFER                           29.2.0        
  33.1        31  OUT    55 53 42 43  60 55 af d2  ff 00 00 00  80 00 06 12  01 80 00 ff  00 00 00 00  00 00 00 00  00 00 00     USBC`U.........................         30.1.0        
  33.1            URB    80 00 09 00  00 00 00 00  98 83 ef 1d  f0 57 00 00  00 00 00 00  00 00 00 00  c0 e9 9e e6  0f a8 ff ff  BULK/INT XFER                           30.2.0        
  33.1         8  IN     00 80 00 08  20 20 20 20                                                                                ....                                    31.1.0        
  33.1            URB    80 00 09 00  00 00 00 00  98 83 ef 1d  f0 57 00 00  00 00 00 00  00 00 00 00  b0 26 1a e8  0f a8 ff ff  BULK/INT XFER                           31.2.0        
  33.1        13  IN     55 53 42 53  60 55 af d2  f7 00 00 00  00                                                               USBS`U.......                           32.1.0        
  33.1            URB    80 00 09 00  00 00 00 00  98 83 ef 1d  f0 57 00 00  00 00 00 00  00 00 00 00  b0 26 1a e8  0f a8 ff ff  BULK/INT XFER                           32.2.0        
  34              CMD    12 00 00 00  24 00                                                                                      INQUIRY                                 33.1.0        
  34          36  IN     00 80 02 02  1f 00 00 00  4c 5a 4e 20  20 20 20 20  4c 72 6f 64  75 63 74 20  20 20 20 20  20 20 20 20  ........LZN     Lroduct                 33.2.0        
  34              CMD    25 00 00 00  00 00 00 00  00 00                                                                         READ CAPACITY                           34.1.0        
  33.1        31  OUT    55 53 42 43  50 aa 91 d4  08 00 00 00  80 00 0a 25  00 00 00 00  00 00 00 00  00 00 00 00  00 00 00     USBCP..........%...............         35.1.0        
  33.1            URB    80 00 09 00  00 00 00 00  98 83 ef 1d  f0 57 00 00  00 00 00 00  00 00 00 00  c0 e9 9e e6  0f a8 ff ff  BULK/INT XFER                           35.2.0        
  33.1         8  IN     00 73 7f ff  00 00 02 00                                                                                .s......                                36.1.0        
  33.1            URB    80 00 09 00  00 00 00 00  98 83 ef 1d  f0 57 00 00  00 00 00 00  00 00 00 00  b0 26 1a e8  0f a8 ff ff  BULK/INT XFER                           36.2.0        
  33.1        13  IN     55 53 42 53  50 aa 91 d4  00 00 00 00  00                                                               USBSP........                           37.1.0        
  33.1            URB    80 00 09 00  00 00 00 00  98 83 ef 1d  f0 57 00 00  00 00 00 00  00 00 00 00  b0 26 1a e8  0f a8 ff ff  BULK/INT XFER                           37.2.0        
  34           8  IN     00 73 7f ff  00 00 02 00                                                                                .s......                                34.2.0        
  34              ATA    00 00 00 4f  c2 a0 ec                                                                                   IDENTIFY                                38.1.0        
  34              SSTS   04                                                                                                      check condition                         38.2.0        
  34              CMD    1a 00 1c 00  c0 00                                                                                      MODE SENSE 1C                           39.1.0        
  33.1        31  OUT    55 53 42 43  10 00 cb e4  c0 00 00 00  80 00 06 1a  00 1c 00 c0  00 00 00 00  00 00 00 00  00 00 00     USBC...........................         40.1.0        
  33.1            URB    80 00 09 00  00 00 00 00  98 83 ef 1d  f0 57 00 00  00 00 00 00  00 00 00 00  c0 e9 9e e6  0f a8 ff ff  BULK/INT XFER                           40.2.0        
  33.1        23  IN     22 00 00 00  08 12 00 00  00 00 00 00  00 00 00 00  00 00 00 00  00 00 00                               "......................                 41.1.0        
  33.1            URB    80 00 09 00  00 00 00 00  98 83 ef 1d  f0 57 00 00  00 00 00 00  00 00 00 00  b0 26 1a e8  0f a8 ff ff  BULK/INT XFER                           41.2.0        
  33.1        13  IN     55 53 42 53  10 00 cb e4  a9 00 00 00  00                                                               USBS.........                           42.1.0        
  33.1            URB    80 00 09 00  00 00 00 00  98 83 ef 1d  f0 57 00 00  00 00 00 00  00 00 00 00  b0 26 1a e8  0f a8 ff ff  BULK/INT XFER                           42.2.0        
  34          23  IN     22 00 00 00  08 12 00 00  00 00 00 00  00 00 00 00  00 00 00 00  00 00 00                               "......................                 39.2.0        
  34              SSTS   12                                                                                                      data overrun                            39.3.0        
  34              CMD    12 01 00 00  ff 00                                                                                      INQUIRY                                 43.1.0        
  34          18  SENSE  70 00 05 00  00 00 00 0a  00 00 00 00  24 00 00 00  00 00                                               invalid cdb                             43.2.0        
  34              CMD    1a 00 08 00  c0 00                                                                                      MODE SENSE 08                           44.1.0        
  33.1        31  OUT    55 53 42 43  50 aa 91 d4  c0 00 00 00  80 00 06 1a  00 08 00 c0  00 00 00 00  00 00 00 00  00 00 00     USBCP..........................         45.1.0        
  33.1            URB    80 00 09 00  00 00 00 00  98 83 ef 1d  f0 57 00 00  00 00 00 00  00 00 00 00  c0 e9 9e e6  0f a8 ff ff  BULK/INT XFER                           45.2.0        
  33.1        23  IN     22 00 00 00  08 12 00 00  00 00 00 00  00 00 00 00  00 00 00 00  00 00 00                               "......................                 46.1.0        
  33.1            URB    80 00 09 00  00 00 00 00  98 83 ef 1d  f0 57 00 00  00 00 00 00  00 00 00 00  b0 26 1a e8  0f a8 ff ff  BULK/INT XFER                           46.2.0        
  33.1        13  IN     55 53 42 53  50 aa 91 d4  a9 00 00 00  00                                                               USBSP........                           47.1.0        
  33.1            URB    80 00 09 00  00 00 00 00  98 83 ef 1d  f0 57 00 00  00 00 00 00  00 00 00 00  b0 26 1a e8  0f a8 ff ff  BULK/INT XFER                           47.2.0        
  34          23  IN     22 00 00 00  08 12 00 00  00 00 00 00  00 00 00 00  00 00 00 00  00 00 00                               "......................                 44.2.0        
  34              SSTS   12                                                                                                      data overrun                            44.3.0        
  34              CMD    25 00 00 00  00 00 00 00  00 00                                                                         READ CAPACITY                           48.1.0        
  33.1        31  OUT    55 53 42 43  a0 2a 8b e8  08 00 00 00  80 00 0a 25  00 00 00 00  00 00 00 00  00 00 00 00  00 00 00     USBC.*.........%...............         49.1.0        
  33.1            URB    80 00 09 00  00 00 00 00  98 83 ef 1d  f0 57 00 00  00 00 00 00  00 00 00 00  c0 e9 9e e6  0f a8 ff ff  BULK/INT XFER                           49.2.0        
  33.1         8  IN     00 73 7f ff  00 00 02 00                                                                                .s......                                50.1.0        
  33.1            URB    80 00 09 00  00 00 00 00  98 83 ef 1d  f0 57 00 00  00 00 00 00  00 00 00 00  b0 26 1a e8  0f a8 ff ff  BULK/INT XFER                           50.2.0        
  33.1        13  IN     55 53 42 53  a0 2a 8b e8  00 00 00 00  00                                                               USBS.*.......                           51.1.0        
  33.1            URB    80 00 09 00  00 00 00 00  98 83 ef 1d  f0 57 00 00  00 00 00 00  00 00 00 00  b0 26 1a e8  0f a8 ff ff  BULK/INT XFER                           51.2.0        
  34           8  IN     00 73 7f ff  00 00 02 00                                                                                .s......                                48.2.0        
  34              CMD    12 00 00 00  24 00                                                                                      INQUIRY                                 52.1.0        
  33.1        31  OUT    55 53 42 43  a0 2a 8b e8  24 00 00 00  80 00 06 12  00 00 00 24  00 00 00 00  00 00 00 00  00 00 00     USBC.*..$..........$...........         53.1.0        
  33.1            URB    80 00 09 00  00 00 00 00  98 83 ef 1d  f0 57 00 00  00 00 00 00  00 00 00 00  c0 e9 9e e6  0f a8 ff ff  BULK/INT XFER                           53.2.0        
  33.1        36  IN     00 80 02 02  1f 00 00 00  4c 5a 4e 20  20 20 20 20  4c 72 6f 64  75 63 74 20  20 20 20 20  20 20 20 20  ........LZN     Lroduct                 54.1.0        
  33.1            URB    80 00 09 00  00 00 00 00  98 83 ef 1d  f0 57 00 00  00 00 00 00  00 00 00 00  b0 26 1a e8  0f a8 ff ff  BULK/INT XFER                           54.2.0        
  33.1        13  IN     55 53 42 53  a0 2a 8b e8  00 00 00 00  00                                                               USBS.*.......                           55.1.0        
  33.1            URB    80 00 09 00  00 00 00 00  98 83 ef 1d  f0 57 00 00  00 00 00 00  00 00 00 00  b0 26 1a e8  0f a8 ff ff  BULK/INT XFER                           55.2.0        
  34          36  IN     00 80 02 02  1f 00 00 00  4c 5a 4e 20  20 20 20 20  4c 72 6f 64  75 63 74 20  20 20 20 20  20 20 20 20  ........LZN     Lroduct                 52.2.0        
  34              CMD    9e 10 00 00  00 00 00 00  00 00 00 00  00 20 00 00                                                      SVC ACTION IN                           56.1.0        
  34          18  SENSE  70 00 05 00  00 00 00 0a  00 00 00 00  20 00 00 00  00 00                                               illegal request                         56.2.0        
  34              CMD    25 00 00 00  00 00 00 00  00 00                                                                         READ CAPACITY                           57.1.0        
  33.1        31  OUT    55 53 42 43  e0 65 dc d3  08 00 00 00  80 00 0a 25  00 00 00 00  00 00 00 00  00 00 00 00  00 00 00     USBC.e.........%...............         58.1.0        
  33.1            URB    80 00 09 00  00 00 00 00  98 83 ef 1d  f0 57 00 00  00 00 00 00  00 00 00 00  c0 e9 9e e6  0f a8 ff ff  BULK/INT XFER                           58.2.0        
  33.1         8  IN     00 73 7f ff  00 00 02 00                                                                                .s......                                59.1.0        
  33.1            URB    80 00 09 00  00 00 00 00  98 83 ef 1d  f0 57 00 00  00 00 00 00  00 00 00 00  b0 26 1a e8  0f a8 ff ff  BULK/INT XFER                           59.2.0        
  33.1        13  IN     55 53 42 53  e0 65 dc d3  00 00 00 00  00                                                               USBS.e.......                           60.1.0        
  33.1            URB    80 00 09 00  00 00 00 00  98 83 ef 1d  f0 57 00 00  00 00 00 00  00 00 00 00  b0 26 1a e8  0f a8 ff ff  BULK/INT XFER                           60.2.0        
  34           8  IN     00 73 7f ff  00 00 02 00                                                                                .s......                                57.2.0        
  34              CMD    25 00 00 00  00 00 00 00  00 00                                                                         READ CAPACITY                           61.1.0(2)     
  33.1        31  OUT    55 53 42 43  50 aa 91 d4  08 00 00 00  80 00 0a 25  00 00 00 00  00 00 00 00  00 00 00 00  00 00 00     USBCP..........%...............         62.1.0(2)     
  33.1            URB    80 00 09 00  00 00 00 00  98 83 ef 1d  f0 57 00 00  00 00 00 00  00 00 00 00  c0 e9 9e e6  0f a8 ff ff  BULK/INT XFER                           62.2.0        
  33.1         8  IN     00 73 7f ff  00 00 02 00                                                                                .s......                                63.1.0(2)     
  33.1            URB    80 00 09 00  00 00 00 00  98 83 ef 1d  f0 57 00 00  00 00 00 00  00 00 00 00  b0 26 1a e8  0f a8 ff ff  BULK/INT XFER                           63.2.0        
  33.1        13  IN     55 53 42 53  50 aa 91 d4  00 00 00 00  00                                                               USBSP........                           64.1.0(2)     
  33.1            URB    80 00 09 00  00 00 00 00  98 83 ef 1d  f0 57 00 00  00 00 00 00  00 00 00 00  b0 26 1a e8  0f a8 ff ff  BULK/INT XFER                           64.2.0        
  34           8  IN     00 73 7f ff  00 00 02 00                                                                                .s......                                61.2.0        
  34              CMD    28 00 00 00  00 00 00 00  01 00                                                                         READ                                    69.1.0        
  33.1        31  OUT    55 53 42 43  50 aa 91 d4  00 02 00 00  80 00 0a 28  00 00 00 00  00 00 00 01  00 00 00 00  00 00 00     USBCP..........(...............         70.1.0        
  33.1            URB    80 00 09 00  00 00 00 00  98 83 ef 1d  f0 57 00 00  00 00 00 00  00 00 00 00  c0 e9 9e e6  0f a8 ff ff  BULK/INT XFER                           70.2.0        
  34              CMD    00 00 00 00  00 00                                                                                      TEST UNIT READY                         71.1.0        
  33.0            CTL    80 06 00 02  00 00 09 00                                                                                GET DESCRIPTOR                          72.1.0        
  33.0            USTS   c0010000                                                                                                canceled                                72.2.0        
  33.0            URB    88 00 08 00  00 00 01 c0  98 83 ef 1d  f0 57 00 00  00 00 00 00  00 00 00 00  b0 e6 6c e4  0f a8 ff ff  CONTROL TRANSFER                        72.3.0        
  33.1            URB    80 00 09 00  00 00 01 c0  98 83 ef 1d  f0 57 00 00  00 00 00 00  00 00 00 00  b0 26 1a e8  0f a8 ff ff  BULK/INT XFER                           73.1.0        
  34              SSTS   49                                                                                                      timeout                                 69.2.0        
  34              SSTS   16                                                                                                      request flushed                         71.2.0        
  33              RESET                                                                                                                                                  74.1.0        
  34              CMD    00 00 00 00  00 00                                                                                      TEST UNIT READY                         75.1.0        
  34              CMD    28 00 00 00  00 00 00 00  01 00                                                                         READ                                    76.1.0        
  33              NTSTS  c0000001                                                                                                failed                                  74.2.0        
  34              SSTS   08                                                                                                      no device                               75.2.0        
  34              SSTS   08                                                                                                      no device                               76.2.0        
  34              CMD    28 00 00 00  00 00 00 00  10 00                                                                         READ                                    77.1.0        
  34              SSTS   08                                                                                                      no device                               77.2.0        
  34              CMD    00 00 00 00  00 00                                                                                      TEST UNIT READY                         78.1.0        
  34              SSTS   08                                                                                                      no device                               78.2.0        
  34              CMD    28 00 00 00  00 00 00 00  10 00                                                                         READ                                    79.1.0        
  34              SSTS   08                                                                                                      no device                               79.2.0        
  34              CMD    25 00 00 00  00 00 00 00  00 00                                                                         READ CAPACITY                           80.1.0(4)     
  34              SSTS   08                                                                                                      no device                               80.2.0        
